headline,date
Wall St surges ahead of Fed policy decision; Microsoft shines,01-26-22
" When Cathie Wood Loses, He Wins, and It Started With a Tweet ",01-26-22
" Data Privacy Week: Organizations see strong ROI on privacy spending, says Cisco ",01-26-22
" Goldman, Citi strategists say it's now time to buy after stocks selloff ",01-26-22
" S&P/TSX composite edges higher as crude oil prices rise, U.S. stock markets mixed ",01-26-22
Wall St roars back ahead of Fed policy decision; Microsoft shines,01-26-22
Wall St opens higher ahead of Fed announcement,01-26-22
Israel's NSO Group says in talks with U.S. funds over possible deal,01-26-22
Wall St eyes strong open on Microsoft's outlook; Fed decision looms,01-26-22
Canadian dollar gains as investors eye potential rate hike,01-26-22
Microsoft pledges transparency in Xbox subscriptions in Britain,01-26-22
" U.S. stock futures bounce ahead of Fed, oil gains on Russia-Ukraine ",01-26-22
Nasdaq futures jump 2% after Microsoft's strong forecast; Fed decision looms,01-26-22
Microsoft pledges more clarity over UK Xbox subscriptions - regulator,01-26-22
Bitcoin Well Signs Exclusive Agreement to Offer Bitcoin Services for National Retailer Memory Express,01-26-22
Microsoft agrees to change Xbox auto-renewal practices in Britain,01-26-22
Nasdaq futures jump 2% after Microsoft's strong forecast; Fed decision looms,01-26-22
" Futures, Europe Stocks Rally With All Eyes on Fed: Markets Wrap ",01-26-22
U.S. retail investors kept buying stocks on Fed day -analysts,01-27-22
" Wall St slips as chipmakers, Tesla weigh; Netflix jumps ",01-27-22
Wall Street firms 1% on boost from tech stocks,01-27-22
Why you shouldn't wait until April 30 to file your 2021 taxes,01-27-22
Tech stocks set to push Wall Street higher at open,01-27-22
Dentons Joins IBI Group-Led Smart City Sandbox,01-27-22
Norway Wealth Fund Returns $176 Billion Led by Technology Stocks,01-27-22
Tencent plans to take U.S.-listed streaming firm DouYu private -sources,01-27-22
Hedge fund short sellers take aim at green energy stocks,01-27-22
Retail investors kept buying U.S. stock on Fed day - Vanda,01-27-22
Norway wealth fund earns second-highest return in 2021,01-27-22
Tencent plans to take U.S.-listed streaming firm DouYu private -sources,01-27-22
SAP to buy U.S. fintech Taulia; eyes metaverse opportunities,01-27-22
Japanese stocks suffer biggest weekly foreign outflow in seven weeks,01-27-22
Apple's stock racks up biggest one-day gain since July 2020,01-28-22
Apple's stock racks up biggest one-day gain since July 2020,01-28-22
Troubled U.S. Carbon-Sucking Startup Goes Looking for New CEO,01-28-22
" Apple shares hold up to tech rout on strong results, metaverse tease ",01-28-22
" Data Privacy Day message to companies: Don't just write privacy policies, enforce them ",01-28-22
Apple bucks tech rout to surge this morning on blockbuster earnings,01-28-22
Tencent plans to take U.S.-listed streaming firm DouYu private -sources,01-28-22
EA taps Microsoft executive as new chief financial officer,01-31-22
Sony to buy 'Destiny' videogame developer Bungie in $3.6 bln deal,01-31-22
Electronic Arts Names Chris Suh as Chief Financial Officer,01-31-22
Nasdaq gains avert worst January on record,01-31-22
Sony to buy 'Halo' videogame creator Bungie in $3.6 bln deal,01-31-22
Wall Street swings higher on final day of volatile month,01-31-22
Sony to buy 'Halo' videogame creator Bungie in $3.6 bln deal,01-31-22
Sony to buy video game developer Bungie in $3.6-billion deal,01-31-22
Nasdaq up 2% on final day of volatile month,01-31-22
3 'buying opportunities' from Goldman amid an extended stock market rout,01-31-22
Morgan Stanley says S&P 500 could drop another 10 per cent,01-31-22
Battered Nasdaq climbs at end of volatile month,01-31-22
Posthaste: Home sales set for the second 'most remarkable' year in Canadian real estate history,01-31-22
Magnet Forensics Introduces Magnet AUTOMATE Enterprise to Transform How Organizations Respond to Cybersecurity Incidents and Accelerate Their Recovery,01-31-22
Wall St set to open lower at end of volatile month,01-31-22
Benchmark Corp and Arctiq Inc. amalgamate to offer enterprises an end-to-end Canadian-based cloud and application solutions team to support digital transformation,01-31-22
Nasdaq futures edge higher at end of turbulent month,01-31-22
Enthusiast Gaming Announces Record 51.8 Million Monthly Unique Visitors in the United States,01-31-22
" Red-hot gaming market to breach $150 billion in deals, fundraising - report ",01-31-22
Ladbrokes owner Entain eyes metaverse with new innovation hub,01-31-22
Pearson buys certification group Credly in deal valued at $200m,01-31-22
Cruise to raise $1.35 bln from SoftBank as it readies robotaxis,02-01-22
" Google parent Alphabet's sales top estimates, show strength of ad business ",02-01-22
" Epic Games invests in Spire Animation's funding round, eyes metaverse boom ",02-01-22
Commodities lift S&P/TSX composite to start February after volatile start to year,02-01-22
" Epic Games invests in Spire Animation's funding round, eyes metaverse boom ",02-01-22
" Wall St eases after two-day surge as Tesla, Microsoft slip ",02-01-22
Surfaceink Launches Innovation Lab for Consumer Electronic Product Development,02-01-22
ResMed Welcomes Urvashi Tyagi as New Chief Technology Officer,02-01-22
" MarketWall and Morningstar Launch Morningstar Global Market, a GEMINA-Based Research and Market Data Offering for Enterprise Clients ",02-01-22
Chargebee Raises Another $250M to Meet Surging Demand from Growing Subscription and SaaS businesses,02-01-22
U.S. FTC to review Microsoft's $68.7 bln deal for Activision - Bloomberg News,02-01-22
U.S. FTC to review Microsoft's $68.7 bln deal for Activision - Bloomberg News,02-01-22
U.S. FTC to review Microsoft deal for Activision - Bloomberg News,02-01-22
U.S. FTC to review Microsoft deal for Activision - Bloomberg News,02-01-22
Meta stock is plunging the most ever — five key takeaways from the earnings that caused the rout,02-02-22
" Alphabet stock split may trigger retail buying, Dow inclusion ",02-02-22
Alphabet eyes $2 trillion value after blowout results,02-02-22
" Alphabet latest megacap to split its stock, may trigger retail buying ",02-02-22
" Melinda French Gates no longer plans to give most of wealth to Gates Foundation, WSJ reports ",02-02-22
" Dragoneer, Tiger Global-led funding values Productboard at $1.73 bln ",02-02-22
Alphabet inches closer to $2 trln market value after blowout results,02-02-22
" Melinda French Gates no longer plans to give most of wealth to Gates Foundation, WSJ reports ",02-02-22
$20 a pop for Apple: CDRs open new avenue for Canadians to invest in U.S. stocks,02-02-22
Alphabet inches closer to $2 trln market value after blowout results,02-02-22
Alphabet inches closer to $2 trillion market value after blowout results,02-02-22
Lawyer Bonuses Leaves U.K. M&A Watchdog Battling for Talent,02-02-22
" EU policymakers must do more to boost telco investments, study says ",02-02-22
Big tech should reimburse victims of online scams - British lawmakers,02-02-22
Meta's share price wipe-out shakes world tech stocks,02-03-22
Meta's share price wipe-out shakes world tech stocks,02-03-22
" Amazon hikes Prime membership fees in U.S., profit soars on Rivian stake ",02-03-22
Wall St ends winning run as Facebook forecast halts tech-led recovery,02-03-22
Meta's share price wipe-out shakes world tech stocks,02-03-22
Wall St snaps winning run as Facebook forecast disrupts tech-led recovery,02-03-22
Facebook-owner Meta was popular stock for hedge funds before the slide,02-03-22
" Facebook's forecast frightens Wall St, disrupts tech-led recovery ",02-03-22
" Clutch of hedge funds held Meta shares, may have been punished ",02-03-22
Meta's huge share price drop shakes world tech stocks,02-03-22
Wall St falls as Facebook's forecast disrupts tech recovery,02-03-22
Meta's huge share price drop shakes world tech stocks,02-03-22
EU aims to tighten curbs on data transfers to non-EU governments - EU document,02-03-22
Wall St falls as Facebook's forecast disrupts tech recovery,02-03-22
3 top-ranked dividend stocks for February yielding as high as 8.6%,02-03-22
Alphabet eyes $2 trillion value after blowout results (Feb 2),02-03-22
Wall St futures tumble after Facebook sparks another tech rout,02-03-22
EU aims to tighten curbs on data transfers to non-EU governments - EU document,02-03-22
Wall Street futures fall after Facebook triggers tech sell-off,02-03-22
Growing Corporate Presence in Power Markets Will Boost Clean Energy,02-03-22
Zoho Workplace Touts Consecutive Years of Exceptional Growth and Record Migrations from Competitor Suites,02-03-22
Sony shares slide as gaming concerns re-emerge,02-03-22
Inside J&J's secret plan to cap litigation payouts to cancer victims,02-04-22
Amazon surges with record $190 billion gain in value,02-04-22
Amazon surges with record $190 billion gain in value,02-04-22
Amazon surges with record $190 billion gain in value,02-04-22
" Apple, Broadcom win new trial in $1.1 bln Caltech patent case ",02-04-22
Inside J&J's secret plan to cap litigation payouts to cancer victims,02-04-22
Inside J&J's secret plan to cap litigation payouts to cancer victims,02-04-22
" Tech, growth shares shine in Amazon-led rebound after Meta rout ",02-04-22
Inside J&J's secret plan to cap litigation payouts to cancer victims,02-04-22
" Amazon surges, eyes Wall Street record gain in value ",02-04-22
" Apple, Broadcom win new trial in $1.1 bln Caltech patent case ",02-04-22
Tech stocks edge higher after Meta rout,02-04-22
Global tech stocks stage tentative recovery after Meta rout,02-04-22
S&P futures ease ahead of jobs data; Amazon climbs,02-04-22
" S&P, Nasdaq futures rise on Amazon boost ",02-04-22
Global tech stocks stage tentative recovery after Meta rout,02-04-22
" Despite client shift to 'multicloud', Amazon notches up sunny sales ",02-04-22
Futures bolstered by Amazon results ahead of jobs report,02-04-22
Earnings whiplash points to more volatility for U.S. markets,02-04-22
Why organization tools like Microsoft Excel make remote work possible,02-05-22
Microsoft buying Activision is just the beginning -- what you should know as Big Tech gobbles up gaming,02-06-22
Adtech firm Aleph reveals 85% jump in revenue in IPO filing,02-07-22
" Proactive news headlines including Google, Trust Stamp, NEO Battery Materials, New Pacific Metals, Thor Explorations and ElectraMeccanica ",02-07-22
Wall Street mixed as Amazon gains and Meta weighs,02-07-22
Digital advertising company Aleph's revenue jumps 85% ahead of U.S. IPO,02-07-22
Wall St falls as Facebook extends losses; Peloton shines,02-07-22
Market swings leave high-profile stockpickers wrongfooted,02-07-22
Ethical Hedge Fund Beats 97% of Peers by Dodging Tech Rout,02-07-22
Unreal demand? Irregular sales worth billions fire up wild NFT market,02-07-22
Unreal demand? Irregular sales worth billions fire up wild NFT market,02-07-22
" Wall Street rallies on tech boost, European shares end flat ",02-08-22
Microsoft eyeing deal to buy cybersecurity firm Mandiant -Bloomberg,02-08-22
Wall Street ends higher; bank stocks rise with Treasury yields,02-08-22
Wall Street ends higher; bank stocks rise with Treasury yields,02-08-22
Microsoft considers deal to buy cybersecurity firm Mandiant - Bloomberg News,02-08-22
Wall Street rallies with Big Tech; banks up with Treasury yields,02-08-22
" Wall Street climbs as Apple, bank stocks jump ",02-08-22
Secure IoT Device Updates Using Mender.io and Azure IoT Hub,02-08-22
S&P/TSX composite up more than 100 points despite energy falling on lower oil prices,02-08-22
" Stonebranch Announces Record Growth in 2021, Well Positioned for 2022 ",02-08-22
" D-Wave, a Global Leader in Quantum Computing Systems, Software and Services Announces Plans to Bring Commercial Quantum Computing to Public Markets Via Transaction with DPCM Capital, Inc. ",02-08-22
New ABB study on industrial transformation unveils critical relationship between digitalization and sustainability,02-08-22
" Global stocks rise on strong earnings, tech sector strength ",02-09-22
" Breaking the Rules with Galaxy Tab S8 series: Our Biggest, Boldest, Most Versatile Galaxy Tablets Yet ",02-09-22
" Wall Street ends sharply higher, lifted by Big Tech ",02-09-22
" Wall Street ends sharply higher, lifted by Big Tech ",02-09-22
Stocks rise as investors put aside rate hike fears,02-09-22
Sony's new AI beats humans in Gran Turismo racing game,02-09-22
" Wall Street surges, lifted by Big Tech ",02-09-22
Microsoft unveils new app store guidelines as it woos regulators on deal,02-09-22
" S&P 500, Nasdaq climb over 1% on tech, earnings boost ",02-09-22
Microsoft announces app store principles as it woos regulators on deal,02-09-22
" Wall Street lifted by tech stocks, upbeat earnings ",02-09-22
" New Samsung Galaxy S22 and S22+ Deliver Revolutionary Camera Experiences, Day and Night ",02-09-22
Samsung Galaxy S22 Ultra: The Ultimate Galaxy S Experience,02-09-22
Wall St set to extend gains with Big Tech in the lead,02-09-22
TigerGraph Launches Million-Dollar Challenge to Inspire Innovative Uses of Graph,02-09-22
Futures rise as Big Tech gains ground,02-09-22
Greece's fledgling tech scene starts to take off,02-09-22
Finding Mutual Funds Without Fossil-Fuel Holdings Isn't Easy,02-09-22
" Japan shares end higher on overnight Wall Street gains, strong earnings ",02-09-22
" Asian stocks join global rally, U.S. yields cling to highs ",02-09-22
" Asian stocks track Wall St tech rally, U.S. yields cling to highs ",02-09-22
Japanese shares track Wall Street higher on savvy stock-picking,02-09-22
Wall Street ends down sharply on fears of aggressive Fed rate hikes,02-10-22
Wall Street ends down sharply on fears of aggressive Fed rate hikes,02-10-22
" U.S. inflation data hits global stocks, lifts benchmark yields ",02-10-22
Wall Street falls as hot inflation turns Fed official 'dramatically' hawkish,02-10-22
" Wall St drops over 1% on hotter inflation data, Bullard's hawkish comment ",02-10-22
Wall St slips after stronger-than-expected inflation data,02-10-22
Wall Street loses ground after hot inflation data,02-10-22
Wall Street set to slide after hot CPI data,02-10-22
" S&P 500, Nasdaq futures slip ahead of inflation data ",02-10-22
Data-Driven Leaders Podcast Host Christina O'Reilly Named One of the 10 Most Impactful Women in Technology,02-10-22
" AppDirect Acquires Leading Canadian Cloud Technology Provider, ITCloud.ca ",02-10-22
Wall Street ends down sharply on fears of Ukraine conflict,02-11-22
Wall Street ends down sharply on fears of Ukraine conflict,02-11-22
TANAAKK HITSERIES Now Available in the Microsoft Azure Marketplace,02-11-22
Wall Street struggles for direction as inflation worries linger,02-11-22
Uber CEO Says App Will Eventually Accept Crypto as Payment,02-11-22
Wall Street mixed as inflation worries linger,02-11-22
Wall St set for mild gains after selloff on rate hike fears,02-11-22
Futures point to more losses on Wall Street,02-11-22
Saudi Arabia transfers Aramco shares worth $80 bln to state fund,02-13-22
Saudi Arabia transfers 4% of Aramco shares to sovereign wealth fund,02-13-22
Buffett's Berkshire bought Activision shares before Microsoft takeover,02-14-22
Buffett's Berkshire bought Activision Blizzard before deal,02-14-22
" Buffett's Berkshire buys Activision Blizzard, cuts healthcare positions ",02-14-22
How gold miners lost their mojo,02-14-22
Employers set for a shock as hybrid work makes staff less loyal,02-14-22
Wall Street mixed amid Fed rate hike fears; Ukraine tensions eyed,02-14-22
Wall St eyes lower open on rate fears; Ukraine tensions ease slightly,02-14-22
Futures fall on fears of potential Russian attack on Ukraine,02-14-22
Futures slide on fears of potential Russian attack on Ukraine,02-14-22
Wall St rallies on boost from Big Tech as geopolitical tensions ease,02-15-22
Key EU lawmaker aims for April pact on rules to rein in tech giants,02-15-22
" S&P 500, Nasdaq climb over 1% on signs of easing geopolitical tensions ",02-15-22
Wall St set to bounce on signs of easing Russia-Ukraine tensions,02-15-22
Nasdaq futures jump 2% on signs of easing Russia-Ukraine tensions,02-15-22
Futures jump on signs of easing Russia-Ukraine tensions,02-15-22
Futures jump on signs of easinng Russia-Ukraine tensions,02-15-22
EU to launch probe over use of cloud services by public sector,02-15-22
" Tyson Foods, Massachusetts Loosen Mask Guidance: Virus Update ",02-15-22
Buffett's Berkshire extends board shuffle as Tom Murphy resigns,02-15-22
" Buffett business partner Munger laments U.S.-China tensions, calls crypto 'venereal disease' ",02-16-22
Wall St falls on geopolitical tensions; Fed minutes eyed,02-16-22
NYSE moves closer to NFT trading with trademark application,02-16-22
" Wall Street pulls back on Fed, Ukraine jitters ",02-16-22
Intel CEO Is Tired of Wall Street Doubting His Comeback Plan,02-16-22
" Wall St set to open lower on Fed, Ukraine jitters ",02-16-22
NYSE moves closer to NFT trading with trademark application,02-16-22
Alida Recognized on the 2022 List of Best Workplaces™ for Hybrid Work in Canada,02-16-22
" Futures largely flat ahead of retail sales data, Fed minutes ",02-16-22
Acronym bets like BRICs or FAANGs rarely endure: McGeever,02-16-22
NETSCOUT Launches nGeniusEDGE Server to Quickly Identify and Resolve User Experience Performance Issues,02-16-22
Acronym bets like BRICs or FAANGs rarely endure: McGeever,02-16-22
Solving the hybrid work paradox,02-16-22
Edge Total Intelligence Provides Interim Corporate Update,02-17-22
CDPQ Is Said to Buy Stake in Warburg-Backed Cybersecurity Firm,02-17-22
Wall St set for sharp losses as Ukraine tensions mount,02-17-22
Quisitive Provides Update on Key Business Milestones for 2022,02-17-22
Futures slip on heightening Ukraine tensions,02-17-22
IBM spinoff Kyndryl signs 'beachhead' networking deal with Nokia,02-17-22
Wall Street ends lower as investors eye Ukraine conflict,02-18-22
Meta tells advertisers mixed reality could be a few years away,02-18-22
Secure a lifetime Microsoft Office license for your Windows or Mac,02-18-22
One bad meeting causes three more meetings': Companies are fighting back against meeting bloat,02-18-22
Wall St eyes muted open as Ukraine nerves persist,02-18-22
Futures bounce back on diplomacy hopes to avoid Ukraine conflict,02-18-22
Singapore to hike taxes on rich as it winds down COVID-19 spending,02-18-22
Buffett says Berkshire's Activision purchase was 'no bonanza',02-18-22
HighPoint's Bootable SSD6200 Series Controllers Maximize Server Uptime with Driverless Maintenance & Host NVMe RAID Technology,02-21-22
Saudi Aramco Sees Good Signs Oil Demand's Rising as Shares Hit Record,02-21-22
Procore Announces Fourth Quarter and Full Year 2021 Financial Results,02-22-22
TikTok agrees to $2M settlement of Canadian class-action lawsuit over data collection,02-22-22
" Unprotected federal agencies leave Canada open to cyber attacks, says Parliamentary committee ",02-22-22
" Futures slip as Ukraine war fears, sanctions rattle investors ",02-22-22
" CloudBlue Launches CloudBlue PSA IaaS 360, a New Solution Helping MSPs Streamline Multi-Cloud IaaS Practices ",02-22-22
Cloud Summit '22 in Miami Centered on A Future of Even More,02-22-22
Aptean Expands Food and Beverage ERP Partner Program in North America,02-22-22
Quisitive Appoints Scott Meriwether as Chief Financial Officer,02-22-22
Buchanan Technologies Recognized on CRN's 2022 MSP 500 List,02-22-22
Futures slip in volatile trade as Ukraine tensions mount,02-22-22
Thales Accelerates Digital Transformation of Payment Ecosystem in the Cloud,02-22-22
" Users should be allowed to sue U.S. tech giants under EU rules, civil groups say ",02-22-22
Cologix and CIM Group Announce Joint Venture to Develop TOR4 Scalelogix Data Center,02-23-22
Activision's mobile gaming unit to see leadership changes ahead of Microsoft deal,02-23-22
Saudi Wealth Fund Weighs Plans for $90 Billion Aramco Stake,02-23-22
SEGA of America & Paramount Pictures Partner With JAKKS Pacific & Disguise to Unveil New Toys and Costumes for Sonic the Hedgehog 2,02-23-22
" EU's Vestager says tech giants may prefer fines to compliance, cites Apple ",02-23-22
Wall St set to open higher after modest Western sanctions on Russia,02-23-22
FortiGuard Labs Reports Ransomware Not Slowing; Continues to be Relentless and More Destructive,02-23-22
Posthaste: Toronto area home prices have skyrocketed 453% since 1996,02-23-22
LOKI Systems Announces Turnkey Tool for Migration of Historical Payroll Data when Implementing Advanced Payroll for Microsoft Dynamics 365,02-23-22
Aventus Network and Scytale Ventures partner to accelerate integration with Polkadot,02-23-22
Futures rebound after less harsh Western sanctions on Russia,02-23-22
EU rules take aim at illegal data transfer to non-EU governments,02-23-22
EU rules take aim at illegal data transfer to non-EU governments,02-23-22
" EU's Vestager says tech giants may prefer fines to compliance, cites Apple ",02-23-22
" Hedge Funds Slash Tech in Pivot to Other Strategies, Goldman Report Says  ",02-23-22
AMD Announces New $8 Billion Share Repurchase Authorization,02-24-22
Wall Street slides as Russia attacks Ukraine,02-24-22
15 years of leveraging technology to drive diversity and inclusion,02-24-22
NP Digital Expands in Canada with Ronnie Malewski as Managing Director,02-24-22
Buffett's Dealmaking Slump Forces a New Reality on Berkshire,02-24-22
Futures slip as investors fret over Ukraine crisis,02-25-22
New Samsung Galaxy S22 series and Galaxy Tab S8 series now available in Canada,02-25-22
New Galaxy Book2 Pro Series Enables Work-On-the-Go Flexibility with Peace-of-Mind Security,02-27-22
" Buffett Touts Berkshire's Infrastructure Might, Growth Plan ",02-27-22
Ukraine calls for no-fly zone to stop Russian bombardment,02-28-22
Russia pounds Ukraine's second biggest city as fighting rages on,02-28-22
" Facebook owner Meta will block access to Russia's RT, Sputnik in EU ",02-28-22
Western companies head for the exit in Russia as sanctions tighten,02-28-22
Western companies head for the exit in Russia as sanctions tighten,02-28-22
Russian artillery pounds Ukraine's Kharkiv as ceasefire talks end with no breakthrough,02-28-22
" Microsoft to remove RT apps, ban Russian state-owned media ads ",02-28-22
U.S. stock futures are tumbling this morning after 'terrible weekend' kicks off more volatility,02-28-22
Futures slide as West ratchets up sanctions against Russia,02-28-22
Lenovo Unveils Products and Solutions Designed to Power a Hybrid World at MWC '22,02-28-22
" After decades in a spin, Sonic's break-out leaves Sega hoping for more ",02-28-22
Canadian healthcare provider's unpatched Exchange server exploited twice by ransomware gangs,03-01-22
" Digital Construction Works Powers Up its Integrations Platform Insights with New Certified Microsoft Power BI Connector, the First in the Marketplace for Construction Projects ",03-01-22
Winners Announced in 16th Annual Stevie® Awards for Sales & Customer Service,03-01-22
OTC Markets Group Welcomes Bango PLC to OTCQX,03-01-22
" Ukraine to seek action against Russia from about 50 gaming, cloud and other tech firms ",03-02-22
" Ukraine to seek action against Russia from about 50 gaming, cloud and other tech firms ",03-02-22
Global brands exit Russia over Ukraine invasion,03-02-22
Wall St rallies over 1% as Powell says rate hikes on track,03-02-22
monday.com Announces Strategic Alliance with KPMG,03-02-22
Successful phishing attacks were up in 2021: Report,03-02-22
Motorsport Games warns of impact from Russia sanctions,03-02-22
Adastra Corp. Expands Its Industry-Leading Global Data & Analytics Consulting Operations into Southeastern US,03-02-22
D2L Expands Collaboration and Community in Brightspace,03-02-22
" Cyber Acoustics for Healthcare: Innovative, Reliable, Sustainable Technology Solutions for Patients, Providers, and Administrators ",03-02-22
" Boeing, Exxon, Apple join Western firms spurning Russia over Ukraine ",03-02-22
" Boeing, Exxon, Apple join Western firms spurning Russia over Ukraine ",03-02-22
" Apple, Ford, other big US brands join corporate wave shunning Russia ",03-02-22
" Wall Street mixed as growth stocks, Ukraine jitters weigh ",03-03-22
Growth stocks drag Wall St lower on inflation worries,03-03-22
" Wall Street eyes higher open as banks, megacaps rise ",03-03-22
Russia's Gas Giant Shunned by European Traders -- and Its Landlord,03-03-22
Ukraine and Russia: What you need to know right now,03-04-22
Russia seizes Europe's biggest nuclear plant and blocks media websites,03-04-22
Wall St Week Ahead-Rate-hike fears abate but Ukraine muddies stock market outlook,03-04-22
" Russia blocks Facebook, passes 'fake news' law; LVMH, Microsoft halt sales ",03-04-22
Russia seizes Europe's biggest nuclear plant and blocks media websites,03-04-22
Wall Street ends down as Ukraine fears eclipse solid jobs data,03-04-22
Wall Street ends down as Ukraine fears eclipse solid jobs data,03-04-22
Ukraine and Russia: What you need to know right now,03-04-22
" Russia blocks Facebook, passes 'fake news' law; Microsoft, EA halt sales ",03-04-22
Wall Street falls as Ukraine fears eclipse solid jobs data,03-04-22
Ukraine and Russia: What you need to know right now,03-04-22
The consequences of remote work: Suddenly we're a lot more 'tribal' at the office,03-04-22
Ukraine and Russia: What you need to know right now,03-04-22
Ukraine and Russia: What you need to know right now,03-04-22
Wall Street drops as Ukraine worries eclipse strong jobs data,03-04-22
Ukraine and Russia: What you need to know right now,03-04-22
