headline,date
Tech giants grilled for hours over allegations of anti-competitive behaviour,07-29-20
DIRTT Releases Q2 2020 Financial Results Announces Additions to Board of Directors,07-29-20
" Jeff Bezos, Mark Zuckerberg and Elon Musk have made $115 billion this year ",07-29-20
Facedrive Launches TraceSCAN Wearables Pilot Project in Partnership with Labourers' International Union of North America (LiUNA),07-29-20
Big Tech to tangle with Washington lawmakers in antitrust showdown,07-29-20
Rare pause in tech appetite suggests some indigestion: Mike Dolan,07-29-20
Tech leads stock rebound from lows before earnings,07-30-20
Big Tech results move center stage after Congressional bruising,07-30-20
Epiq Recognized as the Winner of the Top US Microsoft Compliance Partner for the 2020 Microsoft US Modern Work and Security Partner Awards,07-30-20
Big Tech results move center stage after Congressional bruising,07-30-20
Amazon Junior' Throws Weight Around on Canada's Stock Market,07-31-20
Microsoft weighs TikTok purchase as ad business flattens out,07-31-20
Nasdaq surges on megacap earnings but U.S. fiscal uncertainty nags,07-31-20
Nasdaq surges on megacap earnings but U.S. fiscal uncertainty nags,07-31-20
" Stocks advance on tech rally, stimulus talks ",07-31-20
Nasdaq surges on megacap earnings but fiscal uncertainty lingers,07-31-20
Nasdaq surges on megacap earnings but fiscal uncertainty lingers,07-31-20
Four easy ways to increase your work-from-home productivity,07-31-20
Microsoft in talks to buy TikTok - NYT,07-31-20
Apple Tops Saudi Aramco as World's Most Valuable Company,07-31-20
William Watson: Third time lucky for committees,07-31-20
TikTok's Chinese owner offers to forego stake to clinch U.S. deal-sources,08-01-20
TikTok's Chinese owner offers to forego stake to clinch U.S. deal-sources,08-01-20
TikTok's Chinese owner offers to forego stake to clinch U.S. deal-sources,08-01-20
Microsoft in talks to buy TikTok - NYT,08-01-20
ByteDance offers to forgo stake in TikTok to clinch U.S. deal-sources,08-01-20
Trump says will ban TikTok amid pressure on Chinese owner to sell,08-01-20
Trump to give TikTok's Chinese owner 45 days to reach deal to sell-sources,08-02-20
Microsoft to continue talks to buy TikTok from ByteDance,08-02-20
Republican senators back plan to sell TikTok's U.S. operations,08-02-20
Republican senators back plan to sell TikTok's U.S. operations,08-02-20
TikTok's Chinese owner offers to forego stake to clinch U.S. deal-sources,08-02-20
Trump: U.S. should get 'substantial portion' of TikTok operations sale price,08-03-20
" Asia shares set to gain after manufacturing data, tech stocks boost ",08-03-20
Trump says China or Microsoft should pay U.S. a share of any TikTok sale proceeds,08-03-20
" Dollar, equities gain on upbeat data, Microsoft ",08-03-20
Nasdaq hits record high close as traders eye M&A and stimulus,08-03-20
Nasdaq ends at record high as traders eye M&A and stimulus,08-03-20
Trump: U.S. should get 'substantial portion' of TikTok operations sale price,08-03-20
" Dollar, equities gain on upbeat manufacturing data ",08-03-20
Wall St jumps as traders eye M&A and stimulus,08-03-20
" Microsoft, Apple lift Wall St as investors await stimulus ",08-03-20
" Microsoft, Apple lift Wall St as investors await stimulus ",08-03-20
Trump: U.S. should get 'substantial portion' of TikTok operations sale price,08-03-20
" Earnings, Microsoft boost Wall St as investors await stimulus ",08-03-20
" Earnings, Microsoft boost Wall St as investors await stimulus ",08-03-20
" Earnings, Microsoft set to boost Wall St as investors await stimulus ",08-03-20
" Earnings, Microsoft set to boost Wall St as investors await stimulus ",08-03-20
Trump gives Microsoft 45 days to clinch TikTok deal,08-03-20
Trump says he does not mind if Microsoft buys TikTok,08-03-20
" Microsoft, Apple lift Wall St as investors await stimulus ",08-03-20
" Microsoft, Apple lift Wall St as investors await stimulus ",08-03-20
Trump vows TikTok ban if no U.S. sale deal reached by Sept. 15,08-03-20
" Trump Says TikTok Must Sell U.S. Arm by Sept. 15, or Close ",08-03-20
Trump says he does not mind if Microsoft buys TikTok,08-03-20
" China's ByteDance to consider international HQ for TikTok, outside U.S. ",08-03-20
" U.S. manufacturing activity near 1-1/2-year high, factory job losses persist ",08-03-20
Lawmakers welcome TikTok U.S. sale as White House adviser raises concerns,08-03-20
" Microsoft, Apple lift Wall St as investors await stimulus ",08-03-20
" Microsoft, Apple lift Wall St as investors await stimulus ",08-03-20
" Dollar, equities gain on upbeat manufacturing data ",08-03-20
Schumer backs TikTok U.S. operations sale,08-03-20
U.S. manufacturing activity near 1-1/2-year high; construction spending extends drop,08-03-20
UK says TikTok locating HQ in London would be a commercial decision,08-03-20
" Earnings, Microsoft boost Wall St as investors await stimulus ",08-03-20
" Earnings, Microsoft boost Wall St as investors await stimulus ",08-03-20
White House adviser Navarro suggests Microsoft divest China holdings,08-03-20
White House adviser Navarro questions Microsoft's China ties amid TikTok discussions,08-03-20
Europe Resists TikTok Ban as U.S. Advances China Tech Crackdown,08-03-20
Tech sector drives U.S. markets higher after best four months in a decade,08-03-20
" Earnings, Microsoft boost Wall St as investors await stimulus ",08-03-20
" Earnings, Microsoft boost Wall St as investors await stimulus ",08-03-20
" Earnings, Microsoft set to boost Wall St as investors await stimulus ",08-03-20
" Earnings, Microsoft set to boost Wall St as investors await stimulus ",08-03-20
" Stimulus gridlock strains S&P 500, Dow futures ",08-03-20
" Stimulus gridlock strains S&P 500, Dow futures ",08-03-20
Microsoft nears big bet on TikTok after risky LinkedIn deal shows promise,08-03-20
TikTok Could Become Microsoft's Deal of the Decade,08-03-20
Trump gives Microsoft 45 days to clinch TikTok deal,08-03-20
" Yuan holds steady after posting best month in nine, market monitors TikTok developments ",08-03-20
Trump to give TikTok's Chinese owner 45 days to agree sale -sources,08-03-20
Trump to give TikTok's Chinese owner 45 days to agree sale -sources,08-03-20
TikTok owner ByteDance accuses Facebook of 'plagiarism and smears',08-03-20
ByteDance says faces 'complex and unimaginable difficulties',08-03-20
Trump to give TikTok's Chinese owner 45 days to reach deal to sell-sources,08-03-20
" Microsoft Tries to Salvage Deal to Buy TikTok, Appease Trump ",08-03-20
Australian PM says no evidence to suggest TikTok should be banned,08-04-20
White House says unclear whether U.S. govt will get cut of TikTok sale,08-04-20
Trump's bid for a piece of Microsoft-TikTok deal could spur legal action,08-04-20
" China, U.S. to review trade deal, air other grievances on Aug. 15 - sources ",08-04-20
TikTok's Price Is a Giant Question Mark in Already Complex Deal,08-04-20
" U.S., China Plan to Review Phase-One Trade Deal Mid-Month ",08-04-20
Wall St ends higher as investors eye stimulus,08-04-20
Wall St ends higher as investors eye stimulus,08-04-20
S&P 500 ends higher as investors eye stimulus,08-04-20
Microsoft joins OpenSSF to improve open-source software security,08-04-20
White House says unclear whether U.S. gov't will get cut of TikTok sale,08-04-20
Wall St mixed as investors eye stimulus,08-04-20
" S&P 500, Dow drift higher as investors eye stimulus ",08-04-20
Does it make sense for Microsoft to buy TikTok's U.S. arm?,08-04-20
" S&P 500, Dow grind higher with stimulus in focus ",08-04-20
Apple says it has no interest in buying TikTok,08-04-20
" Escalating Sino-U.S. tensions strain S&P 500, Dow ",08-04-20
Tech titans in the hot seat as tactics likened to railway cartels of old,08-04-20
Wall St set to dip as U.S.-China tensions heat up over TikTok,08-04-20
HiWire™ Consortium Publishes First Active Electrical Cable (AEC) Specification,08-04-20
ByteDance founder defends TikTok's U.S. strategy in staff letter,08-04-20
World shares hit five-month high; mixed earnings knock European shares,08-04-20
Futures retreat as U.S.-China tensions heat up over TikTok,08-04-20
Why Markets Don't Seem to Care If the Economy Stinks,08-04-20
ByteDance founder defends TikTok's U.S. strategy in staff letter,08-04-20
Trump’s TikTok assault opens new front in tech war with China,08-04-20
Microsoft's rescue attempt of TikTok endears old company to new generation,08-04-20
" World shares hit five-month high; European shares, dollar falter ",08-04-20
China stocks end higher as banks rally,08-04-20
" Asia shares supported by upbeat U.S. manufacturing, but virus woes cap gains ",08-04-20
Asia shares rise as U.S. manufacturing perks up,08-04-20
China stocks firm as banks lend support; Hong Kong up,08-04-20
White House adviser Navarro suggests Microsoft divest China holdings,08-04-20
Asia stocks rise as upbeat factory data lifts confidence,08-04-20
China will not accept US 'theft' of TikTok - China Daily,08-04-20
" Trump Seeks TikTok Payment to U.S., Despite No Clear Authority ",08-04-20
U.S. steps up campaign to purge 'untrusted' Chinese apps,08-05-20
U.S. wants to see 'untrusted' Chinese apps removed from app stores - Pompeo,08-05-20
Facebook launches TikTok-like product inside Instagram,08-05-20
" Samsung launches new Note, foldable phone as pandemic shrinks market ",08-05-20
TikTok takes steps to curb misinformation ahead of U.S. election,08-05-20
IZEA Announces BrandGraph® Pulse Integration with Microsoft Teams®,08-05-20
White House unveils partnership to boost quantum science education,08-05-20
TikTok takes steps to curb misinformation ahead of U.S. elections,08-05-20
Samsung launches pricey new Note as pandemic shrinks smartphone market,08-05-20
White House unveils new partnership to boost quantum science education,08-05-20
White House unveils new partnership to boost quantum science education,08-05-20
Food-X Technologies Receives Additional Funding to Enhance eGrocery Management Solution for Retailers,08-05-20
" Posthaste: Five months in, the pandemic has triggered a collective mental health crisis in Canada ",08-05-20
Trump's Bid to Force TikTok Sale Follows Well-Trod Legal Path,08-05-20
Global E-Commerce Company Leverages 3CLogic with ServiceNow to Optimize Customer Experience,08-05-20
TikTok's journey from global sensation to Trump target,08-05-20
" China, U.S. to review trade deal, air other grievances on Aug 15 -sources ",08-05-20
" China, U.S. to review trade deal, air other grievances on Aug 15 -sources ",08-05-20
U.S. Senate votes to ban TikTok app on government devices,08-06-20
" TransAtlantic Petroleum Announces that it will Release Second Quarter 2020 Financial Results on Wednesday, August 12, 2020 Earnings conference call scheduled for Thursday, August 13, 2020 at 7:30 a.m. Central time ",08-06-20
" Microsoft expands TikTok takeover ambitions to entire global business, sources say ",08-06-20
U.S. Senate votes to ban TikTok app on government devices,08-06-20
U.S. Senate bans TikTok app on government devices,08-06-20
U.S. Senate bans TikTok on government devices,08-06-20
" Microsoft's TikTok Talks Said to Stay Focused on U.S., 3 Nations ",08-06-20
Microsoft aiming to buy TikTok's entire global business - FT,08-06-20
Microsoft expands TikTok takeover ambitions to entire global business - FT,08-06-20
Microsoft expands TikTok takeover ambitions to entire global business - FT,08-06-20
" ITWC Morning Briefing, August 6, 2020 – Talking exposure notification apps with Sophos' Chester Wisniewski ",08-06-20
TikTok to open first European data center in Ireland,08-06-20
TikTok to open first European data center in Ireland,08-06-20
U.S. steps up campaign to purge 'untrusted' Chinese apps,08-06-20
WeChat U.S. ban cuts off users link to families in China,08-07-20
" Slowing job growth, stimulus worries weigh on Nasdaq ",08-07-20
" Slowing job growth, stimulus worries weigh on Nasdaq ",08-07-20
" Slowing job growth, stimulus worries weigh on Nasdaq ",08-07-20
" Slowing job growth, stimulus worries weigh on Nasdaq ",08-07-20
Slowing job growth weighs on Wall St; new stimulus eyed,08-07-20
Slowing job growth weighs on Wall St; new stimulus eyed,08-07-20
Slowing job growth weighs on Wall St as focus turns to stimulus,08-07-20
Slowing job growth weighs on Wall St as focus turns to stimulus,08-07-20
" Wall St retreats on slowing jobs growth, U.S.-China friction ",08-07-20
" Wall St retreats on slowing jobs growth, U.S.-China friction ",08-07-20
" Wall St dips on slowing job growth, U.S.-China tensions ",08-07-20
" Wall St dips on slowing job growth, U.S.-China tensions ",08-07-20
" Wall St set to dip on slowing job growth, U.S.-China tensions ",08-07-20
" Wall St set to dip on slowing job growth, U.S.-China tensions ",08-07-20
Sino-U.S. tensions hit futures ahead of jobs report,08-07-20
Sino-U.S. tensions hit futures ahead of jobs report,08-07-20
" Winter Coats, Apocalyptic Vibes Greet Workers Returning to Deserted Offices ",08-07-20
" Trump preps bans on WeChat, TikTok, stoking tension with Beijing ",08-07-20
" Trump preps bans on WeChat, TikTok, stoking tension with Beijing ",08-07-20
" Trump preps bans on WeChat, TikTok, stoking tension with Beijing ",08-07-20
Shares falter after Trump takes aim at China tech firms,08-07-20
Shares tumble after Trump takes aim at China tech firms,08-07-20
" Trump issues bans on China's TikTok, WeChat, stoking tension with Beijing ",08-07-20
China warns Japan a TikTok ban would affect relations - TBS,08-07-20
" Trump imposes U.S. ban on WeChat, TikTok in 45 days ",08-07-20
" Trump issues orders for U.S. ban on WeChat, TikTok in 45 days ",08-07-20
" Twitter, TikTok held preliminary talks about potential combination - WSJ ",08-08-20
Latin America Infrastructure Woes Add to Inequality,08-08-20
U.S.-China Tensions Halt Rally in Emerging Market Currencies,08-09-20
Twitter expressed interest in buying TikTok's U.S. operations - sources,08-09-20
" S&P 500 ends up slightly, tech-related shares underperform value ",08-10-20
" S&P 500 ends up slightly, tech-related shares underperform value ",08-10-20
" S&P 500 ends up slightly, tech-related shares underperform value ",08-10-20
" S&P 500 end up slightly, tech-related shares underperform value ",08-10-20
" S&P 500 end up slightly, tech-related shares underperform value ",08-10-20
WeChat Users in the U.S. Fear Losing Family Links With Ban,08-10-20
Absolute Reports Fiscal 2020 Fourth Quarter and Annual Financial Results,08-10-20
The how and why of a potential TikTok sale to Microsoft,08-10-20
" Dow, S&P 500 up; tech-related shares underperform value ",08-10-20
" Dow, S&P 500 up; tech-related shares underperform value ",08-10-20
" Spies, lies and dormant ties: How to use and abuse LinkedIn ",08-10-20
Active Managers Had Worst Stumble in Two Years Last Month,08-10-20
Wall St mixed with stimulus in focus; Dow hits over 5-month high,08-10-20
Wall St mixed with stimulus in focus; Dow hits over 5-month high,08-10-20
Biotech company CureVac aims to raise up to $245 mln in U.S. IPO,08-10-20
Wall St mixed with stimulus in focus; Dow hits over 5-mth high,08-10-20
Wall St mixed with stimulus in focus; Dow hits over 5-mth high,08-10-20
Tech giants back legal challenge to Trump's foreign worker restrictions,08-10-20
Ingram Micro Cloud Appoints Victor Baez as Vice President of Global Cloud Channel Sales and Rony Lerner as Vice President of Engineering,08-10-20
Microsoft faces complex technical challenges in TikTok carveout,08-10-20
CureVac aims to raise up to $245 mln in U.S. IPO,08-10-20
Microsoft's TikTok bid spotlights Windows maker's history with China,08-10-20
Microsoft faces complex technical challenges in TikTok carveout,08-10-20
Microsoft's TikTok bid spotlights Windows maker's history with China,08-10-20
Enthusiast Gaming Reports Strong Second Quarter 2020 Financial Results with Increase in Direct Sales and Subscriptions,08-11-20
" S&P 500, Dow snap 7-day winning streak as concern mounts over stimulus deal ",08-11-20
TikTok Seeks More Lobbyists as Trump Ban Aims to Force U.S. Sale,08-11-20
French privacy watchdog opens investigation into TikTok,08-11-20
" SurveyMonkey Launches Tech Partner Program Over 100 companies including Salesforce, Microsoft, Zendesk, HubSpot, MailChimp, Constant Contact, Gainsight, and Freshworks integrate with SurveyMonkey to help customers turn critical feedback into action ",08-11-20
French privacy watchdog opens preliminary investigation into TikTok,08-11-20
French privacy watchdog opens preliminary investigation into TikTok,08-11-20
Big U.S. companies form group to boost hiring of minorities in New York,08-11-20
" TikTok Faces French Data Probe, Adding to EU-Wide Scrutiny ",08-11-20
" Facebook, Snap held talks to buy TikTok rival Dubsmash- Information ",08-12-20
TransAtlantic Petroleum Announces Second Quarter 2020 Financial Results and Provides an Operations Update,08-12-20
S&P 500 finishes within points of record high close,08-12-20
S&P 500 finishes within points of record high close,08-12-20
" BitAngels Sports Blockchain Virtual Conference - August 19th, 2020 NFL Player, Super Bowl Champion, Microsoft NFL Honors Finalist and Sports Tech Company Founder Najee Goode Highlights the Sports Blockchain Virtual Conference ",08-12-20
S&P 500 finishes within points of record high close,08-12-20
S&P 500 finishes within points of record high close,08-12-20
To Brink and Back in 175 Days: S&P 500 Briefly Tops Record Close,08-12-20
S&P 500 trades above closing record high level,08-12-20
S&P 500 trades above closing record high level,08-12-20
" S&P 500 jumps more than 1%, again close to record high ",08-12-20
" S&P 500 jumps more than 1%, again close to record high ",08-12-20
Tech stocks boost S&P 500 closer to record high,08-12-20
S&P 500 inches toward record high on tech boost,08-12-20
S&P 500 inches toward record high on tech boost,08-12-20
Meeting the challenges of remote working during the pandemic,08-12-20
Where Canada stands in the global race for a COVID-19 vaccine,08-12-20
" Microsoft prices its dual-screen Android phone at $1,399, will arrive Sept 10 ",08-12-20
These successful retail investors reveal the six things you’re doing wrong when buying stocks on your own,08-12-20
Thales Expands Technology Partner Ecosystem to Accelerate Enterprises' Cloud and Digital Transformation Initiatives,08-12-20
Pandemic delivers first crisis lessons to Southeast Asia's Grab,08-13-20
Canadian firm among those targeted by corporate espionage group: Report,08-13-20
Japan Has Plenty of Reasons to Clean Up Its Power Sector,08-13-20
Pandemic delivers first crisis lessons to Southeast Asia's Grab,08-13-20
Learn to become the Microsoft Excel expert in your office with this training bundle,08-13-20
ByteDance in talks with India's Reliance for investment in TikTok - TechCrunch,08-13-20
Brazilian gaming company reaches $3 bln valuation with new investment,08-14-20
Big U.S. funds gorged on tech stocks and gold in second quarter - 13F filings,08-14-20
Coronavirus vaccine developer CureVac shares surge in U.S. debut,08-14-20
Coronavirus vaccine developer CureVac shares surge 175% in Nasdaq debut,08-14-20
CureVac in talks with pharma companies about partnership - Sueddeutsche,08-14-20
Coronavirus vaccine developer CureVac raises $213.3 mln in U.S. IPO,08-14-20
Trump orders ByteDance to divest interest in U.S. TikTok operations within 90 days,08-15-20
" In lawsuit, 'Fortnite' maker to test idea of iPhone as market unto itself ",08-15-20
Trump orders ByteDance to divest interest in U.S. TikTok operations within 90 days,08-15-20
" Microsoft Weighs Buying TikTok's U.K. Services Too, Fox Reports ",08-16-20
" TikTok Starts Website to Take on Rumors, Misinformation ",08-17-20
TikTok's journey from global sensation to Trump target,08-17-20
Moscow Exchange to offer trading in U.S. blue chips from Aug. 24,08-17-20
" SoftBank builds $1.2 bln Amazon stake; invests in Netflix, Tesla ",08-17-20
Russian Billionaire Invests in VR Parties Startup,08-17-20
Amazon in talks to invest in cloud services company Rackspace -sources,08-17-20
Amazon in talks to invest in cloud services company Rackspace — sources,08-17-20
Amazon in talks to invest in cloud services company Rackspace -sources,08-17-20
TikTok signs music distribution deal with UnitedMasters,08-17-20
CloudBlue Powers SB C&S Cloud Distribution,08-17-20
" NexTech AR Now Scaling AR E-Commerce Business With Major Brand Expansion Launches New Distribution Deals with Well Known Consumer Brands, Including:  Dyson, Philips Norelco, MR. Coffee, VitaMix, Breville and Cuisinart ",08-17-20
Oracle's Improbable TikTok Talks Have a Simple Explanation: Data,08-18-20
" Oracle joins bid for TikTok's U.S. operations, sources say ",08-18-20
S&P 500 record close relegates COVID-19 sell-off to history books,08-18-20
S&P 500 record close relegates COVID-19 sell-off to history books,08-18-20
Oracle and TikTok? That's Just Weird,08-18-20
Detached from reality? Why U.S. stocks just hit a new high,08-18-20
" Oracle joins bid for TikTok's U.S. operations, sources say ",08-18-20
" Oracle joins bid for TikTok's U.S. operations, sources say ",08-18-20
" S&P 500 just hit an all-time high, wiping out pandemic losses ",08-18-20
Detached from reality? Why U.S. stocks just hit a new high,08-18-20
" S&P 500 completes recovery from COVID-19 sell-off, hits record high ",08-18-20
" S&P 500 completes recovery from COVID-19 sell-off, hits record high ",08-18-20
Tech-fueled 'everything's awesome' rally looks unstoppable,08-18-20
Ingram Micro and Veritas Extend Successful Relationship to the Ingram Micro Cloud Marketplace,08-18-20
Attabotics Raises $50M USD to Bring Efficiency and Scale to Supply Chains,08-18-20
Facedrive Health Launches BLE Connect App on Google Play Store and Apple Store to Pair with TraceSCAN Wearable Technology,08-18-20
Givex Joins LOT Network to Protect Clients from Patent Trolls,08-18-20
Oracle enters race to buy TikTok's U.S. operations - FT,08-18-20
Oracle enters race to buy TikTok's U.S. operations - FT,08-18-20
Oracle Said to be Weighing Bid for TikTok's U.S. Business,08-18-20
Oracle enters race to buy TikTok's U.S. operations - FT,08-18-20
Unusual for U.S. Treasury to get a cut of any TikTok sale -White House aide,08-19-20
Apple's stock market value tops $2 trillion,08-19-20
Apple's stock market value tops $2 trillion,08-19-20
Apple becomes first U.S. company to hit $2-trillion market value,08-19-20
Apple tops $2 trillion in market value,08-19-20
Tsedal Neeley and Ritcha Ranjan Join Brightcove's Board of Directors,08-19-20
Trump Backs Oracle's TikTok Bid in Boost for Donor Ellison,08-19-20
Asian stocks set to rise after Wall Street tech-driven rally,08-20-20
Asian stocks set to rise after Wall Street tech-driven rally,08-20-20
" Tech stocks defy downbeat data as dollar, global equities retreat ",08-20-20
Nasdaq closes at all-time high as strong tech sector offsets jobless data,08-20-20
Nasdaq closes at all-time high as strong tech sector offsets jobless data,08-20-20
" Dollar holds gains on weak data, Fed outlook ",08-20-20
Nasdaq closes at all-time high as tech stock gains offset weak data,08-20-20
Nasdaq closes at all-time high as tech stock gains offset weak data,08-20-20
" NexTech is Presenting at Wall Street Reporter's ""NEXT SUPER STOCK""  Livestream Conference on August 21st ",08-20-20
S&P 500 rises as tech gains offset weak U.S. data,08-20-20
S&P 500 rises as tech gains offset weak U.S. data,08-20-20
" Vaccine won't end COVID-19, so people must to learn to live with virus, warns WHO ",08-20-20
Wall Street ekes out gains as tech stocks eclipse data gloom,08-20-20
Wall Street ekes out gains as tech stocks eclipse data gloom,08-20-20
Business email compromise attacks are rising in Canada: Canadian Anti-Fraud Centre,08-20-20
" Microsoft Deepens Oil Ties, Helping Petrobras Weather Pandemic ",08-20-20
" In U.S.-China tech war, investors bet on China's localisation push ",08-20-20
" In U.S.-China tech war, investors bet on China's localisation push ",08-20-20
TikTok to challenge U.S. order banning transactions with the video app-sources,08-21-20
Alphabet Weighed Buying Small TikTok Stake as Part of Group Bid,08-21-20
TikTok's U.S. Chief Says Video Site Will Stay Despite Trump Ban,08-21-20
Facebook pushes for data portability legislation ahead of FTC hearing,08-21-20
Game Makers Battle to Boost Accessibility for Players With Disabilities,08-21-20
" TikTok Races to Calm Workers, Brands With 25 Days Until Ban ",08-21-20
Facebook pushes for data portability legislation ahead of FTC hearing,08-21-20
TikTok to challenge Trump's executive order,08-22-20
TikTok to challenge Trump's executive order,08-22-20
TikTok Plans to File Suit Against Trump's Order on Monday,08-22-20
Global dividend plunge to be worst since financial crisis,08-23-20
Microsoft says Apple's move against 'Fortnite' creator would hurt its games,08-23-20
Microsoft says Apple's move against 'Fortnite' creator would hurt its games,08-23-20
Microsoft says Apple's move against 'Fornite' creator would hurt its games,08-23-20
TikTok to challenge Trump's executive order,08-23-20
TikTok to challenge Trump's executive order,08-23-20
" TikTok sues Trump administration over U.S. ban, calls it an election ploy ",08-24-20
Zoom says service restored after U.S. users hit by partial outage,08-24-20
" TikTok sues Trump administration over U.S. ban, calls it an election ploy ",08-24-20
" TikTok sues Trump over threatened U.S. ban, calling it an election ploy ",08-24-20
PureFacts Welcomes Three High-Profile Investors to Further Accelerate Its Growth,08-24-20
Zoom says service restored after U.S. users hit by partial outage,08-24-20
