headline,date
What did you learn in 2017? These seven entrepreneurs share some new wisdom,01-03-18
Infrastructure bank could be 'key' for U.S.-Canada high-speed rail: study,01-03-18
" Google says phones, tablets also affected by newly discovered security issue ",01-04-18
AP Explains: Who's affected by computer chip security flaw,01-04-18
" Apple says all Macs, iPhones, iPads are exposed to Meltdown chip flaw; Google smartphones and tablets too ",01-05-18
Everything you need to know — and what you should do — about the computer chip security flaws,01-05-18
Government reps join private businesses at CES tech show,01-07-18
It makes you shudder': Inside the chip industry's massive security meltdown,01-08-18
Intel CEO: Fixes on the way for serious chip security flaws,01-09-18
The man who shook up Canada’s telecom industry has set his sights on blockchain,01-09-18
Jeff Bezos is now the richest man in history and he made $6 billion of that $105 billion fortune in the past 9 days,01-09-18
It costs us': Canada trails Europe and U.S. when adopting new technology,01-09-18
" Microsoft says chip security fix may significantly slow some servers, personal computers ",01-09-18
Microsoft stops fixing security flaw on PCs with AMD chips,01-09-18
" Warren Buffett closer to naming a successor as Berkshire Hathaway promotes Canadian Gregory Abel, Ajit Jain ",01-10-18
" Las Vegas hotels bet on technology to attract, dazzle guests ",01-10-18
Finding value in founder-run companies one of this fund manager's keys to success,01-11-18
The search for peak Bitcoin continues as KFC Canada briefly accepts currency,01-12-18
Documents: Former billionaire reaches deal with creditors,01-13-18
" Markets Right Now: Dow Jones industrials recede from 26,000 ",01-16-18
How a 22-year-old Google cybersecurity researcher discovered the worst chip flaws in history,01-17-18
How a two-man Vancouver team created Apple's 2017 game of the year,01-17-18
Justin Trudeau to push middle class interests as he heads to Davos,01-21-18
" Markets Right Now: More records for stocks, led by tech ",01-22-18
" Beyond the vacuum: Dyson banks on brand power, R&D in effort to transform into tech powerhouse ",01-22-18
I wanted to come say thank you': Tim Cook makes first visit to Canada as Apple CEO,01-22-18
" Big pay package for Elon Musk, if he can meet even bigger goals for Tesla ",01-23-18
AI can read! Tech firms race to smarten up thinking machines,01-23-18
" Former Ont. privacy commissioner forms global council, seeks funds for research ",01-24-18
" PM Trudeau applying pressure on U.S. in NAFTA talks, says Wilbur Ross ",01-24-18
Metrolinx says recent attack involved malware and had many targets,01-24-18
Squeezing leadership wisdom out of a mouse and a louse — on Robbie Burns Day,01-25-18
" Health care, tech and trade hopes lead another stock surge ",01-25-18
Game developers' confidence in Switch grows while faith in VR declines: Report,01-25-18
" ‘America First’ is good for the whole world, Donald Trump tells Davos business elite ",01-26-18
Markets Right Now: Stock indexes end lower after wobbly day,01-26-18
" Google's Sidewalk Labs has big plans to remake Toronto, but some say the whole thing is a big mistake ",01-26-18
" Finally, the little guys are moving in on competing with the big chip-makers ",01-29-18
" TSX nose-dives on oil and gold prices, Wall St. backs off recent record gains ",01-29-18
Energy leads Toronto stocks lower as U.S. stocks plunge; Loonie ticks higher,01-30-18
" The digital economy has created a demand for 216,000 more tech workers, report finds ",01-31-18
Microsoft reports 2Q loss,01-31-18
" Microsoft reports better-than-expected quarterly revenue, profit ",01-31-18
" Cognitive solutions for innovation: Are you a Reinventor, a Tactician, an Aspirational or an Observer? ",02-01-18
IPhone X puts Apple in crosshairs of nervous tech investors,02-01-18
" Alphabet hit by massive Q4 drop on earnings, from one-time charge ",02-02-18
" 'The only electricity we use is one lamp': Apple execs, Facebook billionaires embrace tech diets for devices, services they helped create ",02-05-18
Olympic video and VR: Guide to watching without a TV,02-06-18
" SoftBank's profits soar on sales growth, Sprint improvement ",02-07-18
Dragon Quest Builders for Switch review: Minecraft for less imaginative people,02-07-18
" Trudeau looks to lure tech talent, capital north in San Francisco visit ",02-08-18
" Trudeau makes pitch to Silicon Valley, Amazon to invest in Canada ",02-08-18
" Why giving employees time to grieve is critical to their wellbeing, and your company's ",02-09-18
Will Rare's Sea of Thieves be the new exclusive Xbox One desperately needs?,02-13-18
" Bill, Melinda Gates turn attention toward poverty in America ",02-13-18
" Push your employees to their limits, and everyone will be rewarded ",02-13-18
" Bill and Melinda Gates talk taxes, feminism, President Trump ",02-13-18
Business Highlights,02-13-18
Sales tax breaks to lure data centres booming in Virginia,02-14-18
The cloud is the latest frontier in Walmart's battle with Amazon for e-commerce domination,02-14-18
Markets Right Now: Tech leads stocks to 5th straight gain,02-15-18
" Crypto-miners flood into Canada, boosting the hopes of small towns looking for a break ",02-15-18
" Sure, artificial intelligence is rapidly replacing mundane jobs. But it's not exactly an alien invasion ",02-20-18
Money an issue as many businesses don't give caregiver leave,02-21-18
Dropbox seeking to raise $500 million in stock market debut,02-24-18
Justices look at how older law applies to internet cloud,02-25-18
How Samsung’s new Galaxy S9 compares to Apple's iPhone X,02-26-18
" Move over Apple, Amazon, marijuana is coming to the Nasdaq ",02-26-18
Terence Corcoran: Today’s the day Canada’s ‘entrepreneurs’ 'innovate' more demands for taxpayer money,02-27-18
Business Highlights,02-27-18
CBD infused products Canada's next major growth area,02-28-18
" Winning streak ends for stocks, but technology bounces back ",02-28-18
Bill Gates says cryptocurrencies are leading to deaths and rising drug abuse,03-02-18
" Aurora Cannabis eyeing Nasdaq, NYSE listing as Canadian pot goes global ",03-07-18
Cryptojacking' hacker trend turns unwitting Canadian web surfers into cryptocurrency miners,03-12-18
" Toronto stocks, loonie close higher, while U.S. markets mixed ",03-12-18
Five big-picture trends to help businesses stay ahead of social media shifts,03-13-18
Microsoft finds few gender discrimination complaints valid,03-14-18
Facebook shares sink more than 6 per cent on privacy issues,03-19-18
The Latest: Report says Facebook security chief to leave,03-19-18
Netflix for oil and gas:' Oilpatch gears up to do battle over drilling data worth $1 trillion,03-19-18
BlackBerry says new software bridge to Microsoft products will increase security,03-19-18
Markets Right Now: Trade worries send stock market plunging,03-20-18
" Asian stocks advance ahead of Fed meeting, Tokyo closed ",03-20-18
Amazon vaults ahead of Google parent Alphabet in market value for the first time,03-20-18
BlackBerry and SandRidge climb while Facebook dips,03-20-18
Melania Trump listens to students talk about online civility,03-21-18
Artificial intelligence has one big weakness: The humans who create and shape it,03-22-18
Major international lithium and battery manufacturer teams up with junior explorer to solve supply shortages,03-22-18
BlackBerry says new software bridge to Microsoft products will increase security,03-22-18
Updated privacy policies after Facebook scandal leave room for improvement,03-22-18
Microsoft announces major solar buy in Virginia,03-22-18
Why US consumers could feel impact of Trump's China tariffs,03-22-18
Business Highlights,03-22-18
Updated privacy policies after Facebook scandal leave room for improvement,03-22-18
Sea of Thieves review: A great pirate adventure — if you have friends with whom to share it,03-23-18
Apple to introduce low-cost iPad today in bid to win back students and teachers,03-23-18
Shares of Dropbox surge in first day of trading,03-23-18
Dropbox shares surge in biggest tech debut since Snap,03-23-18
Business Highlights,03-23-18
Five things to watch for in the Canadian business world in the coming week,03-25-18
" Markets Right Now: Dow surges 669, clawing back lost ground ",03-26-18
World stock markets higher as geopolitical tension eases,03-26-18
" Stocks roar back, with the Dow adding over 650 points after biggest weekly rout in two years ",03-26-18
" Finish Line, Lowe's and Microsoft jump ",03-26-18
Apple unveils pencil support for $329 iPad at school event,03-27-18
Markets Right Now: Stocks end a rocky quarter with a bang,03-27-18
The Latest: Apple hopes to regain ground in US classrooms,03-27-18
" Apple refocuses on the classroom, looking to grab market share back from Google, Microsoft ",03-27-18
" Asian shares track tech, consumer stocks' rally on Wall St ",03-28-18
Five things you should know before starting your work day on March 28,03-28-18
BlackBerry's Q4 revenue ahead of expectations as software divisions grow,03-28-18
BlackBerry profit beats expectations on software gains,03-28-18
" 'I've been wrong, but this feels right': BlackBerry CEO's bet on security pays off in privacy scandal age ",03-28-18
BlackBerry's Chen: a delay of mass market driverless cars wouldn't be a problem,03-28-18
" Let's not write Facebook's obituary just yet, despite the market’s gyrations ",03-28-18
Could enemies target undersea cables that link the world?,03-30-18
" Markets Right Now: Tech woes, trade tensions sink US stocks ",04-02-18
Asian shares mixed as markets mull US tariffs list for China,04-02-18
Business Highlights,04-02-18
" Markets Right Now: US, European stock markets move higher ",04-03-18
Business Highlights,04-03-18
Five things you should know before starting your work day on April 4,04-04-18
So what exactly defines an entrepreneur? It's not about coming up with ideas,04-04-18
" Apple working on curved iPhone screens, touchless gesture control, sources say ",04-04-18
" Why the great growth-value reversal will come with a whimper, not a bang ",04-06-18
Markets Right Now: Stocks surge as China trade tensions ease,04-09-18
" Apple unveils red versions of iPhone 8, 8 Plus to keep line fresh mid-cycle ",04-09-18
Asian stocks mostly rise as investors weigh trade war fears,04-09-18
" In search of good news, markets turn to earnings season ",04-09-18
Why tech giants like Google want to make sure Canadians can keep stealing entertainment,04-10-18
Nasdaq SUMMARY,04-10-18
" Facebook must take ‘more proactive role’ in managing network, Zuckerberg tells Congress ",04-10-18
Markets Right Now: Stocks close mostly lower on Wall Street,04-11-18
" Apple is the world's most valuable company at $879 billion, so why hasn't it spawned more billionaires? ",04-11-18
Mavericks and Movers: The brains behind 2017's top-five venture capital deals,04-11-18
9.7-inch iPad review: Few (but significant) changes make for the most complete entry-level tablet,04-12-18
Business Highlights,04-12-18
" For Canada's AI industry, Cambridge Analytica scandal raises existential questions ",04-12-18
Bovines online: Farmers are using AI to help monitor cows,04-13-18
Death of the password? New web standard trades passcodes for biometrics,04-16-18
Markets Right Now: US stocks indexes close broadly higher,04-16-18
Microsoft turns to former rival to improve internet security,04-16-18
" Markets Right Now: Stocks close higher, extending gains ",04-17-18
Supreme Court dismisses Microsoft search case,04-17-18
Team backed by Microsoft co-founder locates USS Helena wreck,04-18-18
TD Canada Trust to open office at CF Champlain mall in former Sears digs,04-19-18
Jeff Bezos says Amazon has signed up more than 100 million Prime subscribers,04-19-18
Markets Right Now: Stocks end lower after early gain fades,04-20-18
Rivals see opening in Dominion Energy's political success,04-23-18
The lessons of HQ1: What the cities vying for Amazon's second headquarters can learn from Seattle,04-25-18
Microsoft: Fiscal 3Q Earnings Snapshot,04-26-18
Microsoft Windows adapts as its business importance declines,04-26-18
" Microsoft tops estimates as Azure, Office products drive gains ",04-26-18
Business Highlights,04-26-18
7 striking facts about the money tech companies are making,04-27-18
Markets Right Now: Stocks end mixed; oil falls on Iran news,04-27-18
Global shares start busy data week solidly,04-27-18
Distracted by technology? Microsoft tries to help,04-27-18
Exxon Mobil and Charter skid while Amazon climbs,04-27-18
Business Highlights,04-27-18
" Box CEO Aaron Levie talks Canada, AI and the future of cloud computing ",05-01-18
Bill Gates pumps $158 million into push to combat US poverty,05-03-18
Business Highlights,05-03-18
" How to pick a new password, now that Twitter wants one ",05-04-18
Microsoft launches $25M program to use AI for disabilities,05-07-18
The Latest: Microsoft CEO says 'privacy is a human right',05-07-18
Google launches Android Things for appliances as earlier spinoffs struggle to catch on,05-07-18
Brazil court tells Microsoft to ease data-sharing opt-out,05-07-18
Business Highlights,05-07-18
" Gates, Zuckerberg team up on new education initiative ",05-08-18
Walmart makes a $16 billion bet on India's booming economy,05-09-18
Bill Morneau: Ignore the gossip and guesswork. The facts prove that Canada’s competitive,05-09-18
Tech leaders push for more White House focus on AI,05-10-18
The Latest: White House launches new AI effort,05-10-18
The CEO who helped deliver India’s online shoppers to Walmart,05-14-18
" Home Depot, Newmont Mining and D.R. Horton skid ",05-15-18
Wynn Resorts female directors address policies after scandal,05-15-18
" Microsoft planning low-cost Surface tablet line to take on iPad, sources say ",05-16-18
Newly revealed Xbox Adaptive Controller poised to get disabled players back in the game,05-17-18
" State of Decay 2 review: A stressful, repetitive hybrid of The Walking Dead and The Sims ",05-17-18
Trudeau touts Canada's AI credentials at MIT tech gathering,05-18-18
Elon Musk keeps Tesla board buddy on leave for more than six months in sign of weak governance,05-18-18
Jurassic Park' dinosaur expert's next big thing: holograms,05-20-18
Business Highlights,05-21-18
Siri winning battle of the virtual assistants in Canada: poll,05-22-18
France's Macron takes on Facebook's Zuckerberg in tech push,05-23-18
Wyoming courts tech behind cryptocurrency to entice business,05-23-18
World stocks mixed as NKorea's restraint eases concerns,05-24-18
Business Highlights,05-24-18
" Amid confusion, EU data privacy law goes into effect ",05-25-18
AP Explains: What's changing under new data privacy rules,05-25-18
Iowa utility: Project means wind will meet customer demand,05-30-18
Nasdaq SUMMARY,06-01-18
Microsoft embraces collaboration in $7.5B deal for GitHub,06-04-18
" Markets Right Now: Tech, retailers lead gains for US stocks ",06-04-18
Microsoft agrees to buy coding site GitHub for $7.5 billion,06-04-18
" Apple's $1 trillion chase isn't so unprecedented after all — in fact, it's completely logical ",06-04-18
Apple's new phone software will speed up older devices,06-04-18
" Apple dangling more goodies, while adding tech diet options ",06-04-18
" Pexip Partners With Google Cloud to Bring Native Video, Audio, and Content-Sharing Interoperability to Hangouts Meet ",06-04-18
Business Highlights,06-04-18
SoftwareONE Rises to #11 on CRN's 2018 Solution Provider 500 List,06-05-18
SoftwareONE Rises to #11 on CRN's 2018 Solution Provider 500 List,06-05-18
Accruent to Expand CMMS Leadership with Acquisition of Maintenance Connection,06-06-18
Shareholders reject bid to link Google diversity to exec pay,06-06-18
Google pledges not to use AI for weapons or surveillance,06-07-18
Tech investors complain of ‘blockchain fatigue’ as the fad fades,06-11-18
Dimension Data and Britehouse Recognised as Winners for 2018 Microsoft Partner of the Year Awards,06-12-18
NTT Communications Named Leader in Managed Hosting by ISG,06-13-18
Rimini Street Approved for UK Government TS2 Framework,06-13-18
" Global IT and Finance Leaders Survey Finds Biggest Blocker to Innovation is Overspending on ""Keeping the Lights On"" ",06-13-18
A feel-good index ranking companies based on social impact instead of profits now has a fund,06-13-18
HyperX to Gear up New Fortnite Fans on Nintendo Switch,06-13-18
Sony wins E3. Again. Barely,06-13-18
" TA Associates Announces Acquisition and Combination of Global Software, Inc. and insightsoftware.com International to Create Market-Leading ERP Reporting Platform ",06-14-18
Microsoft follows Amazon in pursuit of cashier-less stores,06-14-18
This Week: Oracle results; May home sales; Philly Fed survey,06-18-18
How to build your own unfair advantage against your competitors,06-18-18
Rimini Street Announces $140 Million Refinancing,06-18-18
" Rates used to price trillions worth of financial instruments in dire need of update, BoC says ",06-18-18
IBM pits computer against human debaters,06-19-18
IBM computer proves formidable against 2 human debaters,06-19-18
" Google, Facebook, others speak out against child separation ",06-19-18
" The Dow then and now: original, current members of index ",06-19-18
Mark Zuckerberg is only $725 million away from becoming richer than Warren Buffett,06-20-18
Keihin Switches to Rimini Street Support for Oracle EBS,06-20-18
" Xiaomi: A Chinese startup out to challenge Google, Amazon ",06-21-18
US stocks finish mostly higher as energy companies climb,06-22-18
Some boosters want South Dakota's Augustana on bigger stage,06-24-18
" Ribbon Communications Signs Agreement to Acquire Edgewater Networks, Inc. ",06-25-18
Global markets subdued as trade concerns linger,06-26-18
Rimini Street Recognized as a Top Workplace by Bay Area News Group for the Fifth Time,06-28-18
Barbs for Bezos but Bill Gates largely admired in Seattle,06-30-18
Rimini Street Honored With Four Gold Stevie Awards for Outstanding Customer Service,07-03-18
How much all-seeing AI surveillance is too much?,07-03-18
AP Explains: How computers 'see' faces and other objects,07-03-18
" Biogen, Microsoft gain; PriceSmart, Silicon Motion fall ",07-06-18
Amazon as a value stock?: Why the $840-billion company's shares are surprisingly cheap,07-09-18
How Apple's app store changed our world,07-10-18
StarLeaf's Maestro Management Solution Is Now Available in Microsoft Azure,07-10-18
Microsoft debuts $399 Surface Go tablet to take on Apple's cheaper iPads,07-10-18
" Once bailed out by the government, tech hub MaRS now can't keep up with startups' demand for space ",07-10-18
Stocks shuffle toward another weekly gain as oil prices rise,07-12-18
New UN panel to make proposals to ensure safe digital future,07-12-18
Adobe to launch Photoshop for iPad in strategy shift to boost subscription sales,07-13-18
Microsoft raises alarms about face recognition,07-13-18
AP Exclusive: Billionaires fuel US charter schools movement,07-16-18
Tech is going to inherit the earth': Netflix in the spotlight as FANG surge leads stock market recovery,07-16-18
Amazon.com founder Jeff Bezos just became the richest person in modern history,07-16-18
Business Highlights,07-16-18
Five things you should know before starting your day on July 17,07-17-18
" Walmart partners with Microsoft on cloud, AI tech in latest battle against Amazon ",07-17-18
Login VSI Revolutionizes Application Compatibility Testing,07-19-18
Trump promotes job training as employers search for workers,07-19-18
The Latest: Trump: US needs 'people with training' for jobs,07-19-18
" Microsoft profit up, aided by cloud rivalry with Amazon ",07-19-18
Business Highlights,07-19-18
Canadian Brands Celebrated at the Americas Edition of the World Branding Awards in New York,07-20-18
" Selling generic Viagra, Rogaine to Instagram crowd – over the phone ",07-20-18
Markets Right Now: Stocks end slightly lower on Wall Street,07-20-18
" World shares mostly higher, defying Facebook-led tech slump ",07-20-18
Microsoft shares shoot to all-time high after blockbuster earnings,07-20-18
Microsoft and Honeywell rally while Skechers and GE slip,07-20-18
Business Highlights,07-20-18
How rising employee activism is driving corporate change,07-23-18
Spectra7 DreamWeVR™ Chips Support New Industry Standard Interface for Virtual Reality Headsets,07-23-18
" Samsung, Google smartphones leave Apple's iPhones in the dust when it comes to internet speeds ",07-23-18
Alphabet shares surge as it trounces profit estimates on strong online ad sales,07-23-18
Element AI Announces New Podcast Series 'The AI Element',07-24-18
Meet the Waterloo startup that's partnering with Google and IBM to make quantum computing a reality,07-24-18
Canadian executives transferring to U.S. risk losing visa perk in Trump crackdown on immigration,07-24-18
" GSMA Announces Latest Event Updates for 2018 ""Mobile World Congress Americas, in Partnership With CTIA"" ",07-26-18
" How China, Russia, Iran target US with economic espionage ",07-26-18
Facebook fallout shatters myth of big tech's everlasting upward trajectory,07-26-18
The Latest: Twitter's stock plunges on weak user numbers,07-27-18
" SIGGRAPH 2018 to Spotlight Creators and Pioneers in Games Industry, Real-Time Live! to Showcase the Future of Production Live on Stage ",07-30-18
Want to work in tech? You don’t need to know how to code,07-31-18
Watts Miners Disrupts the Global Crypto Space with Extraordinary Hash Rate Power,07-31-18
Trump criticized for not leading effort to secure elections,08-01-18
Leaked chats show alleged Russian spy seeking hacking tools,08-01-18
How AI – and a Habs game – can get you in to see the doctor faster,08-02-18
Triumph of the iPhone: Apple cracks trillion-dollar mark,08-02-18
Milestones along the way for Apple's trip to $1 trillion,08-02-18
Apple makes history with $1 trillion market valuation,08-02-18
Campaigns on their own as cyber threats roil midterms,08-03-18
Stingray Digital Group makes unsolicited $120M bid for Music Choice,08-03-18
Gemalto Boosts Cloud Security with a Scalable Virtual Key Management Solution,08-07-18
Trend Micro Reports Second Quarter 2018 Results,08-07-18
Zones Named to 2018 CRN Fast Growth 150 List,08-07-18
Trump's China trade war pulls consumer tech into crossfire,08-07-18
Bentley Systems Announces Finalists in the Year in Infrastructure 2018 Awards Program,08-07-18
Business Highlights,08-07-18
Business Highlights,08-08-18
SoftwareONE Named to 2018 CRN Fast Growth 150 List,08-09-18
Schiefer Chopshop Acquires Fuel to Expand Its Digital Capabilities and Raise Its Innovative Integrated Marketing Offerings to the Next Level,08-09-18
SIGGRAPH 2018 Spotlights Women in Computer Graphics,08-09-18
Rimini Street Announces Fiscal Second Quarter 2018 Financial Results,08-09-18
Watts Miners Powerful Mining Rigs Create High Impact on the Market,08-13-18
Not even Trump’s trade threats can slow this booming port in a tiny Canadian town,08-13-18
" Watts Miners Announces State-of-the-Art Cryptocurrency Mining Technology for BTC, ETH, LTC, DASH and XMR ",08-14-18
Klick Health Bulks Up Creative Team To Support Explosive Growth,08-14-18
Walmart's size may not be enough to shield it from passing price hikes on to shoppers,08-14-18
Asian stocks slide as investors fret over China's economy,08-15-18
Rimini Street Receives Asia-Pacific Stevie Award for Customer Service Innovation,08-15-18
Global shares mixed following Wall Street losses,08-16-18
Lenovo aims to grow market share in saturated PC market,08-16-18
" Trump sends mean tweets, first lady talks positivity online ",08-20-18
" Apple to release a new low-cost Macbook, pro-focused Mac mini later this year ",08-20-18
Microsoft uncovers more Russian hacking ahead of midterms,08-21-18
US adds to growing list of sanctions on Russia,08-21-18
The Latest: FBI aware of hack political found by Microsoft,08-21-18
Ranks of most valuable companies shifted during bull market,08-21-18
The bull that will not die: S&P 500 back at a record after months on ice,08-21-18
Business Highlights,08-21-18
Microsoft's anti-hacking efforts make it an internet cop,08-21-18
Facebook uncovers new global misinformation operations,08-22-18
" beqom Scales Sales Incentives Plans for Large Enterprises, Powered by Microsoft Azure ",08-22-18
Rimini Street Achieves Flawless ISO 9001 Audit for Seventh Consecutive Year,08-22-18
Rimini Street Achieves Flawless ISO 9001 Audit for Seventh Consecutive Year,08-22-18
Can tech giants work together against their common enemies?,08-22-18
Rimini Street Receives Court-Ordered $21.5 Million Refund from Oracle and Seeks an Additional $41.3 Million in Further Appeals,08-22-18
Attempt to break into Democratic Party voter data thwarted,08-22-18
Google takes on alleged Iranian influence campaign,08-23-18
" David Rosenberg: This bull market is many things, but ‘unloved’ is not one of them ",08-23-18
The Latest: Google acts against Iranian influence operation,08-23-18
Microsoft confirms employee firings amid Hungary bribe probe,08-23-18
Grupo Positivo Switches to Rimini Street Support for its Oracle Applications,08-24-18
WIBEIS is the International Brand of Scientific and Standard Evaluation System,08-24-18
Owners who slap their name on a business choose glory over growth,08-27-18
" Back from vacations, a good time to beef up cybersecurity ",08-27-18
Global stocks mixed after Wall Street gain,08-28-18
Silicon Valley's Jumio launches AI lab in Montreal to hone ID verification,08-28-18
Rights groups to Google: No censored search in China,08-29-18
Global stocks fall as weak dollar weighs on sentiment,08-29-18
