headline,date
" Signature Senior Lifestyle Chooses Advanced Payroll by LOKI Systems, a Workforce Logiq Company, to Maintain HMRC Compliance and Manage End-to-End Payroll Operations ",03-31-21
Li-Cycle Launches Partnership with The Shore Foundation to Provide Communities with Enhanced Access to Technology,03-31-21
" Verde Delivers 97% Gross Profit Growth With 62% Gross Margin for 2020, and First Full Year Profit ",03-31-21
Ford resumes political donations after review,04-01-21
Microsoft says investigating issues with Microsoft 365 services and features,04-01-21
Quisitive Completes Acquisition of Mazik Global,04-01-21
" S&P 500 rides Microsoft, Amazon to record close above 4,000 ",04-01-21
" Global equities surge on factory data, stimulus hopes ",04-01-21
" S&P 500 rides Microsoft, Amazon to record close north of 4,000 ",04-01-21
" Posthaste: There may be a solution to our hot, hot housing market — if we just wait for it ",04-01-21
" Global equities surge on factory data, stimulus hopes ",04-01-21
" Microsoft and Amazon lead S&P 500 to 4,000 points ",04-01-21
" S&P 500 hits 4,000 on tech power, recovery optimism ",04-01-21
" S&P 500 hits 4,000 on tech power, recovery optimism ",04-01-21
" Nearly half of Canadian workers experience daily burnout, according to Microsoft Work Trend Index ",04-01-21
" S&P 500 hits 4,000 mark on tech strength, reopening optimism ",04-01-21
" S&P 500 hits 4,000 mark on tech strength, reopening optimism ",04-01-21
Dialpad Receives 2021 CUSTOMER Magazine Voice Technology Excellence Award,04-01-21
" S&P 500 hits 4,000 mark on tech strength, reopening optimism ",04-01-21
" S&P 500 hits 4,000 mark on tech strength, reopening optimism ",04-01-21
Wall Street on track for higher open on tech strength,04-01-21
Wall Street on track for higher open on tech strength,04-01-21
IPOs at 15-Year High in Canada With Tech Industry Coming of Age,04-01-21
Verizon signs first private 5G contract in Europe,04-01-21
Microsoft wins $21.9 bln contract with U.S. Army to supply augmented reality headsets,04-01-21
Stocks edge up as Biden spending plan boosts U.S. outlook,04-01-21
" Delta, Coca-Cola blast home state Georgia's voting restrictions as 'unacceptable' ",04-01-21
Mathematics can guide leaders to validate their business knowledge,04-02-21
CoVIg-19 Plasma Alliance Announces Topline Results from NIH-Sponsored Clinical Trial of Investigational COVID-19 Hyperimmune Globulin Medicine,04-02-21
Millennials and global consumers push U.S. companies to get political,04-02-21
" Tencent's Timi gaming studio generated $10 billion in 2020, sources say ",04-02-21
Microsoft says an outage with Microsoft 365 services resolved,04-02-21
Microsoft says an outage with Microsoft 365 services mitigated,04-02-21
Cisco updates Webex People Insights to help boost employee well-being,04-05-21
U.S. Supreme Court backs Google over Oracle in major copyright case,04-05-21
U.S. Supreme Court backs Google over Oracle in major copyright case,04-05-21
MSSP eSentire says hackers using LinkedIn profiles for spearphishing,04-05-21
Jumio Collaborates With Microsoft to Deliver on Its Vision of Decentralized Digital Identity,04-05-21
" Pythian Acquires SAP MSP Partner ManageServe The acquisition extends Pythian's full lifecycle ERP capabilities to include SAP HANA migration, analytics, and managed services ",04-06-21
" 'The very, very rich got very, very richer:' Jeff Bezos, Elon Musk top Forbes list that saw record growth in billionaires ",04-06-21
Intel aims for supply chain edge with new data center chip,04-06-21
Dialpad Announces Appointment of CMO and CHRO,04-06-21
Former Credit Suisse exec backed SPAC to take robotics firm Sarcos public,04-06-21
NGen Supercluster Members Deploying New Technology Solutions for Food Processing Sector Panevo's ioTORQ platform promises significant productivity improvements for Canadian industry,04-06-21
Bill Gates Is Reaching for the High-Hanging Fruit on Climate,04-06-21
Acuant Joins Forces with Microsoft to Build a More Trustworthy Identity Ecosystem with Verifiable Credentials New Approach in Decentralized Identifiers Will Provide Microsoft Azure Active Directory Users Control Over ID Management,04-06-21
Former Credit Suisse exec backed SPAC to take robotics firm Sarcos public,04-06-21
3CLogic Secures Significant Investment from Recurring Capital Partners to Support Growth and Expansion,04-06-21
Ambyint and Microsoft Partner to Deliver Production Optimization at Scale,04-07-21
" Cloud firm Redis Labs valued at $2 bln as SoftBank, Tiger Global invest ",04-07-21
How ag-tech innovations can solve the global food supply crisis,04-07-21
" S&P 500, Dow tick higher ahead of Fed minutes ",04-07-21
" S&P 500, Dow tick higher ahead of Fed minutes ",04-07-21
" Redis Labs valued at over $2 bln in latest funding from SoftBank, others ",04-07-21
" Ekata Launches Merchant Onboarding Solution to Enable Faster, Smarter Assessments of Merchant Risk ",04-07-21
Asia shares set for choppy session after S&P 500 hits record high,04-08-21
Apple argues it faces competition in video game market as 'Fortnite' trial nears,04-08-21
S&P closes at record on tech boost as U.S. Treasury yields retreat,04-08-21
S&P closes at record on tech boost as U.S. Treasury yields retreat,04-08-21
Day Traders Go Big on Blue Chips as Meme Stocks Fad Cools,04-08-21
Tech boost lifts S&P to record as U.S. Treasury yields retreat,04-08-21
" KKR invests $500 mln in cloud storage firm Box, gets board seat ",04-08-21
A grand bargain: How the radical U.S. corporate tax plan would work,04-08-21
ESG Funds That Rode Tech Rally Well-Positioned for a Rotation,04-08-21
S&P 500 scales new record high on tech boost,04-08-21
S&P 500 scales new record high on tech boost,04-08-21
" KKR invests $500 mln in cloud storage firm Box, gets board seat ",04-08-21
" KKR invests $500 mln in cloud storage firm Box, gets board seat ",04-08-21
S&P 500 scales new record high on tech boost,04-08-21
S&P 500 scales new record high on tech boost,04-08-21
" S&P 500, Nasdaq set to open higher on tech boost ",04-08-21
" S&P 500, Nasdaq set to open higher on tech boost ",04-08-21
mdf commerce announces a partnership with Mibusoft Inc. to offer its SMB ecommerce solution to Mibusoft's customers The agreement will add an essential ecommerce component to Mibusoft's offering and expand the market reach of mdf commerce in the Greater Toronto Area and Quebec region,04-08-21
Skyhook to Provide Enhanced Location Services for Microsoft Products and Services,04-08-21
Quisitive Announces Closing of $62.6 Million Financing Transactions,04-08-21
GameStop plans to elect activist investor Cohen as chairman,04-08-21
Taos Eliminates DevOps Skills Gap With On-Demand Talent at Global Scale with Follow the Sun DevOps NowTM Offering,04-08-21
UN group consensus report on cyberspace called 'significant',04-08-21
Nasdaq futures gain 1% ahead of weekly jobless claims data,04-08-21
Nasdaq futures gain 1% ahead of weekly jobless claims data,04-08-21
Gates-Led Group Wants to Help Climate Tech Find Paying Customers,04-08-21
Apple to argue it faces competition in video game market in Epic lawsuit,04-08-21
Aramco Selling $12.4 Billion Stake in Pipeline Rights Unit,04-09-21
" S&P 500, Dow climb for third day and close at records ",04-09-21
" S&P 500, Dow climb for third day and close at records ",04-09-21
" S&P 500, Dow climb for third day and close at records ",04-09-21
" S&P 500, Dow hit records; earnings season jitters cap gains ",04-09-21
" More Canadian firms leave RDP exposed than other countries, report suggests ",04-09-21
LinkedIn says some user data scraped and posted for sale,04-09-21
S&P 500 set to ease from record level as tech stocks weigh,04-09-21
S&P 500 set to ease from record level as tech stocks weigh,04-09-21
Study flags gender bias in Facebook's ads tools,04-09-21
Futures tepid after S&P 500 ends at record level,04-09-21
Futures tepid after S&P 500 ends at record level,04-09-21
LinkedIn says some user data extracted and posted for sale,04-09-21
LinkedIn says some user data extracted and posted for sale,04-09-21
" World stocks hit record high, powered by Wall Street ",04-09-21
Stocks firm near record after easing U.S. inflation fears lift Wall Street,04-09-21
Facedrive Provides a Corporate Update and Growth Report,04-09-21
Stocks firm near record as easing U.S. inflation fears lift Wall Street,04-09-21
Over 1 billion people worldwide use a MS Office product or service,04-10-21
Microsoft in talks to buy AI firm Nuance Communications for about $16 billion -source,04-11-21
Microsoft in talks to buy AI firm Nuance Communications for about $16 billion,04-11-21
Microsoft in talks to buy AI firm Nuance Communications for about $16 billion - Bloomberg,04-11-21
Microsoft in talks to buy AI firm Nuance Communications - Bloomberg,04-11-21
Microsoft doubles down on cloud healthcare business with $16 billion Nuance buy,04-12-21
U.S. senator wants to ban Big Tech from buying anything ever again,04-12-21
" Wall St ends lower as investors await earnings, inflation data ",04-12-21
Creative Solutions Acquires Lightstream to Expand into Gaming and Strengthen Cloud Offering,04-12-21
" Wall St ends lower as investors await earnings, inflation data ",04-12-21
" S&P 500, Dow dip ahead of earnings, inflation data ",04-12-21
Microsoft to buy AI firm Nuance for $16 bln to boost healthcare business,04-12-21
" S&P 500, Dow slip from record highs ahead of earnings, inflation data ",04-12-21
" S&P 500, Dow slip from record highs ahead of earnings, inflation data ",04-12-21
Microsoft to buy AI firm Nuance Communications for about $16 bln in healthcare push,04-12-21
" S&P 500, Dow ease from record levels; earnings, data in focus ",04-12-21
" S&P 500, Dow ease from record levels; earnings, data in focus ",04-12-21
Software maker UiPath aims for nearly $26 bln valuation in U.S. IPO,04-12-21
Salesforce to welcome vaccinated employees back to office,04-12-21
Microsoft to buy AI firm Nuance Communications for about $16 bln in healthcare push,04-12-21
" S&P 500, Dow set to ease from record levels; earnings, data in focus ",04-12-21
" S&P 500, Dow set to ease from record levels; earnings, data in focus ",04-12-21
Microsoft to buy AI firm Nuance Communications in $19.7 bln deal in healthcare push,04-12-21
Microsoft to buy AI firm Nuance Communications in $19.7 bln deal,04-12-21
Software maker UiPath aims for nearly $26 bln valuation in U.S. IPO,04-12-21
" Futures slip after S&P 500, Dow's record close; earnings, data in focus ",04-12-21
" Futures slip after S&P 500, Dow's record close; earnings, data in focus ",04-12-21
U.S. directs agencies to apply patches to Microsoft servers,04-13-21
Global stocks hit record after U.S. inflation data,04-13-21
" Tech stocks push S&P 500 to record close, buoy Nasdaq ",04-13-21
" Tech stocks push S&P 500 to record close, buoy Nasdaq ",04-13-21
" Tech stocks push S&P 500 to record close, buoy Nasdaq ",04-13-21
" S&P 500, Nasdaq up on tech gains; unfazed by vaccine pause, inflation ",04-13-21
" S&P 500, Nasdaq up on tech gains; unfazed by vaccine pause, inflation ",04-13-21
" S&P 500, Nasdaq up as tech stocks rise after J&J vaccine pause ",04-13-21
" S&P 500, Nasdaq up as tech stocks rise after J&J vaccine pause ",04-13-21
" S&P 500, Nasdaq up as tech stocks rise after J&J vaccine pause ",04-13-21
" S&P 500, Nasdaq up as tech stocks rise after J&J vaccine pause ",04-13-21
S&P 500 set for muted open on strong inflation,04-13-21
S&P 500 set for muted open on strong inflation,04-13-21
" Blockchain firm ConsenSys raises $65 million from J.P. Morgan, others ",04-13-21
" Brightcove Announces Virtual Events for Business: A Broadcast-Quality Video Solution for Team-Level, Departmental, and Enterprise-Wide Events ",04-13-21
Calm before the CPI,04-13-21
Calm before the CPI,04-13-21
" Dell spins off VMware stake, generating up to $9.7 bln to pay down debt ",04-14-21
Shaw Announces Second Quarter and Year-to-Date Fiscal 2021 Results,04-14-21
Wall Street ends mixed despite bumper big-bank earnings,04-14-21
Wall Street ends mixed despite bumper bank earnings,04-14-21
Wall Street ends mixed despite bumper bank earnings,04-14-21
" Coinbase tops $100-billion value, then slips in landmark cryptocurrency listing ",04-14-21
" S&P 500 dips off record high, Dow rises on bank earnings ",04-14-21
" S&P 500 dips off record high, Dow rises on bank earnings ",04-14-21
" S&P 500, Dow rise on boost from bank earnings ",04-14-21
" S&P 500, Dow rise on boost from bank earnings ",04-14-21
Uber expects employees to return to office by Sept. 13,04-14-21
Dialpad Announces CTO and COO Appointments to Drive Growth Through Innovation,04-14-21
Parallels Desktop 16.5 for Mac Supports Both M1 and Intel Chips; Run Windows 10 at Native Speeds on Mac Computers with a Seamless Experience Loved by Millions¹ Parallels Access and Parallels Toolbox apps have native support for M1 Mac Computers,04-14-21
" Wall St set to open higher as JPMorgan, Goldman kick off bank earnings ",04-14-21
" Wall St set to open higher as JPMorgan, Goldman kick off bank earnings ",04-14-21
" Quisitive Sets Fourth Quarter and Full Year 2020 Earnings Call for Tuesday, April 20, 2021 at 4:30 p.m. ET ",04-14-21
BlackRock's Record-Breaking ESG Fund Looks Just Like a Big Tech ETF,04-14-21
" S&P, Nasdaq futures rise as JPMorgan, Goldman set to kick off earnings season ",04-14-21
" S&P, Nasdaq futures rise as JPMorgan, Goldman set to kick off earnings season ",04-14-21
From Harvard to Nasdaq listing: Grab CEO's ride to world's biggest SPAC deal,04-14-21
" Civil groups want EU lawmakers to boost privacy rights in planned WhatsApp, Skype rules ",04-14-21
World stocks hit record high as bond yields ease,04-14-21
Indonesian e-commerce firm Bukalapak raises $234 mln- document,04-14-21
Indonesian e-commerce company Bukalapak raises $234 mln - document,04-14-21
World stocks hit record high as bond yields ease with inflation fears,04-14-21
World stocks rally as Treasury yields tumble,04-15-21
" Dow hits milestone, S&P breaks record high on tech rally ",04-15-21
" Dow breaks 34k, S&P hits fresh record high on tech rally ",04-15-21
World stocks rally as Treasury yields tumble,04-15-21
" S&P 500, Dow extend record highs on tech stock gains ",04-15-21
" Technology stocks lead S&P 500, Dow to record highs ",04-15-21
" Technology stocks lead S&P 500, Dow to record highs ",04-15-21
World stocks rally as Treasury yields tumble,04-15-21
Rare melding of strategies may add more fuel to gains for energy and bank stocks,04-15-21
" S&P 500, Dow hit record highs on upbeat earnings, strong retail sales ",04-15-21
" S&P 500, Dow hit record highs on upbeat earnings, strong retail sales ",04-15-21
Verizon to launch 5G internet for businesses in 21 U.S. cities,04-15-21
" Self-driving startup Cruise raises $2.75 bln from Walmart, others ",04-15-21
" Vantage Data Centers Expands Executive Team with President of North America and Chief of Staff, Vice President of Investor Relations ",04-15-21
" Wall Street set to rise on upbeat earnings, strong retail sales ",04-15-21
" Wall Street set to rise on upbeat earnings, strong retail sales ",04-15-21
Dell shares rise on plans to spin off top-performing VMware unit,04-15-21
Facebook signs renewable energy deal in India; says it has reached net zero,04-15-21
" Work-integrated learning is changing with the times New program will offer four month one-term work projects, with mentorship support from industry partners ",04-15-21
" Futures rise on solid corporate results, jobless claims data awaited ",04-15-21
" Futures rise on solid corporate results, jobless claims data awaited ",04-15-21
Facebook signs first deal to buy renewable energy in India,04-15-21
Notice of 2021 AGM and Shell Energy Transition Strategy,04-15-21
" Wall St ends week positively; S&P 500, Dow hit record highs ",04-16-21
" S&P 500, Dow hit record highs on bank earnings boost ",04-16-21
" S&P 500, Dow hit record highs on bank earnings boost ",04-16-21
" S&P 500, Dow hit record highs on bank earnings boost ",04-16-21
" S&P 500, Dow hit record highs on bank earnings boost ",04-16-21
AT&T to Hold Annual Meeting of Stockholders via Webcast,04-16-21
CFAs typically earn at least $150K annually,04-16-21
Wall St set to open higher after bumper earnings from big banks,04-16-21
Wall St set to open higher after bumper earnings from big banks,04-16-21
" Futures muted after S&P 500, Dow hit record closing highs ",04-16-21
" Futures muted after S&P 500, Dow hit record closing highs ",04-16-21
" Wall Street slips off record highs, Tesla drops after fatal crash ",04-19-21
" Wall Street slips off record highs, Tesla drops after fatal crash ",04-19-21
" Facebook takes on Clubhouse, unveils upcoming audio products ",04-19-21
" Facebook pushes into audio to compete with Clubhouse, Twitter ",04-19-21
UK invokes national security to investigate Nvidia's ARM deal,04-19-21
" Microsoft to test Xbox cloud gaming on PCs, Apple mobile devices ",04-19-21
New Report Sheds Light on Students' Mental Health during Pandemic,04-19-21
InnoTech Alberta Celebrates with XPRIZE,04-19-21
Zoom launches $100 mln fund to invest in apps using its technology,04-19-21
Internet security company Cloudflare opens first Canadian office,04-19-21
Quisitive Achieves Information Security and Business Continuity Certifications for LedgerPay,04-19-21
" Schlumberger Will Collaborate With Equinor for DELFI Environment Deployment, Fully Integrated With the OSDU Data Platform ",04-19-21
" Amazon Invests in Nine New Renewable Energy Projects in Canada, the U.S., Spain, Sweden, and the UK and Becomes Europe's Largest Corporate Buyer of Renewable Energy ",04-19-21
UnitedLex Vantage Now Available in the Microsoft Azure Marketplace,04-19-21
GameStop loses CEO in latest management shakeup,04-19-21
" UiPath boosts IPO price range, aims for $28 bln valuation ",04-19-21
GameStop says CEO Sherman to resign; starts search for successor,04-19-21
GameStop CEO George Sherman to resign,04-19-21
Microsoft to invest $1 bln in Malaysia to set up data centers - Malaysian PM,04-19-21
" Bill Gates, dozens of world leaders to attend Biden climate summit -source ",04-20-21
Quisitive Reports Fourth Quarter and Full Year 2020 Financial Results Company Achieves 169% Year over Year Revenue Growth,04-20-21
Discord ends sale talks with Microsoft - sources,04-20-21
" Apple targets remote workers with new iPad Pro, slim iMacs using own chips ",04-20-21
" Apple targets remote workers with new iPad Pro, slim iMacs using own chips ",04-20-21
" Apple showcases AirTags for lost items, slim iMacs, purple iPhones and iPad Pro at launch event ",04-20-21
" Apple targets remote professionals with new iPad Pro, iMacs fused with own chip ",04-20-21
Discord ends buyout talks with Microsoft - source,04-20-21
Discord terminates buyout talks with Microsoft - WSJ,04-20-21
Latest AMD Radeon Software Release Expands Remote Gaming Functionality and Enables New Features and Customization Capabilities,04-20-21
Why a U.S. hospital and oil company turned to facial recognition,04-20-21
" U.S. Senate panel advances bill to aid Ukraine, pressure Nord Stream 2 ",04-21-21
Software maker UiPath shares rise over 23% in NYSE debut,04-21-21
Wall Street rebounds after two-day decline; Netflix slides,04-21-21
Wall Street rebounds after two-day decline; Netflix slides,04-21-21
Wall Street rebounds after two-day decline; Netflix slides,04-21-21
Wall Street rebounds after two-day fall; Netflix slides,04-21-21
Wall Street rebounds after two-day fall; Netflix slides,04-21-21
Software maker UiPath valued at $34 bln in NYSE debut as shares jump 17%,04-21-21
" UiPath set to jump 14% in NYSE debut, potentially valuing it at over $33 bln ",04-21-21
" S&P 500, Dow snap two-day fall, Netflix keeps Nasdaq in check ",04-21-21
" S&P 500, Dow snap two-day fall, Netflix keeps Nasdaq in check ",04-21-21
" Wall St set for lower open as Netflix slides, cases rise ",04-21-21
" Wall St set for lower open as Netflix slides, cases rise ",04-21-21
" ProntoForms demonstrates value in the energy sector with two global enterprise customers The solution improves asset performance and uptime, and enables detailed compliance reporting to meet stringent health, safety, and environmental requirements ",04-21-21
Xpan Interactive Ltd. and Hatch Win Multiple Awards in Prestigious Horizon Interactive Awards for Training and eLearning,04-21-21
Hackers target SonicWall customers through email weak spot,04-21-21
Hackers use previously unknown vulnerability to target SonicWall customers,04-21-21
U.S. stocks close down on news of Biden tax proposal,04-22-21
U.S. stocks close down on news of Biden tax proposal,04-22-21
U.S. stocks drop on news of Biden tax proposals,04-22-21
U.S. stock sink on reports of Biden tax proposals,04-22-21
LinkedIn-backed Confluent confidentially files for U.S. IPO,04-22-21
Dow Jones reaches new high despite the pandemic,04-22-21
Freelancers in some areas are now earning over 70 per cent more than workers with traditional jobs,04-22-21
This Hot Lister advises Bill Gates on climate change,04-22-21
Job portal ZipRecruiter files to go public via direct listing,04-23-21
Wall Street rallies on strong economic data; tech in focus,04-23-21
Wall Street rallies on strong economic data; tech in focus,04-23-21
Wall Street rallies on strong economic data; tech in focus,04-23-21
" Wall Street jumps after strong factory data; Amex, Honeywell fall ",04-23-21
" Wall Street jumps after strong factory data; Amex, Honeywell fall ",04-23-21
Biggest QQQ Exodus Since 2000 Ups the Ante on Big Tech Earnings,04-23-21
" S&P 500, Nasdaq higher after strong factory data; Amex, Honeywell results hit Dow ",04-23-21
" S&P 500, Nasdaq higher after strong factory data; Amex, Honeywell results hit Dow ",04-23-21
Attorney General Morrisey Attacks Biden Plan: Climate Update,04-23-21
" S&P 500, Nasdaq to open higher; Amex shares to weigh on Dow ",04-23-21
" S&P 500, Nasdaq to open higher; Amex shares to weigh on Dow ",04-23-21
Schlumberger Announces First-Quarter 2021 Results,04-23-21
Leveling up: Embracer's acquisition spree takes it to top of European games business,04-23-21
Strong Microsoft Excel skills can open the door to promotion and leadership opportunities,04-25-21
" Lifshitz Law Firm, P.C. Announces Investigation of INSW, LMNX, NUAN, and SPRT ",04-25-21
" GameStop raises $551 mln to accelerate e-commerce push, shares jump ",04-26-21
" S&P 500, Nasdaq close at record highs ahead of tech earnings wave ",04-26-21
Stocks gain on optimism over economic recovery,04-26-21
" S&P 500, Nasdaq close at record highs ahead of tech earnings wave ",04-26-21
Stocks gain on optimism over economic recovery,04-26-21
Tesla lifts S&P 500 ahead of tech earnings wave,04-26-21
Tesla lifts Wall Street as big tech earnings set to roll in,04-26-21
Tesla lifts Wall Street as big tech earnings set to roll in,04-26-21
Wall Street edges higher on Tesla boost ahead of big tech earnings,04-26-21
Nasdaq set to open lower ahead of big tech earnings,04-26-21
Nasdaq set to open lower ahead of big tech earnings,04-26-21
Nasdaq futures edge lower ahead of Big Tech earnings,04-26-21
Nasdaq futures edge lower ahead of Big Tech earnings,04-26-21
CNH Industrial announces senior appointments,04-26-21
" Microsoft sales rise 19%, short of top estimates, sending shares lower ",04-27-21
" Alphabet shares pop on sales beat, new $50-billion buyback ",04-27-21
" Stock markets dip on caution before Fed, earnings ",04-27-21
Wall Street ends mostly flat ahead of earnings wave,04-27-21
Wall Street ends mixed as earnings wave nears,04-27-21
" Wall Street dips as Tesla, 3M weigh; big tech earnings in focus ",04-27-21
" Wall Street dips as Tesla, 3M weigh; big tech earnings in focus ",04-27-21
" Wall Street edges lower as Tesla, 3M weigh; big tech earnings in focus ",04-27-21
" Wall Street edges lower as Tesla, 3M weigh; big tech earnings in focus ",04-27-21
" S&P 500, Nasdaq set for higher open as focus turns to tech earnings, Fed ",04-27-21
" Futures hover at record levels as focus turns to tech earnings, Fed ",04-27-21
" S&P 500, Nasdaq set for higher open as focus turns to tech earnings, Fed ",04-27-21
" Futures hover at record levels as focus turns to tech earnings, Fed ",04-27-21
" Stocks dip on caution before Fed, earnings ",04-27-21
Wall Street treads water as earnings wave nears,04-27-21
" Wall Street dips as Tesla, 3M weigh; big tech earnings in focus ",04-27-21
" Wall Street dips as Tesla, 3M weigh; big tech earnings in focus ",04-27-21
" Wall Street edges lower as Tesla, 3M weigh; big tech earnings in focus ",04-27-21
" Wall Street edges lower as Tesla, 3M weigh; big tech earnings in focus ",04-27-21
" BitTitan Acquires Perspectium, Expands Portfolio to Address Growing Market Demand for IT Transformation Solutions ",04-27-21
" S&P 500, Nasdaq set for higher open as focus turns to tech earnings, Fed ",04-27-21
" S&P 500, Nasdaq set for higher open as focus turns to tech earnings, Fed ",04-27-21
" Stocks dip on caution before Fed, earnings ",04-27-21
" S&P 500, Nasdaq open higher as focus turns to tech earnings, Fed ",04-27-21
" S&P 500, Nasdaq open higher as focus turns to tech earnings, Fed ",04-27-21
" Parallels Desktop for Chrome OS Adds Support for AMD Ryzen 5 and Ryzen 7 Processors, and 12 New Chromebook and Chromebox Devices with Intel and AMD Chips ",04-27-21
Quisitive creates solutions for holistic digital transformation,04-27-21
" S&P 500, Nasdaq set for higher open as focus turns to tech earnings, Fed ",04-27-21
" S&P 500, Nasdaq set for higher open as focus turns to tech earnings, Fed ",04-27-21
Alida Focuses on Complete View of the Customer for Spring 2021 Product Release,04-27-21
