headline,date
" Delivery drivers face pandemic without sick pay, insurance, sanitizer ",25-03-2020
  HyperX Now Shipping Cloud Alpha S Blackout Edition ,25-03-2020
" Delivery drivers face pandemic without sick pay, insurance, sanitizer ",25-03-2020
" Walmart taps Sameer Aggarwal as CEO of Indian unit, says in touch with suppliers ",25-03-2020
 India's Flipkart and Amazon's Pantry halt services as lockdown obstructs online deliveries ,25-03-2020
 Walmart's Flipkart suspends services as India lockdown impedes online grocery deliveries ,25-03-2020
 Walmart's India e-commerce unit Flipkart suspends services due to lockdown ,25-03-2020
 Internet networks feel the strain as COVID-19 sparks surge in Canadians working from home ,24-03-2020
 REUTERS NEWS SCHEDULE AT 10 p.m. GMT/6 a.m. SGT ,24-03-2020
" Mexican Senate to vote on proposal to compel Netflix, Amazon to boost local content ",24-03-2020
" Netflix, Facebook to cut data traffic in India to ease network congestion ",24-03-2020
" Netflix, Facebook to cut data traffic in India to ease network congestion ",24-03-2020
 Amazon to stop non-essential sales in India ,24-03-2020
 Some glitches in the UK as Disney+ launches in Europe ,24-03-2020
" Amazon in India to stop non-essential sales, shipments ",24-03-2020
 The Cost of Air Freight Soars Even Higher ,24-03-2020
 Getting Great Wine Online Is Easier Than Ever ,24-03-2020
" Facebook lowers video quality in Latin America, following Europe ",23-03-2020
 Amazon teams up with Bill Gates-backed group to deliver coronavirus test kits ,23-03-2020
 Amazon teams up with Bill Gates-backed group to deliver coronavirus test kits ,23-03-2020
 Coronavirus Could Give Cuba's Flying Doctors New Wings ,23-03-2020
 Calculating the Costs of Shutting Borders to Trade ,23-03-2020
 commerce companies face disruption as India locks down to curb coronavirus ,23-03-2020
 Walmart ups minimum wage in e-commerce warehouses by $2 as orders surge on virus worries ,23-03-2020
 UK in talks with Amazon over delivering coronavirus tests - FT ,23-03-2020
 HyperX Now Shipping ChargePlay Clutch for Mobile ,23-03-2020
 Walmart ups minimum wage in e-commerce warehouses by $2 as orders surge on virus worries ,23-03-2020
 India Locks Down; H.K. Bans Non-Resident Arrivals: Virus Update ,23-03-2020
 Facebook to cut video streaming quality in virus-hit Europe ,22-03-2020
 Amazon raises overtime pay for warehouse workers ,22-03-2020
" Disney+ launch delayed in France, bandwidth use cut for Europe amid coronavirus ",22-03-2020
" Disney+ launch delayed in France, bandwidth use cut for Europe amid coronavirus - Variety ",22-03-2020
 Amazon.com to stop shipping non-essentials to consumers in Italy and France ,21-03-2020
 Amazon.com to stop shipping non-essentials to consumers in Italy and France ,21-03-2020
 Amazon.com to stop shipping non-essentials to consumers in Italy and France ,21-03-2020
 U.S. senators question Amazon on coronavirus safety at warehouses ,21-03-2020
 Stay at home stocks rise from Wall Street's coronavirus rubble ,20-03-2020
 U.S. senators question Amazon on coronavirus safety at warehouses ,20-03-2020
" Kraft Heinz talks with Amazon, Walmart daily to speed food deliveries ",20-03-2020
" YouTube, Amazon Prime forgo streaming quality to relieve European networks ",20-03-2020
 Amazon notifies shopper about U.S. probe of third-party sellers ,20-03-2020
 Wall Street advances at end of blistering week ,20-03-2020
 Stay productive when you're stuck at home with these business courses ,20-03-2020
" India plans e-commerce regulator, tighter controls under new policy-sources ",20-03-2020
 Whole Foods' New York employee tests positive for coronavirus ,20-03-2020
 Sellers' Amazon loans at risk as company limits warehouses to essential goods ,19-03-2020
 Amazon halts grocery orders to restock amid surging demand ,19-03-2020
 North Wearables Looks for a Buyer While Cash Is Running Out ,19-03-2020
 Amazon asks shoppers to cooperate with U.S. probe of third-party sellers ,19-03-2020
 Amazon asks shoppers to cooperate with U.S. probe of coronavirus price-gouging ,19-03-2020
 France says pressure on Amazon workers 'unacceptable' amid lockdown ,19-03-2020
 France says pressure on Amazon workers 'unacceptable' amid lockdown ,19-03-2020
 America's cleaners: fighting on the coronavirus front line ,19-03-2020
" William Watson: For our COVID-19 stricken economy, money helps — but action is better ",19-03-2020
 Pressures on Amazon's staff in France unacceptable - minister ,19-03-2020
 Amazon shuts New York delivery station after worker gets coronavirus ,19-03-2020
" Amazon to shut down Queens, N.Y. hub after worker tests positive for coronavirus ",19-03-2020
 European Nations Toughen Curbs; Stimulus Explodes: Virus Update ,18-03-2020
 A coronavirus emergency plan for paying your bills ,18-03-2020
 French Amazon workers protest in coronavirus pushback ,18-03-2020
 French Amazon workers protest in coronavirus pushback ,18-03-2020
 DXC Technology's Integrated Patient-Centered Care Solution Creates New Opportunities for Interoperability and Patient Engagement ,18-03-2020
 Global Warehouse Solutions Provider Selects 3CLogic Cloud Contact Center Solution to Integrate with ServiceNow CSM and Cisco ,18-03-2020
 Coronavirus pandemic hands Big Tech a chance to burnish its image ,17-03-2020
 Coronavirus pandemic hands Big Tech a chance to burnish its image ,17-03-2020
" Amazon warehouses receive only vital supplies in U.S., Europe amid coronavirus ",17-03-2020
" Amazon warehouses receive only vital supplies in U.S., Europe amid coronavirus ",17-03-2020
" LIVEBLOG: COVID-19 updates from the markets, economy, and Canadian business ",17-03-2020
" Amazon warehouses receive only vital supplies in U.S., Europe amid coronavirus ",17-03-2020
" Amazon warehouses receive only vital supplies in U.S., Europe amid coronavirus ",17-03-2020
" Amazon to receive only vital supplies at U.S., UK warehouses amid coronavirus outbreak ",17-03-2020
" Amazon prioritizes stocking essential household staples, medical goods in virus response ",17-03-2020
 Amazon stops receiving non-essential products from sellers amid coronavirus outbreak ,17-03-2020
 REUTERS NEWS SCHEDULE AT 6 a.m. GMT/2 a.m. ET ,17-03-2020
" Amazon to hire 100,000 workers as online orders surge on coronavirus worries ",16-03-2020
" Amazon to hire 100,000 workers as online orders surge on coronavirus worries ",16-03-2020
" Amazon to hire 100,000 workers as online orders surge on virus worries ",16-03-2020
" Amazon to hire 100,000 workers as online orders surge on virus worries ",16-03-2020
" Zero rates, zero impact: Fed & co fail to calm markets ",16-03-2020
 REUTERS NEWS SCHEDULE AT 11 a.m. GMT/6 a.m. ET ,15-03-2020
 REUTERS NEWS SCHEDULE AT 10 p.m. GMT/6 a.m. SGT ,14-03-2020
 Spielberg-produced Amazon mini-series in Mexico put on hold over coronavirus - letter ,14-03-2020
 Spielberg-produced Amazon mini-series in Mexico put on hold over coronavirus - letter ,14-03-2020
 Spielberg-produced Amazon mini-series in Mexico put on hold over coronavirus - letter ,14-03-2020
 Sleeping Beauty: How suspect gold reached top brands ,13-03-2020
" Coronavirus work-from-home push means long nights, employee health checks for cloud firms ",13-03-2020
" Cloud firms turn to long nights, employee health checks to survive work-from-home rush ",13-03-2020
 GTY Announces Strategic Partnership with Carahsoft Technology Corp. to Provide Leading SaaS and Cloud Solutions to Public Sector ,13-03-2020
 Pentagon seeks to reconsider parts of $10 bln cloud contract awarded to Microsoft ,13-03-2020
 Pentagon seeks to reconsider parts of $10 bln cloud contract awarded to Microsoft ,13-03-2020
 Amazon tells staff globally to work from home if possible ,12-03-2020
 Amazon tells staff globally to work from home if possible ,12-03-2020
" Italian antitrust watchdog probes Amazon, eBay over price spikes in virus crisis ",12-03-2020
" Italian antitrust watchdog probes Amazon, eBay over price spikes in virus crisis ",12-03-2020
 UPS names former Home Depot executive Carol Tomé as CEO ,12-03-2020
 William Watson: Poof! go our resource rents ,12-03-2020
" Brazil's gangs emerge as major cocaine exporters, flooding Europe with white powder ",12-03-2020
 Coronavirus fears hit the market hard. How much did ordinary Americans lose? ,11-03-2020
 Coronavirus fears hit the market hard. How much did ordinary Americans lose? ,11-03-2020
 Coronavirus fears hit the market hard. How much did ordinary Americans lose? ,11-03-2020
" Bored at home - coronavirus helps headhunters locate candidates, delays deals ",11-03-2020
" Air freight rates skyrocket amid passenger flight cuts, Chinese factory restarts ",11-03-2020
" Air freight rates skyrocket amid passenger flight cuts, Chinese factory restarts ",11-03-2020
" Air freight rates skyrocket amid passenger flight cuts, Chinese factory restarts ",11-03-2020
 Monnit Redefines Internet of Things Security with Release of SensorPrints ,10-03-2020
 Amazon and other large ecosystems at risk of rapid collapse -study ,10-03-2020
 Best Coronavirus Response? QE Plus Infrastructure Spending ,10-03-2020
" Bored at home - coronavirus helps headhunters locate candidates, delays deals ",10-03-2020
 The Hidden Costs of All These Canceled Business Trips ,10-03-2020
 Signifyd Launches Its Commerce Protection Platform to Optimize Revenue Throughout the Shopping Journey ,10-03-2020
 Top 50 Ranked U.S. University Selects 3CLogic to Integrate with ServiceNow to Improve Student and Faculty Services ,10-03-2020
 Brazil agency gives out fewest environmental fines in 24 years ,09-03-2020
" Coronavirus, oil collapse erase $5 trillion from U.S. stocks ",09-03-2020
" Coronavirus, then oil collapse erase $5 trillion from U.S. stocks ",09-03-2020
" Amazon recommends New York, New Jersey employees work from home due to virus ",09-03-2020
" Amazon recommends New York, New Jersey employees work from home due to virus ",09-03-2020
 REUTERS NEWS SCHEDULE AT 11 a.m. GMT/7 a.m. ET ,09-03-2020
 Amazon launches business selling automated checkout to retailers ,09-03-2020
 Echoworx's Enhanced Multi-factor Authentication Improves Cybersecurity With User-focused Design ,09-03-2020
 REUTERS NEWS SCHEDULE AT 6:30 a.m. GMT/2:30 p.m. SGT ,09-03-2020
 REUTERS NEWS SCHEDULE 11 a.m. GMT/6 a.m. ET ,08-03-2020
 REUTERS NEWS SCHEDULE AT 6 a.m. GMT/2 p.m. SGT ,08-03-2020
 REUTERS NEWS SCHEDULE AT 10 p.m. GMT/6 a.m. SGT ,07-03-2020
 U.S. judge says Amazon likely to succeed on key argument in contract challenge ,07-03-2020
 U.S. judge says Amazon likely to succeed in Defense cloud contract challenge ,07-03-2020
 Amazon says working with state AGs to nab sellers engaged in price-gouging over coronavirus ,06-03-2020
 SXSW festival canceled amid coronavirus outbreak ,06-03-2020
 SXSW festival canceled amid coronavirus outbreak ,06-03-2020
 SXSW festival canceled amid coronavirus outbreak ,06-03-2020
 Amazon says working with state AGs to nab sellers engaged in price-gouging over coronavirus ,06-03-2020
" Coronavirus infects more than 100,000 worldwide, wreaking financial havoc ",06-03-2020
 Rear-view mirror: U.S. hiring boomed in February but coronavirus risks job cuts in future ,06-03-2020
" Coronavirus infections pass 100,000 as outbreak wreaks financial havoc ",06-03-2020
 Digital taxes will mean higher costs for businesses and Canadians ,06-03-2020
" Coronavirus infections rise above 100,000 worldwide as outbreak wreaks financial havoc ",06-03-2020
" Coronavirus wreaks financial havoc as infections near 100,000 ",06-03-2020
" Coronavirus wreaks financial havoc as infections near 100,000 ",06-03-2020
 Sequoia Capital warns of coronavirus 'black swan' as venture investors fret ,06-03-2020
 Sleeping Beauty: How suspect gold reached top brands ,06-03-2020
 Sleeping Beauty: How suspect gold reached top brands ,06-03-2020
 Leading venture capital firm Sequoia Capital warns of coronavirus 'black swan' ,06-03-2020
 Brazil restricts environmental employees' media contact after Amazon wood exports report ,05-03-2020
 The Kids Are Back! Amazon Prime Video to Bring Back The Kids in the Hall With New Episodes as First Canadian Amazon Original Series ,05-03-2020
" New York state coronavirus cases double, Senate passes $8.3 bln spending bill ",05-03-2020
" New York state coronavirus cases double to 22, Senate passes $8.3 bln spending bill ",05-03-2020
 New York state coronavirus cases double to 22 with more testing - governor says ,05-03-2020
" Hiring neurodiverse people has given us an edge, says AirGate CEO ",05-03-2020
 Big tech firms ask Seattle employees to work from home over coronavirus fears ,05-03-2020
" Amazon, Facebook ask Seattle employees to work from home over coronavirus fears ",05-03-2020
 $194 for hand sanitiser? You must be joking ,05-03-2020
 Tropical Forests Are Reaching Their Carbon Dioxide Limit ,05-03-2020
 Facebook closes Seattle office after contractor catches coronavirus ,05-03-2020
 Amazon Nixed 'Green' Shipping Proposal to Avoid Alienating Shoppers ,05-03-2020
" Zynga Announces Harry Potter: Puzzles & Spells, A Magical Match-3 Mobile Game ",05-03-2020
 Purell for $400? U.S. lawmaker urges Amazon to tamp down price gouging ,04-03-2020
 $400 for Purell? U.S. lawmaker urges Amazon to tamp down price gouging ,04-03-2020
" (OFFICIAL) -Nestle vows to plant 3 million trees in Mexico, Brazil to help set off emissions ",04-03-2020
" Nestle vows to plant 3 million trees in Mexico, Brazil to help set off emissions ",04-03-2020
" Lawmakers Press Amazon, EBay Executives Over Counterfeit Goods ",04-03-2020
 Mitel Helps Businesses Unleash Productivity with New 'Continuous Collaboration' Solution for Work Teams ,04-03-2020
 project44 Introduces First Ever Carrier Onboarding SLA to Accelerate Visibility Results for Shippers ,04-03-2020
 What you need to know about coronavirus right now ,04-03-2020
 CAPCOM: Just tap! It's so simple! Fun puzzles! The official start of service for Snoopy Puzzle Journey! ,04-03-2020
 Brazil exported thousands of shipments of unauthorized wood from Amazon port ,04-03-2020
 Amazon confirms first coronavirus case among U.S. employees ,04-03-2020
 Alibaba's AliExpress warns of possible coronavirus delays ,03-03-2020
 Alibaba's AliExpress warns of possible coronavirus delays ,03-03-2020
" Ampere targets cloud companies with new chip, signs Oracle as customer ",03-03-2020
 A blow for stamp collectors? Germany to frank letters with codes ,03-03-2020
 Price-Gouging on Coronavirus Masks Isn't Easy to Fix ,03-03-2020
 REUTERS NEWS SCHEDULE AT 11 a.m. GMT/6 a.m. ET ,03-03-2020
" Deutsche Post DHL to expand parcel, letter tracking ",03-03-2020
 Netskrt CEO to Address UK Train Operators at Accelerate Rail 2020 in London ,03-03-2020
 Amazon adds warehouse network closer to cities to speed up same-day delivery ,03-03-2020
 John O'Hara Joins INETCO® Board of Directors ,03-03-2020
 Britain vows 'hard bargain' in list of demands for U.S. trade deal ,02-03-2020
 Britain's demands for U.S. trade talks set to test special relationship ,02-03-2020
 Britain's demands for U.S. trade talks set to test special relationship ,02-03-2020
 HyperX Now Shipping Alloy Origins Mechanical Gaming Keyboard with HyperX Aqua Switch ,02-03-2020
 Amazon's fight against $277 mln EU tax order kicks off in court on Thursday ,02-03-2020
 Amazon confirms two employees in Italy have contracted coronavirus ,02-03-2020
 Luxembourg becomes first country to make public transport free ,29-02-2020
 Zuitte is the genius app suite every entrepreneur needs when they’re getting started ,29-02-2020
" USTR vows to push for trade deals with Britain, EU; seeks reforms at WTO ",29-02-2020
" USTR vows to push for trade deals with Britain, EU; seeks broader reset at WTO ",28-02-2020
 REUTERS NEWS SCHEDULE AT 10.15 p.m. GMT/6.15 a.m. SGT ,28-02-2020
 Citron's Andrew Left closes Wayfair short bet after long wait ,28-02-2020
 Shopify pulls plug on Unite conference as list of corporate events cancelled because of coronavirus swells ,28-02-2020
 Amazon defers 'non-essential' moves even in U.S. as corporate travel bans spread ,28-02-2020
 Amazon tells employees to defer all non-essential travel due to coronavirus ,28-02-2020
 Amazon becomes latest company to tell employees to defer all non-essential travel due to coronavirus ,28-02-2020
" Chinese maker of 'Amazon coat' weathers coronavirus impact with tax breaks, rent waivers ",28-02-2020
" Chinese maker of 'Amazon coat' weathers coronavirus impact with tax breaks, rent waivers ",28-02-2020
 Baker's HBC privatization bid approved after plenty of ‘noise and aggravation’ ,27-02-2020
 Amazon bars 1 million products for false coronavirus claims ,27-02-2020
 Amazon bars 1 million products for false coronavirus claims ,27-02-2020
 Digital Tax Talks May Result in Trade War Even If Democrats Win ,27-02-2020
 OneRail Raises $5.8MM in Financing to Scale Final Mile Orchestration and Fulfillment Platform ,26-02-2020
 Employee Activism Works--Even When It Doesn't ,26-02-2020
 Dashboard of a downturn: coronavirus starts to set off some recession alarm bells ,26-02-2020
" Once bulletproof, tech stocks now among market's biggest losers ",25-02-2020
 Prescription for disruption: How Amazon could shake up Canada’s $45-billion pharmacy sector ,25-02-2020
 Dashboard of a downturn: coronavirus starts to set off some recession alarm bells ,25-02-2020
" BlackBerry, Microsoft and other heavy hitters drop product announcements at RSA Conference ",25-02-2020
 InVivo targets 3 bln euros in sales from farm supplies platform ,25-02-2020
" Eight men in frame to run Norway wealth fund, including deputy CEO ",25-02-2020
 InVivo targets 3 bln euros in sales from farm supplies platform ,25-02-2020
 Britain's Tesco tests cashless store in London ,25-02-2020
 REUTERS NEWS SCHEDULE AT 11 a.m. GMT/6 a.m. ET ,25-02-2020
 Amazon expands physical footprint with bigger cashier-less grocery shop ,25-02-2020
 TV and Cloud Gaming Market is Set for a 90% Jump According to Jon Peddie Research ,24-02-2020
 Ex-Facebook exec starts group to help employees push companies on climate ,24-02-2020
 REUTERS NEWS SCHEDULE AT 10 p.m GMT/5 p.m ET ,23-02-2020
 No global digital tax by end-2020 would mean chaos-France ,23-02-2020
" G20 finance heads eye impact of coronavirus outbreak on growth, see modest pickup ",23-02-2020
 Japan criticizes U.S. digital tax proposal at G20 ,23-02-2020
 Box Office: 'Sonic' Narrowly Beats Harrison Ford's 'Call of the Wild' ,23-02-2020
" G20 finance heads see modest growth pickup, to monitor coronavirus ",23-02-2020
 No global digital tax by end-2020 would mean digital tax chaos -France ,23-02-2020
 Wall St Week Ahead-Fund managers look for value in high-priced consumer sector ,23-02-2020
" Let's come together to tax tech giants, say G20 officials eyeing $100 bln boost ",22-02-2020
" Let's come together to tax tech giants, say G20 officials eyeing $100 bln boost ",22-02-2020
 REUTERS NEWS SCHEDULE AT 6 a.m. ET/11 a.m. GMT ,22-02-2020
" Let's come together to tax tech giants, say G20 officials eying $100 bln boost ",22-02-2020
 REUTERS NEWS SCHEDULE AT 6 a.m. GMT/2 p.m. SGT ,22-02-2020
 REUTERS NEWS SCHEDULE AT 10 p.m. GMT/6 a.m. SGT ,21-02-2020
 Timberland sees eco-green with slower delivery speeds ,21-02-2020
 EU looks to nudge down spending plans to break budget deadlock ,21-02-2020
 Green deal sprinkles stardust on European power stocks ,21-02-2020
 Wall St Week Ahead-Fund managers look for value in high-priced consumer sector ,21-02-2020
 Ross McKitrick: It's never enough with climate activists — even a staggering $10 billion from Jeff Bezos ,21-02-2020
 BOJ's Kuroda says watching with 'grave concern' as virus hits Asian economies ,21-02-2020
 Loblaw profit rises as e-commerce revenue nearly doubles to hit $1 billion ,20-02-2020
 What secrets? Apple embroiled in row over book by German former exec ,20-02-2020
 Missing inflation is no mystery — here are five ways investors can make it work for them ,20-02-2020
 How a nine-year-old's question sparked a Canadian cybersecurity conference for women ,20-02-2020
 REUTERS NEWS SCHEDULE AT 11:00 a.m. GMT/6:00 a.m. ET ,20-02-2020
 Walmart's struggling Japan unit finally delivers with online grocery growth ,20-02-2020
 Germany's Scholz expects G20 progress on tax rules for tech giants ,19-02-2020
 BlackBerry report says data losses increasing due to cloud misconfiguration ,19-02-2020
 Austrian privacy activist Schrems files complaint against Amazon ,19-02-2020
" EU bets on industrial data, new rules to catch up in global tech ",19-02-2020
 Mexico's president says foreign firms optimistic on investing ,19-02-2020
" EU bets on industrial data, new rules to catch up in global tech ",19-02-2020
 Spain's antitrust watchdog investigates Amazon delivery services ,19-02-2020
 Flying taxis only five years away as drone growth takes flight — podcast ,19-02-2020
" EU plans industrial data push, rules to rein in U.S. tech giants ",19-02-2020
" Virgin Galactic's stock soars, fueled by retail investors ",18-02-2020
 EU tax commissioner slams U.S. plans on tech tax ,18-02-2020
 Posthaste: $850M worth of manufactured goods sit idle every day as rail stoppages continue ,18-02-2020
" Cathie Wood, the best investor you've never heard of ",18-02-2020
 What Jeff Bezos's $10 billion can do for the fight against climate change ,18-02-2020
" 20 years after dot-com peak, tech dominance keeps investors on edge ",18-02-2020
 Trend Micro Reports Highest Annual Revenue and Strongest Quarterly Net Sales in Company's 31 Year History ,18-02-2020
 How Wish built a retail empire for shoppers to buy on the cheap under the nose of Amazon ,18-02-2020
 Amazon's Bezos pledges $10 bln to climate change fight ,17-02-2020
 REUTERS NEWS SCHEDULE AT 10 p.m. GMT/6 a.m.SGT ,17-02-2020
 Amazon's Bezos pledges $10 bln to climate change fight ,17-02-2020
 Bezos Says He'll Commit $10 Billion to Fight Climate Change ,17-02-2020
" EU industry chief tells Facebook to adapt to EU, not other way round ",17-02-2020
" Facebook cancels conference, IBM pulls out of RSA over coronavirus worries ",17-02-2020
" Facebook sees risks to innovation, freedom of expression ahead of EU rules ",17-02-2020
" Facebook warns of risks to innovation, freedom of expression ahead of EU rules ",17-02-2020
" Amazon, Flipkart seek rollback of new Indian tax on online sellers ",16-02-2020
" Amazon, Flipkart seek rollback of new Indian tax on online sellers ",16-02-2020
 Regulators should allow RTL and ProSieben to merge - Rabe ,16-02-2020
" Amazon, Flipkart seek rollback of new Indian tax on online sellers ",15-02-2020
" Amazon, Flipkart challenge new Indian tax on online sellers ",14-02-2020
" Coronavirus empties exhibition halls, but over time the show will go on ",14-02-2020
 Terence Corcoran: Big Tech and the myths of monopoly ,14-02-2020
 800 rate cuts on and investors throw money at everything - BofA ,14-02-2020
 Zuckerberg ready for Facebook to pay more tax as welcomes rules review ,14-02-2020
" India court stalls Amazon, Flipkart antitrust probes -lawyers ",14-02-2020
 Zuckerberg accepts Facebook may pay more tax in different places - Politico ,14-02-2020
 REUTERS NEWS SCHEDULE AT 6 a.m. GMT/2 p.m. SGT ,14-02-2020
 Judge grants Amazon motion for pause in Microsoft's Pentagon contract work ,13-02-2020
 Judge grants Amazon bid to pause Microsoft's Pentagon contract work ,13-02-2020
 Judge grants Amazon bid to pause Microsoft's Pentagon contract work ,13-02-2020
 Judge grants Amazon bid to pause Microsoft's Pentagon contract work ,13-02-2020
 Judge grants Amazon bid to pause Microsoft's Pentagon contract work ,13-02-2020
 Jeff Bezos just spent $165-million on a Beverly Hills mansion — a record for Los Angeles ,13-02-2020
 Brazil lawmakers urge Congress to shelve indigenous mining bill ,13-02-2020
" Global tax rewrite could boost governments' revenues by $100 bln, OECD says ",13-02-2020
" The trillion-dollar club runs wild, leading some investors to recall lessons from Nortel Networks ",13-02-2020
 Google's fight against EU antitrust fine comes up against critical judge ,13-02-2020
" Corporate Social Responsibility Related News Releases and Story Ideas for Reporters, Bloggers and Media Outlets ",13-02-2020
 Bezos buys Warner Estate in Beverly Hills for record $165 million ,13-02-2020
 Microsoft boss Nadella to visit India later this month- sources ,13-02-2020
 Big Tech is zeroing in on Canada as the next frontier in the cloud wars ,12-02-2020
 EU antitrust regulators plan broad enquiry into tech sector ,12-02-2020
 Tech titans' market heft could signal broader stocks worry ,12-02-2020
 Europe Notches New Trade Win as Vietnam Pact Clears Final Hurdle ,12-02-2020
 project44 Continues Global Expansion with Significant Growth in Europe ,12-02-2020
" FTC demands data on small buys by Google, Amazon, Apple, Facebook, Microsoft ",11-02-2020
 Google takes on EU in court over record antitrust fines ,11-02-2020
 REUTERS NEWS SCHEDULE AT 10 p.m. GMT/6 a.m. SGT ,11-02-2020
" FTC demands data on small buys by Google, Amazon, Apple, Facebook, Microsoft ",11-02-2020
" FTC demands data about small buys by Google, Amazon, Apple, Facebook, Microsoft ",11-02-2020
 North American stock markets hit record highs on easing of virus concerns ,11-02-2020
 Posthaste: Note to natural gas skeptics — it played a major role in curbing global carbon emissions last year ,11-02-2020
 Zuckerberg to meet EU Commissioners ahead of antitrust proposals ,11-02-2020
 Tubi Announces Record Growth For 2019 ,11-02-2020
 IKEA new CEO targets 'even more affordable' furniture as habits shift ,11-02-2020
