headline,date
" Industry Leader, Brian Buffini, Presents ""Bold Predictions 2022 Real Estate Market Outlook"" Broadcast ",13-12-2021
 Quartile Acquires Sidecar to Form Largest Cross-Channel E-Commerce Advertising Platform ,13-12-2021
 Investigation into Amazon.com Illinois building collapse opened -labor official ,13-12-2021
 Apple within a whisker of $3 trillion market value ,13-12-2021
 Investigation into Amazon.com Illinois building collapse opened - labor official ,13-12-2021
 Apple set to amass $3 trillion in market capitalization ,13-12-2021
 Apple inches closer to $3 trillion market value ,13-12-2021
 Harley to take EV unit public via SPAC deal as valuations soar ,13-12-2021
 Elon Musk named Time's 2021 'Person of the Year' ,13-12-2021
 Harley's electric motorcycle division to go public via $1.7 bln SPAC deal ,13-12-2021
 Else Nutrition Awarded Prestigious World Plant Based Award for 2021 in Best Dairy Product Alternative Category ,13-12-2021
 Daughter of pioneering astronaut Alan Shepard soars to space aboard Blue Origin rocket ,11-12-2021
" GiftChill, Largest E-Gift Cards Platform, Confirms Kishu Inu as Payment ",11-12-2021
" Kevin O'Leary has gone on a crypto binge, but his investment fund has different ideas ",10-12-2021
" Costco warns of holiday delays for toys, seasonal items amid supply chain crunch ",10-12-2021
 Playgon Games Inc. (TSX.V: DEAL) (OTCQB: PLGNF) Laser Focused on B2B iGaming Market ,10-12-2021
" Fobi Announces Partnership with Janam Technologies To Offer Contactless Venue Solutions Targeting Hospitality, Ticketing, Retail, Health Care and Other Verticals ",10-12-2021
" Hobbit, Sauron and Gollum makeovers in New Zealand as Lord of the Rings turns 20 ",10-12-2021
" Starbucks workers vote to unionize at Buffalo, New York, store ",09-12-2021
 Software maker HashiCorp valued at $16 bln in Nasdaq debut ,09-12-2021
" Starbucks workers deliver union a win, a loss, at two New York stores ",09-12-2021
 'What Does a Beaver Do?' the Fifth Installment in the Award-Winning Canadian Children's Series Now Available ,09-12-2021
" Starbucks workers deliver union a win, a loss, at two New York stores ",09-12-2021
" Starbucks workers vote to organize at one New York store, reject union at another cafe ",09-12-2021
" Starbucks loses bid to stave off labor union in Buffalo, New York ",09-12-2021
 Outage shows how Amazon's complex cloud makes backup plans difficult ,09-12-2021
 Software maker HashiCorp valued at $16 bln in Nasdaq debut ,09-12-2021
 MacKenzie Scott keeps donations secret in latest giving spree ,09-12-2021
 Outage shows how Amazon's complex cloud makes backup plans difficult ,09-12-2021
 Macron: EU will draw up regulation to fight hate on social media ,09-12-2021
 Posthaste: Canadians should brace for the biggest surge in food prices in more than decade ,09-12-2021
 Inflation busters: 8 ways to stretch your money and fight soaring prices ,09-12-2021
 A life uninterrupted: CEO of iconic Canadian retail chain opens up about being bipolar ,09-12-2021
" Block Society Co-Founder Faris Khan Executes Launch of Automated COVID-19 Screening Solution ""IHS Screening"" at ISNA High School in Mississauga, ON ",09-12-2021
 Varicent Unveils Major Enhancements for Its Industry-Leading ICM Solution ,09-12-2021
 Outage shows how Amazon's complex cloud makes backup plans difficult ,09-12-2021
" Sera Labs, a Subsidiary of CURE Pharmaceutical, Consummates Exclusive International Distribution Agreement With Leading Canadian Distributor ",09-12-2021
" Nextech AR to Present at ""The Metaverse & Augmented Reality Labs"" Event with Technology And Edtech Partners ",09-12-2021
 Italy fines Amazon record $1.3 bln for abuse of market dominance ,09-12-2021
 Italy fines Amazon record $1.3 bln for abuse of market dominance ,09-12-2021
 Tech firms say EU rules should ensure they are regulated in their bases ,09-12-2021
 Mining companies express worry over Ecuador court ruling ,08-12-2021
" Pitfalls of a smart home: Amazon outage left people without working fridges, lights and even access to homes ",08-12-2021
 McDonald’s pledges more diverse franchisees across the world ,08-12-2021
 Wall Street mixed as Omicron worries cloud vaccine update ,08-12-2021
" Amazon Ads Deceive Consumers, Unions Say in Complaint to U.S. Regulator ",08-12-2021
 Apple inches closer to $3 trillion market cap ,08-12-2021
 Apple inches closer to $3 trillion market cap ,08-12-2021
 IMDb Announces Top 10 Movies and TV Shows of 2021 ,08-12-2021
 U.S.-Israeli firm Tipalti raises $270 mln at more than $8 bln valuation ,08-12-2021
 DAVIDsTEA Partners with BetterSleep App to Support the Connection Between Tea and Healthy Sleep ,08-12-2021
" Nextech AR Integrates With Coinbase Commerce, Now Accepting Cryptocurrency As Payment Method ",08-12-2021
 Futures rise after positive vaccine update from Pfizer ,08-12-2021
" 'Everybody's feeling the heat': Amazon's trucking ambitions bump up against driver shortage, competition ",08-12-2021
 Cognitive Space 2021 Recap – Momentum in Artificial Intelligence for Satellite Operations ,08-12-2021
" Amazon cloud outage hits major websites, streaming apps ",07-12-2021
" Amazon cloud outage hits major websites, streaming apps ",07-12-2021
" Amazon's Prime, Ring and other apps down for thousands of users ",07-12-2021
 Toronto's GoodGood eyes national rollout as ultra-fast delivery market speeds up ,07-12-2021
 Amazon offered France deal to have bill protecting bookshops pulled ,07-12-2021
" Amazon's Prime, Ring and other apps down for thousands of users ",07-12-2021
" Wall Street leaps as Nasdaq rallies 3% on boost from Big Tech, chipmakers ",07-12-2021
 Amazon services down for thousands of users - Downdetector.com ,07-12-2021
 Amazon services down for thousands of users - Downdetector.com ,07-12-2021
" Big Tech, chipmakers power Nasdaq as Omicron worries subside ",07-12-2021
" Delphix, Unisys Transform California State University's Digital Strategy With Fast, Secure Data for Application Development ",07-12-2021
 Ingram Micro Cloud Launches Contracts Alliance Program to Support AWS Cloud Opportunities in the Public Sector ,07-12-2021
 Wall St set to open 1% higher as tech stocks roar back ,07-12-2021
" Ingram Micro Acquires Brlink, Strengthening Its Partner Ecosystem with New Managed Services ",07-12-2021
 Wall St set to open 1% higher as tech stocks roar back ,07-12-2021
" Nextech AR CEO Evan Gappelberg Buys 72,656 Shares of Company Stock In Open Market ",07-12-2021
 Else Nutrition to Participate in the Lytham Partners Winter 2021 Investor Conference ,07-12-2021
 Nasdaq futures jump as tech stocks bounce back ,07-12-2021
 EU antitrust regulator seeks input on Microsoft's $16 bln Nuance deal ,07-12-2021
 Nasdaq to eclipse NYSE in record year for IPOs ,06-12-2021
 Jeff Bezos gives $443 million to climate groups in Earth Fund push ,06-12-2021
 Genesys valued at $21 bln after latest funding round ,06-12-2021
" U.S. labor movement's next frontier is the tech industry, AFL-CIO's Shuler says ",06-12-2021
" Halio, Inc. Announces $100M Financing Led by SK and Capricorn ",06-12-2021
 TOMI launches SteraMist Amazon Store featuring the SteraPak SteraPak Leading Disinfection System for All Industries ,06-12-2021
" Lifeist Subsidiary Mikra Cellular Sciences to Launch First Product ""CELLF"" to Combat Brain Fog and Unlock Healthy Aging, Announces U.S. Patent Application and Pre-Clinical Study ",06-12-2021
" Else Nutrition Establishes North American Office in Columbus, Ohio, Behind Growth Plans ",06-12-2021
 Don't miss out on the Amazon Flip-a-Thon ,04-12-2021
" U.S. labor movement's next frontier is the tech industry, AFL-CIO's Shuler says ",04-12-2021
 Purpose and Drop Partner to Launch New Cryptocurrency Rewards ,03-12-2021
 Quebec's maple syrup cartel should be sweeter ,03-12-2021
 Lyft names Amazon Studio's Elaine Paul as CFO ,02-12-2021
 Lyft names Amazon Studio's Elaine Paul as CFO ,02-12-2021
 Lyft names Elaine Paul as CFO ,02-12-2021
" Proactive news headlines including Pan-Biome Pharmaceuticals, Kootenay Silver, Trillion Energy International and Champion Gaming Group ",02-12-2021
 California should eliminate oil extracted from Amazon rainforest -NGOs ,02-12-2021
 Vietnam factories short of workers after heavy-handed lockdowns -Cento Ventures ,02-12-2021
 Wharton's Jeremy Siegel warns that stocks could drop 10 per cent in December -- hold fast with these 3 'conservative' tech picks ,02-12-2021
 Softchoice Wins 2021 AWS US Rising Star of the Year Partner Award ,02-12-2021
 Fobi Announces Signing Of Amazon Fulfillment And Business Seller Agreement ,02-12-2021
" Corporate Social Responsibility Related News Releases and Story Ideas for Reporters, Bloggers and Media Outlets ",02-12-2021
" The metaverse is already here, and crypto will save it from Big Tech dominance ",02-12-2021
 Strategic Business Update - Acquisition of Precise-ITC and completion of major milestones for China Product Partnership ,02-12-2021
 U.S. Senate panel advances Biden's pick Bedoya for FTC ,01-12-2021
 Matterport Delivers New and Innovative Solutions for the Built World with AWS ,01-12-2021
 Aurora Accelerates Development of the Aurora Driver with AWS ,01-12-2021
 Virtusa Wins 2021 AWS Industry Solution NSI Partner of the Year - US ,01-12-2021
 NetApp Delivers Award-Winning Innovation to Enable Digital Transformation on AWS ,01-12-2021
 Investor group warns livestock industry needs to do more on methane ,01-12-2021
" Amazon Investing in 274 Renewable Energy Projects Globally, Adds 18 New Projects in Europe and U.S. ",01-12-2021
 Investor group warns livestock industry needs to do more on methane ,01-12-2021
 Meat & Dairy Results Sour COP26 Ambitions on Methane and Deforestation ,01-12-2021
" New York accuses Amazon of backsliding over worker safety, seeks monitor ",01-12-2021
 U.S. labor secretary visits top West Coast ports as union talks loom ,30-11-2021
 Broken Supply Chains Threaten Ruin at a Growing Number of Small Firms ,30-11-2021
" New York accuses Amazon of backsliding over worker safety, seeks monitor ",30-11-2021
" Amazon offers new data tool to help carmakers prevent recalls, improve safety ",30-11-2021
" Amazon's cloud unit launches new chips to take on Intel, Nvidia ",30-11-2021
 Goldman launches cloud-based software in partnership with Amazon Web Services ,30-11-2021
" Amazon's cloud unit launches new chips to take on Intel, Nvidia ",30-11-2021
" Amazon offers new data tool to help carmakers prevent recalls, improve safety ",30-11-2021
 Ambyint Achieves AWS Energy Competency Status ,30-11-2021
 AMD EPYC™ Processor Offerings Continue to Grow at AWS With New Instances for General Purpose Compute ,30-11-2021
 Plug Power and ACCIONA Energía Launch AccionaPlug to Address Green Hydrogen Market in Spain and Portugal ,30-11-2021
 Launch of C.A.M.P by DAVIDsTEA x Ethical Tea Partnership: A Sustainable Tea Community Project ,30-11-2021
 Eat Well Group Announces Amara's Toddler Line is the #1 New Release on Amazon ,30-11-2021
 Nextech AR Launches ARitize 3D SaaS Offering For Ecommerce ,30-11-2021
 Yooma Wellness Reports Results for Third Quarter of 2021 ,29-11-2021
 Else Nutrition Reports Third Quarter 2021 Results ,29-11-2021
 U.S. labor board official orders Amazon to redo union vote at Alabama warehouse ,29-11-2021
 Amazon Alabama facility ordered to re-run union election -U.S. labor board ,29-11-2021
 Amazon Warehouse Workers in Alabama Will Get a Second Union Election ,29-11-2021
 Britain open to law to combat rise in online scams - minister ,29-11-2021
" For many Canadian businesses, online retail has provided a lifeline ",29-11-2021
" Lifeist Launches Mikra, a Biosciences and Consumer Wellness Company Operating at the Intersection of Cellular Health and Human Aspiration ",29-11-2021
 Walmart veteran Biggs to step down as CFO next year ,29-11-2021
 BlueCat announces integration with AWS to help enterprises manage IP space in cloud environments ,29-11-2021
 Gilead and AWS Collaborate on Development and Delivery of New Medicines for Patients ,29-11-2021
 Virtusa Signs Strategic Collaboration Agreement with AWS to Help Global Enterprises Get the Full Value of Cloud Investments ,29-11-2021
 Digital gifts like e-learning courses can help you skip holiday shipping delays ,28-11-2021
" Amazon to open Abu Dhabi fulfillment center by 2024, says govt media office ",28-11-2021
 Britain on track for record Black Friday sales ,26-11-2021
 Britain on track for record Black Friday sales ,26-11-2021
 Britain on track for record Black Friday sales ,26-11-2021
" Amazon's Black Friday greeted by climate activists, strikes in Europe ",26-11-2021
" Amazon's Black Friday struck by climate activists, strikes in Europe ",26-11-2021
 Thai oil firm PTT expands pharma business with $475 mln Alvogen deal ,26-11-2021
 France's CGT union calls for Amazon workers to strike on Black Friday ,26-11-2021
 The 'Tesla-financial complex': how carmaker gained influence over the markets ,26-11-2021
 Climate activists target Amazon depots in Britain on 'Black Friday' ,26-11-2021
 Climate activists target Amazon depots in Britain on 'Black Friday' ,26-11-2021
 Climate activists target Amazon depots in Britain on 'Black Friday' ,26-11-2021
 Shortages cast shadow over Britain's Black Friday ,26-11-2021
" Semiconductor industry group calls for national strategy to attract fabrication plants, support scale-ups ",25-11-2021
 'We're right at this inflection point': Coveo looks to growth following $215-million IPO ,25-11-2021
 Innovating for life ,25-11-2021
" Own a slice of Apple, Microsoft — plus others — for $1 with fractional shares ",25-11-2021
 CLC: New Worker Lockdown Benefit Fails to Benefit Workers ,25-11-2021
 DAVIDsTEA and The Glenlivet Partner to Re-imagine the Classic Hot Toddy ,25-11-2021
 EU countries agree on common stance on new rules for U.S. tech giants ,25-11-2021
 Prada's heir designate vows to keep group in family hands ,25-11-2021
 Investors watch retail stocks as U.S. holiday shopping beckons ,24-11-2021
" Amazon seeks to pause antitrust review of 2019 deal with India's Future, documents show ",24-11-2021
 Amazon-backed EV firm Rivian delays deliveries of R1S SUVs - reports ,24-11-2021
 German union urges Amazon workers to strike on 'Black Friday' ,24-11-2021
 German union calls on Amazon workers to go on strike on 'Black Friday' ,24-11-2021
 Investors watch retail stocks as U.S. holiday shopping beckons ,24-11-2021
" Fintech Tipalti Accelerates Global Expansion With New Toronto, Canada Location ",24-11-2021
 Plug Power Selected by Fertiglobe's Green Hydrogen Consortium to Deliver 100MW Electrolyzer for Green Ammonia ,24-11-2021
" Lights, camera.. anyone? Film studios can't get the crew ",24-11-2021
 Texas wins contest to host Samsung's new $17 bln chip plant ,24-11-2021
" Proactive news headlines including Coinsilium, EverGen Infrastructure, Clean Seed Capital, Western Magnesium, Audacious, Empower Clinics and NEO Battery Materials ",23-11-2021
 Spotify launches 'Netflix Hub' on its app to attract fans ,23-11-2021
" With U.S. inventories tight, 'Black Friday' drags through November ",23-11-2021
" GiftChill, E-Gift Cards Giant Retailer, Confirms Shiba as Payment Method ",23-11-2021
 EU's Vestager cheers as lawmakers vote for tougher tech laws ,23-11-2021
 EU's Vestager cheers as lawmakers vote for tougher tech laws ,23-11-2021
 Nextech AR Appoints Jeff Dawley To Its Board Of Directors And As Chair Of The Audit Committee ,23-11-2021
" With U.S. inventories tight, 'Black Friday' drags through November ",23-11-2021
 Can artificial intelligence help close gender gaps at work? ,23-11-2021
 Amazon and Apple handed $225 mln in Italian antitrust fines ,23-11-2021
 Amazon and Apple handed $225 mln Italian fine for alleged collusion ,23-11-2021
 Aqara Launches AI-Enabled Camera Hub G3 ,23-11-2021
 Employees of India's Future Retail urge top court to clear asset sale in Amazon dispute ,23-11-2021
 Asia's Richest Man Looks to Walton Family Playbook on Succession ,22-11-2021
 Nasdaq and S&P 500 end down after hitting record highs ,22-11-2021
 CIBC Innovation Banking hires JPMorgan’s Ryan Enriquez for New York office ,22-11-2021
 S&P 500 ends lower after Powell nomination ,22-11-2021
 S&P 500 hits record as banks rally on Powell nomination ,22-11-2021
" For Brazil co-op, price of first carbon-neutral coffee is sweet ",22-11-2021
" Posthaste: After blistering rally, can the TSX index run up another 2,000 points next year? ",22-11-2021
 U.S. FTC recommended lawsuit against Amazon over privacy breaches at Ring - the Information ,22-11-2021
 Union group says U.S. should reject Amazon's plan to buy MGM ,22-11-2021
 Opening Remarks: Broadcasting Notice of Consultation CRTC 2021-281 – Application for Rogers Communications Inc. for Authority to Acquire Effective Control of Shaw Communications Inc. (Application No. 2021-0228-4) ,22-11-2021
 Opening Remarks: Broadcasting Notice of Consultation CRTC 2021-281 – Application for Rogers Communications Inc. for Authority to Acquire Effective Control of Shaw Communications Inc. (Application No. 2021-0228-4) ,22-11-2021
 Bezos donates $100 mln to Obama foundation in honor of congressman John Lewis ,22-11-2021
" S&P, Nasdaq hit record highs after Powell nomination seen as safe bet ",22-11-2021
 ZICIX Announces Plan to Join The Amazon For Life Project ,22-11-2021
 Wall Street set to rise as COVID-sensitive sectors recover ,22-11-2021
 Visa's Amazon spat shows power is shifting to retailers in fee battle ,22-11-2021
 Yooma Wellness Announces UK Rollout of Vitality CBD Products in ASDA Stores ,22-11-2021
 U.S. lawmakers call for privacy legislation after Reuters report on Amazon lobbying ,22-11-2021
 Princes to paupers: India's salesmen face ruin as tycoon Ambani targets mom-and-pop stores ,22-11-2021
 Wall St Week Ahead-Investors bet on second wind for lagging U.S. small caps ,21-11-2021
 India police charge Amazon execs in alleged marijuana smuggling case ,20-11-2021
 Amazon is expanding it's cloud computing business in Western Canada ,20-11-2021
 India police charge Amazon execs in alleged marijuana smuggling case ,20-11-2021
" Ecuador planning bids for oil blocks, refinery in 2022 -minister ",19-11-2021
 Wall St Week Ahead-Investors bet on second wind for lagging U.S. small caps ,19-11-2021
" Spike in Amazon deforestation draws shock, ups pressure on Brazil ",19-11-2021
 Visa's chief financial officer expects to resolve fee row with Amazon ,19-11-2021
 Wall St Week Ahead-Investors bet on second wind for lagging U.S. small caps ,19-11-2021
 Rivian's electric van for Amazon raises battery power doubts - The Information ,19-11-2021
 Visa's CFO confident of resolving fee row with Amazon ,19-11-2021
 Visa CFO Prabhu says company confident of resolving Amazon dispute ,19-11-2021
 Canada flood shows how climate change could fuel atmospheric river storms ,19-11-2021
 Broken Supply Chains Threaten Ruin at a Growing Number of Small Firms ,19-11-2021
 A look at the intimate details Amazon knows about us ,19-11-2021
 The Amazon lobbyists who kill U.S. consumer privacy protections ,19-11-2021
 Deforestation of Brazil's Amazon jumps 22% in annual gov't report ,18-11-2021
 Brazil deforestation data shows 22% annual jump in clearing of Amazon ,18-11-2021
" Proactive news headlines including Forward Water Technologies, Fireweed Zinc, Altiplano Metals, EverGen Infrastructure and Progressive Planet ",18-11-2021
" Banks' lending recovery seen clouded by surging inflation, bond yields ",18-11-2021
 Independent Pilot Research Survey Demonstrates Else Products Dramatically Improved Major Feeding Related Disorders & Symptoms in Large Majority of Children ,18-11-2021
 Else to Expand Sales into Europe with Amazon ,18-11-2021
 CORRECTED (OFFICIAL)-Starbucks links with Amazon Go for first cashier-less cafe ,18-11-2021
 Protegrity Data Protection Platform and Cloud Protect for Snowflake Now Available in the Microsoft Azure Marketplace ,18-11-2021
 Adobe taps startup Bolt to add one-click checkouts to commerce sites ,18-11-2021
 Leading Enterprises Turn to Magnet AXIOM Cyber to Investigate Critical Cybersecurity Incidents ,18-11-2021
 J. J. Keller Further Expands Safety & Compliance Solutions to Canada and Mexico ,18-11-2021
" Iveco Group presents its Business, Strategy and 2026 Financial Ambitions ",18-11-2021
 Digital Motorsports Launches World Cup with US-Based TV Channel ESTV to Deliver the Event Live on its Global Network ,18-11-2021
 Else Nutrition Receives Conditional Approval to Graduate to the Toronto Stock Exchange ,18-11-2021
 DAVIDsTEA Launches Steeping Together: A Podcast for All Tea Fans Out There ,18-11-2021
 Nextech AR Launches Major 3D Metaverse Upgrade To Its Events Platform ,18-11-2021
 Daniel Schwanen: We don't need new competition laws for Big Tech ,18-11-2021
 Starbucks links with Amazon Go for first cashier-less cafe ,18-11-2021
" Blair on Brexit, Taiwan; Bayer Won't Split: NEF Update ",18-11-2021
 Paytm's Sharma goes from 'ineligible' bachelor to billionaire ,18-11-2021
 EU lawmakers agree on rules to target big tech- FT ,17-11-2021
 Amazon may drop Visa as partner on U.S. credit card ,17-11-2021
" Amazon bans Visa cards in UK, stepping up battle with payments giant ",17-11-2021
" Amazon bans Visa cards in UK, stepping up battle with payments giant ",17-11-2021
 Wall Street dips on rate hike uncertainty; Visa weighs on Dow ,17-11-2021
 Beyond Meat's Delayed Chicken Launch Raises Growth Questions  ,17-11-2021
 Amazon to stop accepting Visa's UK-issued credit cards over high fees ,17-11-2021
 E-Gift Cards Provider GiftChill Adds Vouchers of the E-Commerce Giant ,17-11-2021
 Amazon to stop accepting Visa credit cards in Britain ,17-11-2021
 Wall Street dips on rate hike uncertainty ,17-11-2021
 Posthaste: Why Canada's surprise housing heat wave might just be a market head fake ,17-11-2021
 Amazon to stop accepting Visa credit cards in U.K. in battle over high fees ,17-11-2021
 Retailers tap shoppers' data to sell more ads ahead of holidays ,17-11-2021
 Amazon to stop accepting Visa's UK-issued credit cards over high fees ,17-11-2021
 Amazon to stop accepting Visa credit cards issued in UK - Bloomberg News ,17-11-2021
 Amazon to stop accepting Visa credit cards issued in UK - Bloomberg News ,17-11-2021
 Illumina defends Grail deal; expects EU formal objections on Wednesday ,16-11-2021
" Google Cloud, Snap, Spotify and several other sites down ",16-11-2021
" Google, Amazon and several other websites down ",16-11-2021
 The E-Gift Cards Giant GiftChill to Accept Dogecoin as Payment ,16-11-2021
 Why extended reality is powering the next generation of technology companies ,16-11-2021
 'PR'S Got Talent' Cast Announced for Industry's First Live Variety Show ,16-11-2021
 Author Thom Ryerson releases his third Brant County Sound Book as an E-Publication ,16-11-2021
 The PlayStation Plus subscription comes with stellar perks ,16-11-2021
 Amazon's healthcare business has landed Hilton as a key customer ,16-11-2021
 DAVIDsTEA Expands into Superfood Tea Powder with New Hot Chocolate Blends ,16-11-2021
" Ecuador indigenous community welcomes judges to jungle, demands role in mining decisions ",16-11-2021
 U.S. satellite TV firm Dish ties up with Cisco to sell 5G to businesses ,16-11-2021
 Nextech AR Solutions Rebrands as a Metaverse Company ,16-11-2021
" New Art Book Release Date: December 1, 2021 by Santo Cervello from Actor's Corner Café: 'Time Gates The Intuitive Art of Santo Cervello' Volume V ",16-11-2021
 The art of the rebrand: Facebook's risky transformation into Meta might just pay off ,16-11-2021
 Scroll through TikTok to see the real stars of the workplace ,16-11-2021
 Faire Valuation Grows to $12.4 Billion With $400 Million Series G Funding Round Co-Led by Durable Capital Partners LP ,16-11-2021
 Latinx-led Production House Exile Content Studio Acquires Pioneering Latin American and Spanish-language Podcast Leader Dixo ,16-11-2021
 The long and short of Lightspeed’s Spruce Point spat ,15-11-2021
 Amazon's healthcare business has landed Hilton as a key customer ,15-11-2021
 Amazon's healthcare business has landed Hilton as a key customer ,15-11-2021
 KMWorld 2021 Gold Sponsor Lucidea Showcasing Unmatched KM Software ,15-11-2021
 Tesla shares approach bear market territory on prolonged selloff ,15-11-2021
 Puppy love: How pet parents cope with costs ,15-11-2021
" 'Want me to sell more stock, Bernie?' Just say the word — Elon Musk snipes at Sanders on Twitter ",15-11-2021
 Sonoma Pharmaceuticals Reports Second Quarter FY 2022 Financial Results ,15-11-2021
 TrackX Announces Senior Retail Executive is Joining Its Board of Directors ,15-11-2021
 HempFusion Reports Strong Q3 2021 Financial Results ,15-11-2021
 HyperX Cloud Flight Wireless Gaming Headset Lineup Expands to Include PS5 Support ,15-11-2021
 'Resurrections': Second-biggest cinema chain Cineworld nears pre-COVID sales ,15-11-2021
" IBM, Amazon partner to extend reach of data tools for oil companies ",15-11-2021
 India's Future discloses new documents to bolster case against Amazon deal ,14-11-2021
 U.N. climate summit reaches carbon markets deal ,13-11-2021
 Amazon worker group in New York withdraws petition for union vote ,13-11-2021
 Amazon worker group in New York withdraws petition for union vote ,12-11-2021
 Amazon worker group in New York withdraws petition to organize union ,12-11-2021
 Else Nutrition Announces Grant of Stock Options ,12-11-2021
 Nobul Expands Leadership Team With Four New Key Executives to Accelerate Growth ,12-11-2021
" TOMI Environmental Solutions, Inc. Reports Third Quarter 2021 Financial Results ",12-11-2021
