headline,date
" Stocks rally, dollar slumps after Fed statement, Powell remarks ",01-02-2023
" Stocks rise, dollar falls after Fed hikes as expected ",01-02-2023
 Tech Giants Broke Their Spending Records on Lobbying Last Year ,01-02-2023
 Polish competition watchdog accuses Amazon EU of misleading consumers ,01-02-2023
" MANSCAPED® Debuts Latest Primetime Commercial Starring Brand Partner, Pete Davidson, and New Product, The Beard Hedger™ ",01-02-2023
 Apple embraces potential of sports streaming with MLS deal ,01-02-2023
 Google has the next move as Microsoft embraces OpenAI buzz ,01-02-2023
" Stocks dip, dollar falls as Fed decision looms ",01-02-2023
" Boomi Appoints Former Citrix Executive as President and CFO, and Former SAP Executive as CMO ",01-02-2023
" Brazil readies task force to expel miners from Yanomami lands, officials say ",01-02-2023
 Stocks Drop With Fed Rate Decision Coming Shortly: Markets Wrap ,01-02-2023
 A quart and two halves ,01-02-2023
 End of easy-cash era is going to hurt ,01-02-2023
" Brazil readies task force to expel miners from Yanomami lands, officials say ",01-02-2023
 Penguin Random House US CEO Madeline McIntosh to step down ,31-01-2023
" Amazon illegally threatened NYC workers ahead of union votes, judge finds ",31-01-2023
" Ventana Research Awards InterSystems IRIS an ""Exemplary"" Rating and a Top Ranking in its 2023 Value Index for Data Platforms Report ",31-01-2023
 Norway wealth fund posts record $164 bln loss ,31-01-2023
 Teraco to Expand Data Centers With $680 Million in Debt Funding ,31-01-2023
 'Soft landing' or 'no landing'? ,31-01-2023
 TGS Esports Signs Non-Binding Term Sheet to be Acquired by Midnight Gaming ,31-01-2023
 Amazon Sets a New Record for Most Renewable Energy Purchased by a Single Company ,31-01-2023
 Plug Power and Johnson Matthey announce long-term strategic partnership to accelerate the hydrogen economy ,31-01-2023
 North American markets rally; recover some of last week's losses ,30-01-2023
" Stocks fall, U.S. yields climb as central bank hikes awaited ",30-01-2023
" Stocks fall, U.S. yields climb with central banks on tap ",30-01-2023
" Nasdaq falls as megacaps drop ahead of earnings, Fed meet in focus ",30-01-2023
" Copper under pressure, China demand worry dominates mood ",30-01-2023
" Boomi Named a Leader for Ninth Consecutive Time in Gartner® Magic Quadrant™ for Integration Platform as a Service, Worldwide ",30-01-2023
" Stocks dip, U.S. yields rise ahead of central bank flurry ",30-01-2023
" Nasdaq falls as megacaps drop ahead of earnings, Fed meet in focus ",30-01-2023
" Copper under pressure, China demand worry dominates mood ",30-01-2023
 EU recovers appetite for trade in green industry push ,30-01-2023
 Flora Growth Issues 2023 Revenue Guidance of $90 Million to $105 Million Reflecting Anticipated Year Over Year Growth Exceeding 100% ,30-01-2023
" From ashes to fly larvae, new ideas aim to revive farm soil ",30-01-2023
" Copper under pressure, China demand worry dominates mood ",30-01-2023
 This might hurt ,30-01-2023
 Adani accuses short-seller Hindenburg of attacking India ,30-01-2023
 Asian shares fall in muted trading ahead of Fed meeting ,30-01-2023
" Stocks Fall With Eyes on Rate Hikes, Adani, China: Markets Wrap ",30-01-2023
 Scholz urges swift EU-Mercosur free trade deal on first South America trip ,29-01-2023
" Argentine Leader Expects Mercosur, EU to Close Trade Deal Soon ",29-01-2023
 Amazon axes free grocery delivery on Prime orders under $150 ,27-01-2023
 Intel says it will recover share from AMD but some are skeptical ,27-01-2023
 Take Five: Goldilocks and the three bears ,27-01-2023
 Adani mulls suing US short-seller as shares sink up to 20% ,27-01-2023
" Stumbling Intel, seeing AMD gain ground, says it will recover balance ",27-01-2023
 Brazil says plans green bond sale this year ,26-01-2023
 Ecuador says illegal mining is national security threat ,26-01-2023
" Brazil plans green bond sale, debt chief says ",26-01-2023
 GURU Organic Energy Announces Fourth Quarter and Fiscal 2022 Financial Results ,26-01-2023
 Big Tech's job cuts spur rallies even as economic slowdown looms ,25-01-2023
 Microsoft recovers services after cloud outage hits users around the world ,25-01-2023
" AmazonSmile's end is alarming, say nonprofits that benefited ",25-01-2023
 Microsoft cloud outage hits users around the world ,25-01-2023
 99% of HPU Graduates Are Employed or Furthering Their Education Within 180 Days ,25-01-2023
 Revolutionary Augmented Reality Concert Experience Unveiled by tagSpace for Upcoming TV Series 'Melody' ,25-01-2023
 GeoComply Targets New Markets with Latest Investors ,25-01-2023
" Amazon workers hold first UK strike, adding to labor turmoil ",25-01-2023
 Amazon workers walk out over pay in first UK strike ,25-01-2023
 Traders Prepare for Rapid Reversal of BOE Rate Hikes: City Latest ,25-01-2023
 Microsoft cloud outage hits users around the world ,25-01-2023
 Aviation Comeback Continues: The London Rush ,25-01-2023
 Amazon warehouse workers at Coventry walk out over pay in UK first ,25-01-2023
 Biden administration continues Trump antitrust focus on tech giants ,24-01-2023
 Flexible office spaces on the rise with Canadian companies still deciding how to work ,24-01-2023
 Justice Dept. sues Google over digital advertising dominance ,24-01-2023
 Walmart to raise minimum wage for U.S. hourly workers to $14 ,24-01-2023
 Big Tech layoffs are hitting diversity and inclusion jobs hard ,24-01-2023
" In Celebration of World Breast Pumping Day, Medela Launches New Wearable Breast Pump with Transparent Anatomic Design to Optimize Milk Flow; New Apparel Collection to Enhance Breastfeeding Experience ",24-01-2023
" Alphabet's DeepMind lays off staff, closes Edmonton office ",24-01-2023
" After a long, cold year, investors are flocking back to Europe ",24-01-2023
 causaLens launches the first operating system for decision-making - powered by Causal AI ,24-01-2023
 Amazon launches a subscription prescription drug service ,24-01-2023
 Amazon deepens healthcare push with $5 monthly subscription ,24-01-2023
 AWS Launches Second Infrastructure Region in Australia ,23-01-2023
 Amazon is a value stock in topsy-turvy new world of investing ,23-01-2023
 Federal fund backs Xanadu with $40M to develop quantum computing technology ,23-01-2023
" Spotify latest tech name to cut jobs, axes 6% of workforce ",23-01-2023
 Big tech job cuts keep coming; Dell latest to trim headcount ,23-01-2023
 Amazon launches dedicated air cargo service in India as online sales soar ,23-01-2023
 CNH Industrial workers on strike since May approve new deal ,22-01-2023
 Brazil's new president works to reverse Amazon deforestation ,22-01-2023
 Wall St Week Ahead-Tech stock rebound faces doubters with earnings season ahead ,22-01-2023
 Brazil declares public health emergency for Yanomami people ,21-01-2023
 Amazon's AWS to invest $35 bln in Virginia ,21-01-2023
 Wall St Week Ahead-Tech stock rebound faces doubters with earnings season ahead ,21-01-2023
" Virginia, Amazon announce $35 billion data center plan ",20-01-2023
 Wave of tech layoffs tips power back in favour of employers in sector ,20-01-2023
 Amazon's AWS to invest $35 bln in Virginia ,20-01-2023
 Oil Rig That's Treading Water Is Costing Brazil $1 Million a Day ,20-01-2023
 Tech industry job cuts come rapidly and in big numbers ,20-01-2023
 Wall St Week Ahead-Tech stock rebound faces doubters with earnings season ahead ,20-01-2023
 How (and where) to watch the AP Top 25 Movies online ,20-01-2023
 LTIMindtree Reports Strong Performance in Q3 FY23 ,20-01-2023
" Google axes 12,000 jobs as layoffs spread across tech sector ",20-01-2023
" Google to slash 12,000 jobs — 6% of its global workforce ",20-01-2023
 Brazil launches first anti-deforestation raids under Lula bid to protect Amazon ,20-01-2023
 Purpose Investments Inc. Announces January 2023 Distributions ,20-01-2023
" Netflix's 4Q subscribers surge, long-time CEO passes baton ",19-01-2023
 US union membership rate hits all-time low despite campaigns ,19-01-2023
 Real estate trust hangs 'for sale' sign on nerve centre of Canadian internet ,19-01-2023
 Davos 2023: Global trade rethink: 'race of the big pockets'? ,19-01-2023
 Hootsuite to cut 7% of staff in third set of layoffs ,19-01-2023
 Fashion sneakers propel sustainable rubber in Brazil Amazon ,19-01-2023
 MARZ Unveils Vanity AI VFX Solution for Hollywood ,19-01-2023
 Dollar climbs on safe haven bids; yen regains footing as speculators take charge ,19-01-2023
 Dollar rises on safe haven bids; yen regains footing ,19-01-2023
" Microsoft to shed 10,000 jobs, adding to glut of tech layoffs ",18-01-2023
" Microsoft to shed 10,000 jobs, adding to glut of tech layoffs ",18-01-2023
" Microsoft, Amazon set to erase 28,000 jobs as tech slump deepens ",18-01-2023
" Microsoft to shed 10,000 jobs as recession worries cloud tech sector ",18-01-2023
 U.S. agency says Amazon.com exposed workers to safety hazards ,18-01-2023
" Amazon Kicks Off Round of Job Cuts Affecting 18,000 People ",18-01-2023
 There's an Upbeat Signal Buried Beneath the Stock Market's Surface ,18-01-2023
" Microsoft plans 10,000 job cuts, will take $1.2-billion charge ",18-01-2023
" Job cuts in tech sector spread, Microsoft lays off 10,000 ",18-01-2023
 'I'm tired of being anxious': Amazon HR staffers go from hiring to publicly seeking jobs themselves ,18-01-2023
 OECD sees revenue gains from new tax pact reaching $250 billion ,18-01-2023
 WEBTOON Expands its IP & Creator Ecosystem With Webcomic Adaptations of Hit Web Novels ,18-01-2023
 KnowBe4 2022 Phishing Test Report Confirms Business-Related Emails Trend ,18-01-2023
 How Eco-Friendly Is That Product? Here Are Four Ways to Spot Greenwashing ,18-01-2023
 MANSCAPED® Launches The Beard Hedger™ Trimmer and Luxury Beard Grooming Pro Kit ,17-01-2023
" Lightspeed reneges on boast to keep hiring, cuts 300 workers ",17-01-2023
 Netflix set for slowest revenue growth as ad plan struggles to gain traction ,17-01-2023
 Vass Bednar: Why Canada needs a publicly owned cloud ,17-01-2023
" Temasek, Toyota back climate biotech firm Living Carbon ",17-01-2023
 Davos 2023: Brazil lacking world aid to fight climate change-Silva ,17-01-2023
" Optimi Health Expands Functional Mushroom Sales Network With Additional Brokers, Distribution Agreements ",17-01-2023
" Temasek, Toyota back climate biotech firm Living Carbon ",17-01-2023
 Algernon NeuroScience Doses First Subject in Phase 1 DMT Clinical Stroke Study ,17-01-2023
" Plug Power to Provide Annual Business Update on January 25, 2023 ",17-01-2023
 Davos 2023: Palantir CEO predicts hiring while preparing for economic slowdown ,16-01-2023
 10 Winners of the 2023 Zayed Sustainability Prize Honoured ,16-01-2023
 Megaport Achieves the AWS Outposts Ready Service Designation ,16-01-2023
 Battered 60/40 portfolios face another challenging year ,16-01-2023
 Tech's Slump Camouflages a Rally Sweeping Across Most of S&P 500 ,14-01-2023
" Hackers compromised Ontario liquor board website, stole customer data ",12-01-2023
" ONE Fight Night 10: Johnson vs. Moraes III   Tickets and VIP Packages On Sale Monday, January 16  ",12-01-2023
 Pimco says 'bonds are back' with a recession likely this year ,12-01-2023
" Lifeist's Subsidiary Mikra to Sell CELLF in 5,000+ GNC Stores Across the U.S. ",12-01-2023
 GURU Organic Energy to Report Fourth Quarter and Fiscal Year 2022 Results ,12-01-2023
 Fragile Megacap Tech Stocks Face CPI Test After New Year Rally ,12-01-2023
 Element Nutritional Sciences Provides Operational Milestone Review and 2023 Outlook ,12-01-2023
" Google, Porsche in talks over Google Apps access ",12-01-2023
" Google, Porsche in talks over Google Apps access - Manager Magazin ",12-01-2023
 Amazon workers' union victory upheld by U.S. labor board director ,12-01-2023
 Amazon workers' union victory upheld by U.S. labor board director ,12-01-2023
" Microsoft sets its sights on ChatGPT, Semafor reports ",11-01-2023
 Biden's climate agenda has a problem: Not enough workers ,11-01-2023
 Uniqlo owner Fast Retailing gives Japan's economy a jolt with 40% wage hike ,11-01-2023
 Biden's climate agenda has a problem: Not enough workers ,11-01-2023
 ABL Space Systems' rocket fails on maiden launch ,11-01-2023
 Blackberry unveils new in-vehicle software and partnerships ,10-01-2023
 Amazon faces renewed pressure from UK lawmakers over warehouse conditions ,10-01-2023
 Intel Rolls Out Design Aimed at Winning Back Server Market Share ,10-01-2023
" Amazon, Salesforce job cuts are warning signs for stock prices ",10-01-2023
 ProAmpac was Nominated for Two PAC Global Packaging Design Awards ,10-01-2023
 Wall St rises as Powell gives no clear comment on monetary policy outlook ,10-01-2023
 UK parliament considers recalling Amazon exec after lawmaker 'unhappy' with testimony ,10-01-2023
" Bed, Bath & Beyond rebounds in meme-stock rally ",09-01-2023
 Nasdaq leads Wall St higher as interest rate worries ease ,09-01-2023
" Goldman Sachs to cut about 3,200 jobs this week after cost review ",09-01-2023
 Infobip reveals the five most significant trends in customer experience and omnichannel communications for 2023 ,09-01-2023
 Newly Appointed Appen CEO and President To Accelerate Next Wave of Enterprise AI Adoption ,09-01-2023
" Aging labour force, hybrid work among challenges facing office real estate ",09-01-2023
 Union Launches Multifamily Industry's First Centralized Leasing Software Platform ,06-01-2023
 U.S. job growth solid in December; unemployment rate falls to 3.5% ,06-01-2023
 Bullshift: How optimism bias threatens your investments and finances ,06-01-2023
 German Postal Workers Seek 15% Wage Increase as Negotiations Kick Off ,06-01-2023
 Cooler hiring and milder pay gains could aid inflation fight ,06-01-2023
" Strong U.S. jobs, wages growth expected in December ",06-01-2023
 Bed Bath & Beyond preparing to file for bankruptcy within weeks ,05-01-2023
 Bed Bath & Beyond expresses 'substantial doubt' it can stay in business ,05-01-2023
" Amazon to cut 18,000 jobs as layoffs expand in tech sector ",05-01-2023
 CES startups face cautious investors amid economic woes ,05-01-2023
 Amazon layoff signals more pain for tech sector as recession fears mount ,05-01-2023
 FTC proposes rule that would ban employee noncompete clauses ,05-01-2023
 Amazon layoff signals more pain for tech sector as recession fears mount ,05-01-2023
 Heavy discounts drive record U.S. online holiday spending - report ,05-01-2023
" Amazon to lay off more than 18,000 employees in biggest job cut in its history ",05-01-2023
 AEM's Davis Instruments Unveils New Console Revolutionizing How People Interact with Weather Station Data ,05-01-2023
" Amazon CEO says job cuts to exceed 18,000 roles ",05-01-2023
" Amazon CEO says job cuts to exceed 18,000 roles ",05-01-2023
" Rate cut talk, already! ",05-01-2023
 What You Need to Know About Cultivated Meat ,05-01-2023
" Amazon CEO says job cuts to exceed 18,000 roles ",05-01-2023
" Amazon, Salesforce jettison jobs in latest tech worker purge ",05-01-2023
" Amazon CEO says job cuts to exceed 18,000 roles ",05-01-2023
" At CES 2023, Sony's 'Gran Turismo' flags new entertainment strategy ",04-01-2023
" At CES 2023, Sony's 'Gran Turismo' flags new entertainment strategy ",04-01-2023
" At CES 2023, Sony's 'Gran Turismo' flags new entertainment strategy ",04-01-2023
 Microsoft shares lag Big Tech peers as growth worries prompt UBS downgrade ,04-01-2023
" At CES 2023, Sony's 'Gran Turismo' flags new entertainment strategy ",04-01-2023
" At CES 2023, Sony's 'Gran Turismo' flags new entertainment strategy ",04-01-2023
 Microsoft to invest in autonomous trucking startup Gatik -sources ,04-01-2023
" Best of CES 2023: Wireless TV, delivery robots and in-car VR ",04-01-2023
 The people to watch in Ottawa in 2023 ,03-01-2023
 Shopify marketing tool aims to fill void left by Apple privacy crackdown ,03-01-2023
 Why those waiting for a return to normal in commercial real estate will get left behind ,02-01-2023
 World markets mixed after S&P 500 ends worst year since 2008 ,02-01-2023
 Outlook 2023: The Logic's newsroom picks the business and tech stories to watch ,30-12-2022
 Bill Gates made 2022's biggest charitable donation ,30-12-2022
 S&P 500 closes out dismal year with worst loss since 2008 ,30-12-2022
 2023 Cybersecurity predictions – Part 2 ,30-12-2022
 The new Matter standard and what it means for smart home devices ,29-12-2022
 Is your budget bursting? Try these 3 simple ways to save money ,29-12-2022
 'Woke people have taken over': Home Depot's billionaire co-founder Bernie Marcus is worried about capitalism ,29-12-2022
 BC Partners to acquire account-based marketing firm Madison Logic ,29-12-2022
 The 12 Best New Nonalcoholic Drinks to Imbibe for Dry January ,29-12-2022
 Six Climate Breakthroughs That Made 2022 a Step Toward Net Zero ,29-12-2022
 AIT Worldwide Logistics Signs The Climate Pledge ,28-12-2022
 7 ways you can recession-proof your finances ,27-12-2022
 Kaspersky shares privacy predictions for 2023 ,27-12-2022
 Barry Choi: 6 ways to set yourself up for financial success in 2023 ,27-12-2022
 The 2022 Bossies: Celebrating 10 of the finest management moments of the year ,25-12-2022
 Hiring for holiday season 'chaotic' as applicants ghost retailers in tight labour market ,23-12-2022
 Funding bill targets online sites amid retail theft concerns ,23-12-2022
 FP Comment's 2022 scrapbook: March and April ,23-12-2022
 World Bank to lend $500 million to help Brazil meet climate goals ,23-12-2022
 Microsoft will fight US over $68.7B Activision Blizzard deal ,23-12-2022
 Else Announces Closing of First Tranche of Institutional Investment for Gross Proceeds of US$4.25M ,22-12-2022
 Short sellers gain nearly $304 bln after tumble in U.S. stocks ,22-12-2022
" Amazon may be responsible for allowing Louboutin knock-off ads, EU court says ",22-12-2022
" In Peru, Kichwa tribe wants compensation for carbon credits ",22-12-2022
" YouTube, NFL strike deal to stream Sunday Ticket package of games ",22-12-2022
" Stingray Launches Free, Ad-supported TV Channels with Amazon Freevee and Samsung TV Plus ",22-12-2022
" In Peru, Kichwa tribe wants compensation for carbon credits ",22-12-2022
" Amazon may be responsible for allowing Louboutin knock-off ads, EU court says ",22-12-2022
 Amazon may breach trademark rights over fake Louboutin ads ,22-12-2022
 FP Answers: Are Canadian depositary receipts safe for a retirement portfolio? ,22-12-2022
" Amazon may be responsible for allowing Louboutin knock-off ads, EU court says ",22-12-2022
" How 2022 shocked, rocked and rolled global markets ",22-12-2022
 Short sellers gain nearly $304 bln after tumble in U.S. stocks ,22-12-2022
 EU opens antitrust probe into Broadcom's $61 bln VMware bid ,20-12-2022
 EU opens antitrust probe into Broadcom's $61 bln VMware bid ,20-12-2022
" Wall St reverses sell-off, dollar slides, Treasury yields rise on BOJ policy shift ",20-12-2022
 Canadian retail sales slide after strong October growth ,20-12-2022
" Amazon, P&G Fall Short on Environmental Paper Goals, Group Says ",20-12-2022
" Amazon reaches settlement in three EU antitrust cases, avoids fine ",20-12-2022
" Purpose Investments Launches Yield Shares ETFs, the World's First Single Stock Yield-focused ETFs, on the NEO Exchange ",20-12-2022
" Purpose Investments Debuts Yield Shares, the World's First Yield-Focused Single-Stock ETFs ",20-12-2022
 Amazon to make big business changes in EU settlement ,20-12-2022
 Electric Vehicle Charging Investment Approaches the $100 Billion Mark ,20-12-2022
" Amazon reaches settlement with EU over use of data, avoids fine ",20-12-2022
 LambdaTest launches #LambdaTestYourBusiness holiday season campaign ,20-12-2022
" Boomi Named a ""Hot Company to Watch in 2023"" By Nucleus Research ",19-12-2022
 Else Announces Investment for Gross Proceeds of Up to US$13.75M ,19-12-2022
 Paid-by-the-page ebook subscription model a boon for genre writers ,18-12-2022
 First Two O3b mPOWER Satellites Successfully Launched ,17-12-2022
 OSHA: Amazon failed to record some warehouse injuries ,16-12-2022
 Why has Big Tech fallen in love with exchanges? ,16-12-2022
 European shares post worst weekly loss since September as recession fears mount ,16-12-2022
 FTSE 100 posts worst week in two months on recession fears ,16-12-2022
 App store avalanche forecast as Apple bows to EU demands ,16-12-2022
 App store avalanche forecast as Apple bows to EU demands ,16-12-2022
" Amazon aims to give 'Warhammer 40,000' new powers with Henry Cavill ",16-12-2022
" Amazon to breathe life into fantasy game 'Warhammer 40,000' ",16-12-2022
 UK's FTSE 100 falls as tepid economic data fans slowdown fears ,16-12-2022
 European shares set for weekly loss as recession concerns mount ,16-12-2022
" Amazon to bring fantasy game 'Warhammer 40,000' onto screens ",16-12-2022
 Amazon Canada has released its latest report showing how it supports local communities ,16-12-2022
 Brazil's Petrobras struggles to get license to drill Foz do Amazonas -source ,15-12-2022
 DAVIDsTEA Launches Limited Edition Holiday Matcha Collection ,15-12-2022
 Workers at experimental Starbucks-Amazon store push to unionize ,15-12-2022
 Canadian home prices fall 12% in November from last year as winter chill sets in ,15-12-2022
 Buying into the live-shopping phenomenon ,15-12-2022
 Brazil audit finds 17% of cattle bought by JBS came from 'irregular' ranches ,15-12-2022
 U.S. retail sales fall after hefty gains; labor market still tight ,15-12-2022
 CES 2023: Tech world to gather and show off gadgets ,15-12-2022
 Amazon and Flipkart challenged in India over sale of acid on sites ,15-12-2022
 ChatGPT owner OpenAI projects $1 billion in revenue by 2024 -sources ,15-12-2022
 Prodapt augments its System-On-Chip (SoC) design services with Intel Pathfinder for RISC-V ,15-12-2022
 U.S. retail sales post biggest drop in 11 months; labor market tight ,15-12-2022
 New MacKenzie Scott website details $14 billion in gifts ,15-12-2022
 U.S. retail sales fall more than expected in November; weekly jobless claims decrease ,15-12-2022
 Posthaste: This year's Christmas feast is going to cost you ,15-12-2022
 Group casts doubt on Amazon's claims of reducing plastic ,15-12-2022
 FTX bankruptcy lawyers say they 'do not trust' Bahamas government ,15-12-2022
" Police: Suspect shot worker at Amazon hub, then is shot dead ",14-12-2022
 Mall owners bet they can save bricks-and-mortar retail by being more like Amazon ,14-12-2022
 FTX bankruptcy lawyers say they 'do not trust' Bahamas government ,14-12-2022
 FTX's bankruptcy lawyers say they 'do not trust' Bahamas government ,14-12-2022
 Tesla shares fall as investors bash Musk's Twitter focus ,14-12-2022
 Billionaire-backed KoBold Metals to invest in Zambia copper mine ,14-12-2022
 Billionaire-backed KoBold Metals to invest in Zambia copper mine ,14-12-2022
 Codisto Unveils New API Integration to Boost Sales for Shopify and eBay Retailers ,14-12-2022
 Tech and Telecom Firms Have Resumed Giving to Election-Denying Republicans ,14-12-2022
 Canadian gold miner Belo Sun accused of misleading investors ,14-12-2022
 BW Retail Scales Ecommerce Fulfillment with Descartes' Ecommerce Warehouse and Shipping Solution ,14-12-2022
 Crypto exchange FTX fights Bahamas demand for data access ,14-12-2022
 Protecting 30% of the planet to save nature is not as simple as it sounds ,14-12-2022
 Apple plans to let rival app stores on iPhones in EU -Bloomberg ,14-12-2022
" Apple plans to let rival app stores on iPhones in EU, Bloomberg reports ",13-12-2022
 DAVIDsTEA Reports Financial Results for the Third Quarter of Fiscal 2022 ,13-12-2022
" Deforestation of Brazilian savanna surged some 25% in a year, sources say ",13-12-2022
" Deforestation of Brazilian savanna surged some 25% in a year, sources say ",13-12-2022
 Short sellers eye more gains after reaping $50 billion from Big Tech in 2022 ,13-12-2022
 Rivian's Quick Use of Cash Proves Costly for EV Maker's Global Ambitions ,13-12-2022
" Else Nutrition's Kids Shakes Fastest Growing ""Infant Formula & Toddler Nutrition Drink"" in Natural Channel in 2022 ",13-12-2022
" Privacy-first, ads-free search engine Neeva launches in Canada ",13-12-2022
" 'Incredible challenges': Shopify president talks pandemic, stock plunge and layoffs ",13-12-2022
 Microsoft taking 4% stake in London Stock Exchange ,12-12-2022
 Launchpad joins forces with Altrata to transform data intelligence on the wealthy and influential ,12-12-2022
 Tax-loss selling in battered U.S. stocks could spur January snap-back ,12-12-2022
 IMDb Announces Top 10 Movies and Series of 2022 ,12-12-2022
 obVus Solutions Announces Opening of New Manufacturing Plant in Western New York ,12-12-2022
 Microsoft invests $2 billion in London Stock Exchange cloud deal ,12-12-2022
 Microsoft to buy 4% stake in London Stock Exchange ,12-12-2022
 Rivian pauses JV plans with Mercedes-Benz to make electric vans in Europe ,12-12-2022
 Investors Call Time on FAANG Stock Dominance After Nasdaq's Rout ,10-12-2022
" New this week: 'Banshees,' Whitney Houston, 'High on Life' ",09-12-2022
 Broadcom faces EU antitrust probe into $61 bln VMware deal - sources ,09-12-2022
 Tax-loss selling in battered U.S. stocks could spur January snap-back ,09-12-2022
 SpaceX gives rival's internet satellites ride to orbit ,08-12-2022
 Tax-loss selling in battered U.S. stocks could spur January snap-back ,08-12-2022
 U.S. labor market still tight despite continuing claims hitting 10-month high ,08-12-2022
 U.S. weekly jobless claims rise; continuing claims at 10-month high ,08-12-2022
