headline,date
" Rakuten shares jump 24% on Japan Post, Tencent backing ",15-03-2021
 India's draft e-commerce policy calls for equal treatment of sellers ,13-03-2021
 Amazon Canada asked to shut Brampton facility on COVID-19 concerns ,12-03-2021
 Amazon Canada asked to shut Brampton facility on COVID-19 concerns ,12-03-2021
 Amazon ordered to close Brampton facility over rising COVID cases ,12-03-2021
" Amazon Canada asked to shut Brampton facility, workers to self isolate for 14 days ",12-03-2021
" Amazon Canada asked to shut Brampton facility, workers to self isolate for 14 days ",12-03-2021
 Rubio first U.S. Republican senator to support union push at Amazon.com ,12-03-2021
 Rubio first U.S. Republican senator to support union push at Amazon.com ,12-03-2021
 Apple tilts to iPhone playbook for its car — making Magna a top contender to build it ,12-03-2021
 Ottawa’s $40-million D-Wave funding part of forthcoming quantum strategy: source ,12-03-2021
 India's Tata proposes to take majority stake in Alibaba-backed BigBasket - filing ,12-03-2021
" Corporate Social Responsibility Related News Releases and Story Ideas for Reporters, Bloggers and Media Outlets ",12-03-2021
" Indian agency seeks information, documents from Amazon amid probe -source ",12-03-2021
 Rakuten to sell 8% stake to Japan Post in Amazon battle ,12-03-2021
 Rakuten to sell 8% stake to Japan Post in Amazon battle ,12-03-2021
 Rakuten to sell 8% stake to Japan Post in Amazon battle ,12-03-2021
 India child rights body asks Netflix to stop streaming 'Bombay Begums' ,12-03-2021
 Japan Post takes 8% stake in Rakuten in logistics tie-up ,12-03-2021
" Japan Post Holdings, Rakuten to form capital alliance, sources say ",12-03-2021
 Brazil hospitals pushed to limit as COVID-19 death toll soars ,11-03-2021
 Greenlane Renewables Announces Fourth Quarter and Fiscal Year 2020 Financial Results ,11-03-2021
 Brazil hospitals pushed to limit as COVID-19 death toll soars ,11-03-2021
 Brazil hospitals pushed to limit as COVID-19 death toll soars ,11-03-2021
 Nubeva Expands TLS Decryption Support for Monitoring in AWS ,11-03-2021
 Brazil hospitals pushed to limit as COVID-19 death toll soars ,11-03-2021
 Brazil hospitals pushed to limit as COVID-19 death toll soars ,11-03-2021
 Opportunity from crisis: how investors are playing the post-pandemic property market ,11-03-2021
 Opportunity from crisis: how investors are playing the post-pandemic property market ,11-03-2021
 The Innovation Imperative: How the pandemic has changed the urban environment where innovation thrives ,10-03-2021
 Millions of websites offline after fire at French cloud services firm ,10-03-2021
" Roth Capital Partners 33rd Annual Conference to be held Virtually March 15-17, 2021 Premier Small-Cap Growth Conference to host more than 400 public and private companies ",10-03-2021
 Opportunity from crisis: how investors are playing the post-pandemic property market ,10-03-2021
 Stocks and bond yields inch higher after wild tech reboot ,10-03-2021
 Blaze destroys servers at Europe's largest cloud services firm ,10-03-2021
 Fire destroys some servers at French data company OVHcloud ,10-03-2021
" Stocks rise after wild tech reboot, yields inch higher ",10-03-2021
 Fire destroys servers at French data company OVHcloud ,10-03-2021
 U.S. House approves expanded protections for labor union organizing ,10-03-2021
 Biden flashes warning to Big Tech as antitrust team takes shape ,09-03-2021
 Jeff Bezos hires Earth Fund CEO to speed spending of $10 billion to fight climate change ,09-03-2021
 U.S. Justice Department nominee Gupta vows strong antitrust enforcement ,09-03-2021
 Jeff Bezos names Andrew Steer as head of Bezos Earth Fund ,09-03-2021
 U.S. Justice Department nominee Gupta vows strong antitrust enforcement ,09-03-2021
 Ingram Micro Cloud Announces New Global Strategic Collaboration Agreement with AWS ,09-03-2021
 Lina Khan on track to be nominated to FTC - source ,09-03-2021
 Indian non-profit challenges new content regulation rules for news media ,09-03-2021
 Famed Attorney CHARLES HARDER Releases Book GAWKER SLAYER on Fifth Anniversary of $140 Million Trial Victory For Hulk Hogan Against Gawker Media ,08-03-2021
 Quantum computing provider IonQ to go public via $2 bln SPAC deal ,08-03-2021
 Quantum computing provider IonQ to go public via $2 bln SPAC deal ,08-03-2021
 Deliveroo kicks off landmark London IPO after bumper 2020 ,08-03-2021
 Wall St Week Ahead-Investors weigh how far tech stocks can slide after volatile week ,07-03-2021
 Love to share your ideas? Ride the self-publishing wave on Amazon ,07-03-2021
 'A side of shares': Deliveroo to offer 50 million pounds of stock to customers ,07-03-2021
 This project management certification could help you take home over $100K a year ,06-03-2021
 Wall St Week Ahead-Investors weigh how far tech stocks can slide after volatile week ,05-03-2021
 'No sense of job security': Amazon union organizers tell lawmakers in Alabama ,05-03-2021
 Biden sets stage for Big Tech crackdown with appointment of Timothy Wu as White House adviser ,05-03-2021
 Biden adds Big Tech critic Tim Wu to his economic staff ,05-03-2021
 'No sense of job security': Amazon union organizers tell lawmakers in Alabama ,05-03-2021
 Nasdaq slump badly bruises Wall St's most loved stocks ,05-03-2021
 Congressional delegation heads to Alabama amid growing support for Amazon workers ,05-03-2021
 Main Volkswagen brand speeds up shift to electric ,05-03-2021
 There's an unexpected way to stay competitive in the finance industry ,05-03-2021
 HBC and Insight Partners Launch Saks as a Standalone Ecommerce Company Set to Rapidly Expand Customer Base in Growing Online Luxury Fashion Market ,05-03-2021
 Congressional delegation heads to Alabama amid growing support for Amazon workers ,05-03-2021
 Urban Farming Startup Infarm Raises Extra $100 Million to Expand ,05-03-2021
" Bollywood, streaming giants on edge as Amazon gets flak for hurting religious beliefs in India ",05-03-2021
 Webscale Raises $26 Million in Growth Financing to Accelerate Ecommerce Innovator in cloud infrastructure delivers enterprise-grade security and flexibility amid pandemic consumer shifts and rise of headless architectures ,04-03-2021
 Drill targets defined at the Espejo Project within the ENAMI EP Strategic Exploration Alliance in NW Ecuador ,04-03-2021
 GURU Organic Energy Extends Presence in Convenience Channel Across Canada ,04-03-2021
" Loop Insights Appoints Former Epson General Manager of Global Brand & Marketing Communications, Ian Cameron, as VP of Marketing to Support Loop's Continued Global Expansion in 2021 ",04-03-2021
" ESE Entertainment becomes esports distribution partner for the Ultimate Gaming League, launching event featuring Snoop Dogg, Marshawn Lynch, and JuJu Smith-Schuster The Ultimate Gaming League is an esports organization operating with team franchises owned by current and former National Football League (NFL) players ",04-03-2021
 What you need to know about the coronavirus right now ,04-03-2021
 India's Supreme Court says favors controls on video streaming services ,04-03-2021
" Zoom recovers from hours-long outage, says issues were likely due to local internet glitch ",04-03-2021
 Amazon's first cashierless store arrives in Britain in sign of global expansion ,04-03-2021
 Amazon in talks with NFL for Prime Video rights deal - WSJ ,03-03-2021
 Indigenous Amazonians sue retailer Casino over rainforest destruction ,03-03-2021
" Parler sues Amazon again, alleging effort to 'destroy' app ",03-03-2021
" Parler sues Amazon again, after dropping original lawsuit ",03-03-2021
 Zoom says users issues likely from localized internet glitch ,03-03-2021
 Brave New Coin to Power Digital Currency Perpetuals on LedgerX LedgerX is the first cryptocurrency derivatives exchange licensed by the Commodity Futures Trading Commission ,03-03-2021
 Indigenous Amazonians sue retailer Casino over rainforest destruction ,03-03-2021
 LegalShield Reaches Membership Milestone as Millions Seek to Address Rising Legal and Cybercrime Concerns ,03-03-2021
 Indigenous people sue retailer Casino over Amazon destruction ,03-03-2021
 Indigenous peoples sue retailer Casino over Amazon destruction ,03-03-2021
 Tehama launches secure virtual Windows desktops with the power of GPU ,03-03-2021
 Parler drops case against Amazon for pushing it offline over Capitol violence ,03-03-2021
 'Next big leap': Netflix to offer 41 new shows to lure Indian viewers ,03-03-2021
 Parler drops case against Amazon ,03-03-2021
 Guru Organic Energy to Report First Quarter 2021 Results and to Host Virtual Annual Meeting ,03-03-2021
 Why the Biggest U.S. ESG Fund Has No Direct Renewable Holdings ,03-03-2021
" Amazon Merchant Kicked Off Website Spent $200,000 to Get Justice ",03-03-2021
 Climate Activist Who Took on BlackRock Now Takes Aim at Vanguard ,03-03-2021
 Emerging Europe.com bolsters defenses as Amazon enters Poland ,03-03-2021
 UK's DS Smith gains from orders packed and shipped in online boom ,03-03-2021
 Amazon issues rare apology in India after complaints that series hurt Hindu beliefs ,02-03-2021
" TreeHouse Foods settles with Jana, appoints two to its board ",02-03-2021
 Wall Street ends lower as Apple and Tesla retreat ,02-03-2021
 Walmart sweetens pay for most U.S. hourly workers on the coasts ,02-03-2021
 Amazon issues rare apology in India after complaints that series hurt Hindu beliefs ,02-03-2021
 Amazon Prime Video apologizes for offending Hindu beliefs in Indian political show ,02-03-2021
" Nextech Successfully Launches its Ad Network Featuring Augmented Reality Capabilities on its Virtual Events Properties, Delivering Millions of Impressions ",02-03-2021
 Amazon's new Polish site goes live as online competition grows ,02-03-2021
 Amazon's new Polish site goes live as online competition grows ,02-03-2021
 Shez Partovi to succeed Jeroen Tas as Philips' Chief Innovation & Strategy Officer ,02-03-2021
 Congressional delegation to visit Amazon facility in Alabama to support union vote ,01-03-2021
 Energy leaders grapple with climate targets at virtual CERAWeek ,01-03-2021
 Innovation is popping up everywhere: Five platforms for growth ,01-03-2021
" Indian mobile retailers call for Amazon probe, cap on online smartphone sales ",01-03-2021
 China's Tencent Cloud to open datacentre in Bahrain ,01-03-2021
" Biden defends workers' rights, warns of 'threats' as Amazon employees vote on union ",01-03-2021
 Amazon is banking on the Canadian digital economy to grow ,27-02-2021
" G20 promises no let-up in stimulus, sees tax deal by summer ",26-02-2021
" Brazil regulator approves 5G spectrum auction rules, no Huawei ban ",26-02-2021
" U.S. drops 'safe harbor' demand, raising hopes for global tax deal ",26-02-2021
" U.S. urban office market, stung by pandemic, hopes tech firms drive comeback ",26-02-2021
 Namaste Technologies Announces CannMart.com is LIVE in the USA ,26-02-2021
 Quick response: How to touch customers in contactless commerce ,26-02-2021
" Brazil regulator approves 5G spectrum auction rules, no Huawei ban ",26-02-2021
 Loop Insights Provides Wallet Pass Platform To World Boxing Council (WBC) To Engage Fans For Championship Fight Being Broadcast To Over 200 Countries Across The World. Combined Social Media To Exceed 10 Million Followers. Additional Global Fight Events Expected To Follow Loop to Provide Global Fan Engagement Services During Canelo vs. Yildirim Championship Fight Saturday Feb. 27th at Miami's Hard Rock Stadium ,25-02-2021
" India tightens regulatory grip on Facebook, WhatsApp with new rules ",25-02-2021
" RAIR Launches Decentralized Digital Rights Management Platform, Powering Digital Scarcity for Creators RAIR's new middleware encryption and 'digital watermark' lets anyone publish and distribute media while retaining full ownership and earnings ",25-02-2021
" From Clubhouse to Twitter Spaces, social media grapples with live audio moderation ",25-02-2021
" DeFi Derivatives Exchange LEVERJ Launches Blue-Chip DeFi Index-Based Futures Powered by Brave New Coin Blue-Chip DeFi Index Tracks Real-Time Performance of 8 of the top DeFi Assets, Including $MKR, $AAVE, $SNX and $COMP ",25-02-2021
 Costco lifts minimum wage above Amazon or Target to $16 per hour ,25-02-2021
" India tightens regulatory grip on Facebook, WhatsApp with new rules ",25-02-2021
" Stocks rise, bond yields too - despite central banker talk-down efforts ",25-02-2021
" From Clubhouse to Twitter Spaces, social media grapples with live audio moderation ",25-02-2021
 Gran Tierra Energy Inc. Announces Fourth Quarter and Year-End Results for 2020 and Operational Update ,25-02-2021
 India plans new social media controls after Twitter face-off ,24-02-2021
 India plans new social media controls after Twitter face-off ,24-02-2021
 Nextech AR Virtual Event Platform (VXP) Selected to Host the Student Veterans of America's 2021 National Conference; Keynote Delivered by First Lady Dr. Jill Biden; Speakers Included Gary Vaynerchuk ,24-02-2021
" In Brazil, an indigenous woman joins Bolsonaro in fight for mining ",24-02-2021
 JPMorgan's blockchain payments test is literally out of this world ,24-02-2021
 IonQ in Talks to Go Public Through Merger with DMY SPAC ,24-02-2021
" Bubbles, bubbles bound for trouble? ",24-02-2021
 GameSquare Esports Provides Update on Proposed Acquisition of Reciprocity  Reciprocity Securityholders Approve Transaction ,23-02-2021
" SolarWinds, Microsoft, FireEye, CrowdStrike defend actions in major hack -U.S. Senate hearing ",23-02-2021
" Bubbles, bubbles bound for trouble? ",23-02-2021
 Amazon SVP Jeff Blackburn is departing the company Tuesday ,23-02-2021
 Amazon SVP Jeff Blackburn is departing the company Tuesday: memo ,23-02-2021
" Bubbles, bubbles bound for trouble? ",23-02-2021
 Bill Gates-led Clean Tech Fund Adds New Billionaire Investors ,23-02-2021
 Top Amazon India executive questioned by police over video series ,23-02-2021
" Jellyfish Acquires 5 Companies, Fueling Global Expansion With New Digital Capabilities ",23-02-2021
 Presidio Achieves Premier Partner Status in the Amazon Web Services Partner Network ,23-02-2021
" Skylight Health Expands Data Strategy to Utilize Amazon Web Services Infrastructure to Improve Patient Care, Health Outcomes, and Clinical Efficiencies ",23-02-2021
" Techemy Capital Launches DeFi ETP on Balancer, Giving Traders Non-Synthetic Exposure to DeFi Assets Powered by Brave New Coin, the DeFi ETP includes top assets $YFI, $COMP, $UNI, $AAVE, $SNX, $MKR, $SUSHI and $UMA ",23-02-2021
" Spotify to launch in 85 new markets, reach more than a billion listeners ",22-02-2021
" Spotify to launch in 85 new markets, reach more than a billion listeners ",22-02-2021
" Disney Adds R-Rated Movies, Biker Gangs in Europe Streaming Push ",22-02-2021
" MegazoneCloud Named as a Representative Vendor in Gartner's 2020 Market Guide for Public Cloud Managed and Professional Services Providers, Asia/Pacific ",22-02-2021
" Chief executive of Japan's Honda to step down, hand reins to R&D chief ",19-02-2021
" Zuckerberg, Pichai, Dorsey Due Back for New Grilling in Congress ",18-02-2021
" Internet groups, U.S. Chamber sue Maryland over digital advertising tax ",18-02-2021
" Diane Francis: By unfriending Australia, Facebook proves it is 'dangerously under-regulated' ",18-02-2021
 India's Enforcement Directorate to examine findings in Reuters report on Amazon-agency source ,18-02-2021
 India's Enforcement Directorate to examine findings in Reuters report on Amazon-agency source ,18-02-2021
" As U.S. bond yields march higher, when should stock investors get worried? ",18-02-2021
 Japan must toughen regulation if 'joint approach' e-commerce law falls short -lawmaker ,18-02-2021
 Shopify CEO decries consumerism as sales fuel record revenue ,18-02-2021
 Sycamore Entertainment and SEGI TV Are Officially Approved As an Amdocs/Vubiquity Affiliate ,17-02-2021
 New York attorney general sues Amazon over COVID-19 worker safety shortfalls ,17-02-2021
 Indian retailer group calls for ban on Amazon in country after Reuters report ,17-02-2021
 Indian retailer group calls for ban on Amazon in country after Reuters report ,17-02-2021
 Bharti Airtel to buy Warburg Pincus stake in DTH business for $430 mln ,17-02-2021
" Protegrity Launches Partner Network to Secure Global Innovation in AI, Analytics, and Cloud ",17-02-2021
" TuneIn Expands Leadership Team – Appoints Paul Brody to Chief Technology Officer, Rob Deichert to Chief Revenue Officer and Joe King to Chief Product Officer – Elevates Yasmin Coffey to Chief Legal Officer ",17-02-2021
 Nextech AR Virtual Events Platform (VXP) Selected to Host The 2021 Ontario Dental Association's Annual Spring Meeting ,17-02-2021
 Amazon documents reveal company's secret strategy to dodge India's regulators ,17-02-2021
 Pay gap for U.S. female executives narrows but persists ,17-02-2021
 Superfood Start-up KoRo Uses Descartes Ecommerce Warehouse Management Solution to Fulfill Surging Order Volumes ,17-02-2021
 Big Tech's Democratic critics discuss ways to strike back with White House ,17-02-2021
" 20 New Companies Spanning Agriculture, Renewable Energy, Hospitality, Financial Services, Creative Services, Technology, Forestry, and the Construction Sector Join The Climate Pledge ",17-02-2021
 Daimler's Torc Robotics picks Amazon as cloud provider for self-driving trucks ,17-02-2021
 New York attorney general sues Amazon over COVID-19 shortfalls ,17-02-2021
 Dream Industrial REIT Reports Strong Q4 2020 Results and Addition of New Top 10 Tenant ,16-02-2021
 Regé-Jean Page Receives an IMDb STARmeter Award ,16-02-2021
 Posthaste: Cash is trash as investors pile into equities at near-record levels ,16-02-2021
 Amazon to make TV streaming device in India ,16-02-2021
 TikTok's U.S. ad business roars back as Trump's threats recede ,16-02-2021
 Amazon to make TV streaming device in India ,16-02-2021
 Amazon says to make TV streaming device in India ,16-02-2021
 Future Group creditors scramble to recover $2.5 bln loans amid Reliance deal woes -bankers ,16-02-2021
 Social media app Parler crawls back online on 'independent technology' ,15-02-2021
 France's BNP to stop financing firms farming deforested land in the Amazon ,15-02-2021
" How Monster Beverage Shares Soared a Monster 100,000% in the Last 20 Years ",15-02-2021
 France's BNP to stop financing customers using converted Amazon forest land ,15-02-2021
 France's BNP Paribas to limit finance to customers using converted Amazon forest land ,15-02-2021
 U.S. tells G7 that it is back at the table to help with global recovery ,12-02-2021
 Tech has gone big on green energy — and it could take the world with it ,12-02-2021
 U.S. says it's back at the table to help global economic recovery ,12-02-2021
 Ottawa changed the rules on CERB repayments — here's what it means for taxpayers ,12-02-2021
 Miami mayor sees bitcoin move as way to attract tech ,12-02-2021
 U.S. says it's back at the table to help global economic recovery ,12-02-2021
 G7 finance chiefs discuss how to steer economies out of crisis ,12-02-2021
 Amazon sues New York attorney general to preempt COVID-19 lawsuit ,12-02-2021
 G7 finance chiefs discuss how to steer economies out of crisis ,12-02-2021
 NY attorney general to review legal options on Amazon.com's lawsuit concerning COVID-19 response ,12-02-2021
 Amazon has invested $3 million dollars in Canadians learning code – get a head start in this field ,12-02-2021
" Koios Begins Distribution Initiatives in the Convenience Channel with 200+ Store Placements to Date in Colorado Including 7-Eleven and Shell Locations As convenience stores continue to gain popularity as a point of purchase for everyday items, the Company is undertaking distribution initiatives to place its functional beverage products in convenience stores in the United States to complement existing placements in supermarkets, foodservice outlets, and sports nutrition retailers. With an initial focus on the convenience channel in the state of Colorado, the Company has placed its products in over 200 convenience stores across the state since Q4 2020, including locations of national chains such as 7-Eleven and Shell ",12-02-2021
 Amazon sues New York attorney general to preempt a state COVID lawsuit ,12-02-2021
 What you need to know about the coronavirus right now ,12-02-2021
 Prime Dublin office rents fell by up to 10% in 2020 ,12-02-2021
 HempFusion’s five-channel strategy positions it ahead of competition in CBD space ,12-02-2021
 CDC Urges Schools to Reopen; Cuomo Under Fire: Virus Update ,12-02-2021
" US, with Trump gone, seeks to build bridges on global economy ",12-02-2021
 Strong showing for Ecuador's Perez signals backlash against mining industry ,11-02-2021
 Microsoft approached $51-billion social media company Pinterest about a takeover ,11-02-2021
 Saint-Petersburg Exchange will expand traded assets ahead of IPO ,11-02-2021
" Amazon, Ferragamo sue several firms, people over counterfeit products ",11-02-2021
 Russian logistics firm CDEK plans bond issue of up to $136 mln ,11-02-2021
 Manulife profits rise 45 per cent in fourth quarter but core earnings dip slightly ,10-02-2021
 EU diplomats say it is up to Brazil to save Mercosur trade deal ,10-02-2021
" COVID, climate, tax feature at first post-Trump G7 talks ",10-02-2021
" COVID, climate, tax feature at first post-Trump G7 talks ",10-02-2021
 Spok Go® Secure Communication Platform Launches in Canada ,10-02-2021
 UNFI Becomes a Distributor of KOIOS™ and Fit Soda™ Functional Beverages ,10-02-2021
 Tesla rival Rivian aims for IPO this year - Bloomberg News ,10-02-2021
 Reddit-fueled retail trading frenzy spreads to Europe ,09-02-2021
 Brazil group sues Norsk Hydro over alleged pollution ,09-02-2021
 Norsk Hydro being sued by Brazil group over alleged pollution ,09-02-2021
 Nextech AR's Virtual Event Platform Selected by Canadian Surgery Forum for Its 2021 Virtual Trade Show ,09-02-2021
 Aluminium producer Norsk Hydro sued by Brazilian group over alleged pollution ,09-02-2021
 Wall Street Is Investing Billions to Scale Tiny Mom-and-Pop Sellers on Amazon ,09-02-2021
 3CLogic Announces Cloud Contact Center Integration for Zoom ,09-02-2021
 Amazon-Ambani Spat Tests India Allure for Foreign Investors ,09-02-2021
 Apollo-backed low-cost airline Sun Country files for U.S. IPO ,08-02-2021
 How One Woman Turned a $40 Million Kuaishou Bet Into $12 Billion ,08-02-2021
 Indian court lifts hold on Future's $3.4 bln retail deal in setback for Amazon ,08-02-2021
 Nextech AR Launches Major Platform Upgrade with Standardized AI Chat Features to Enhance Virtual Experience Platform ,08-02-2021
 An unleashed Jeff Bezos will seek to shift space venture Blue Origin into hyperdrive ,08-02-2021
" Loop Insights Signs Four-Year Venue Management Agreement Through TELUS IoT Marketplace with Big White Ski Resort, One Of Canada's Top 5 Ski Resorts, with Potential to Generate $7.2 - $9.6 Million in Newline Revenue For Loop and Big White Ski Resort Agreement a Result of Sales and Marketing Efforts Made by TELUS (T:TSX; TU: NYSE) Through its IoT Marketplace ",08-02-2021
" Shell, Mitsubishi unit Eneco to supply wind power to Amazon's European facilities ",08-02-2021
 Shell enters supply deal with Amazon to provide renewable energy ,08-02-2021
" ECB Sees Recovery, Italian Spring Hope, New WTO Chief: Eco Day ",08-02-2021
 Mitsubishi unit Eneco to supply wind power to Amazon in Europe - Nikkei ,08-02-2021
 Mitsubishi unit Eneco to supply wind power to Amazon.com in Europe -Nikkei ,08-02-2021
 Amazon orders hundreds of trucks that run on natural gas ,06-02-2021
" Amazon orders more than 1,000 natgas-powered engines for U.S. fleet ",05-02-2021
" Amazon orders more than 1,000 natural gas engines for U.S. truck fleet ",05-02-2021
" Amazon orders more than 1,000 natgas engines for U.S. truck fleet ",05-02-2021
 Big Wall St investors chased tech during GameStop retail frenzy - BofA ,05-02-2021
" Amazon bucks UK's grim labor market with 1,000 apprenticeships ",05-02-2021
 White House pulled into unionization effort at Amazon facility ,04-02-2021
" Publishing is a $26 billion industry, with self-publishing growing as a popular side hustle ",04-02-2021
 Amazon plans AI-powered cameras in delivery vans to improve driver safety ,04-02-2021
 Parler CEO John Matze says he was fired by board ,04-02-2021
 Amazon plans AI-powered cameras in delivery vans to improve safety ,04-02-2021
 Social network Parler terminates CEO John Matze ,03-02-2021
 Stingray Reports Third Quarter 2021 Results ,03-02-2021
" With Bezos out as Amazon CEO, is this the end of his ominous question-mark emails? ",03-02-2021
 Fighting Elon Musk and climate change: Jeff Bezos’ many side hustles ,03-02-2021
 UK to lead G7 discussion on COVID economic recovery on Feb. 12 ,03-02-2021
 Amazon unveils development plans for next phase of Virginia headquarters (Feb. 2) ,03-02-2021
" As Jeff Bezos prepares for his second act, what comes next for Amazon? ",03-02-2021
" Alphabet shares power S&P 500, Nasdaq; Amazon dips ",03-02-2021
" Alphabet shares power S&P 500, Nasdaq; Amazon dips ",03-02-2021
 U.S. private hiring rebounds solidly in January ,03-02-2021
" Nextech AR to Webcast Live at VirtualInvestorConferences.com February 4, 2021 ",03-02-2021
" Sweat Free Apparel Announces Launch (100 US & Canadian Cities) of Carbon Neutral Face Coverings, Protecting Amazon Rainforest & Embracing Crypto! ",03-02-2021
" S&P 500, Nasdaq open higher on Alphabet boost ",03-02-2021
" S&P 500, Nasdaq open higher on Alphabet boost ",03-02-2021
" S&P 500, Nasdaq set for higher open on Alphabet boost ",03-02-2021
