date,headlines
2021-03-26, Chinese apps join celebs in backlash against Western fashion brands over Xinjiang 
2021-03-26, Chinese apps join celebs in backlash against Western fashion brands over Xinjiang 
2021-03-26, H&M vanishes from Chinese ride-hailing app Didi after Xinjiang backlash 
2021-03-26, China's Zhihu raises $523 mln in U.S. IPO despite uneasy ties 
2021-03-25," Dollar rallies, equities flat, as European COVID-19 cases rise "
2021-03-25," Safe havens rally, equities slide, as European COVID-19 cases rise "
2021-03-25," Safe havens rally, equities slide, as European COVID cases rise "
2021-03-25," Nike, Adidas join brands feeling Chinese social media heat over Xinjiang "
2021-03-25," Tech stocks, banks set to drag Wall St lower at open "
2021-03-25," Tech stocks, banks set to drag Wall St lower at open "
2021-03-25, Futures turn lower ahead of jobless claims report 
2021-03-25, Futures turn lower ahead of jobless claims report 
2021-03-25, Old H&M comment on 'forced labor' in China's Xinjiang raises online storm 
2021-03-25, Futures rise as jobless claims expected to edge lower 
2021-03-25, Futures rise as jobless claims expected to edge lower 
2021-03-25," After H&M, Nike feels Chinese social media heat over Xinjiang "
2021-03-25, Chinese tech stocks slump as U.S. SEC begins rollout of law aimed at delisting 
2021-03-25," Stocks sluggish, dollar near four-month highs as risk appetite wanes "
2021-03-25," After H&M, more brands criticized on Chinese social media over Xinjiang "
2021-03-25, HK's Hang Seng falls on tech slump after SEC delisting move 
2021-03-25," After H&M, more foreign retail brands under fire in China in Xinjiang fallout "
2021-03-25," After H&M, more foreign retail brands under fire in China in Xinjiang fallout "
2021-03-25," Asian stocks trip on China tech woes, some cyclical shares bought "
2021-03-25, Chinese tech stocks fall as U.S. SEC begins rollout of law aimed at delisting 
2021-03-25, Financials help Hang Seng overcome tech slump; China blue-chips slip 
2021-03-25, Chinese tech stocks fall as U.S. SEC begins rollout of law aimed at delisting 
2021-03-25, Asian shares wobble in volatile trade as China tech selloff weighs 
2021-03-25, U.S. SEC begins rollout of law aimed at delisting Chinese firms 
2021-03-25, Tech drags Hang Seng lower after SEC adopts delisting; China shares down 
2021-03-24, U.S. SEC begins rollout of law aimed at delisting Chinese firms 
2021-03-24, Old H&M comment on 'forced labor' in China's Xinjiang raises online storm 
2021-03-24, Old H&M comment on 'forced labor' in China's Xinjiang raises online storm 
2021-03-24, H&M Slammed on China's Social Media Over Cotton Comment 
2021-03-24, Tencent boss meets China antitrust officials as scrutiny widens-sources 
2021-03-24," China's Didi leans towards New York for IPO, eyes valuation of at least $100 bln -sources "
2021-03-24," China's Didi leans towards New York for IPO, eyes valuation of at least $100 bln -sources "
2021-03-24, Tencent boss meets China antitrust officials as scrutiny widens-sources 
2021-03-24," China's Didi leans towards New York over Hong Kong for IPO, eyeing at least $100 bln valuation -sources "
2021-03-24, Tencent boss meets China antitrust officials as scrutiny widens-sources 
2021-03-24, Tencent boss meets China antitrust officials as scrutiny widens-sources 
2021-03-24," In Southeast Asian internet battle, Sea's rise sends rivals scrambling "
2021-03-23," In Southeast Asian internet battle, Sea's rise sends rivals scrambling "
2021-03-23," In Southeast Asian internet battle, Sea's rise sends rivals scrambling "
2021-03-23," In Southeast Asian internet battle, Sea's rise sends rivals scrambling "
2021-03-23, China's Baidu makes subdued Hong Kong trading debut 
2021-03-23, Bilibili set to raise $2.6 bln in Hong Kong listing -sources 
2021-03-23, Baidu CEO Engineers $66 Billion Comeback After Missteps 
2021-03-22, Niche ETFs Are Winning Over Chinese Investors 
2021-03-22, China's JD.com to invest $800 mln in Dada Group 
2021-03-21, China's Crusade Against Risk Is Tormenting Financial Markets 
2021-03-19, China's small tech firms step out of the shadows as giants reel from regulatory crackdown 
2021-03-18," Proactive news headlines including Silver Range Resources, Vuzix Corp, Endeavour Mining and Delta 9 Cannabis Proactive, provider of real-time news and video interviews on growth companies listed in the US and Canada, has covered the following companies: "
2021-03-18," HempFusion Wellness Enters China with Probulin Probiotics Through Alibaba Group's Tmall Global, Reaching More Than 750 Million Potential New Consumers "
2021-03-18, China delivers on threats to rein in internet economy 
2021-03-17, China's Baidu raises $3.1 bln from Hong Kong listing 
2021-03-17, China's Bilibili launches share sale for $3.2 bln Hong Kong listing 
2021-03-17, China's Baidu to raise $3.1 bln from Hong Kong listing -sources 
2021-03-17, China's Baidu to raise $3.1 bln from Hong Kong listing -sources 
2021-03-16, Alibaba's browser removed from Chinese Android app stores 
2021-03-16, Alibaba's UC Browser removed from Chinese Android app stores 
2021-03-16, Investors value China's Ant Group at over $200 bln after IPO halt -sources 
2021-03-16, China market regulator clamps down on live-streaming e-commerce 
2021-03-16, China asks Alibaba to dispose of media assets - WSJ 
2021-03-16, Global investors value China's Ant Group at over $200 bln -sources 
2021-03-16," Kohler, Ford, Infiniti in spotlight on China consumer rights show "
2021-03-16," Kohler, Ford, Infiniti in spotlight on China consumer rights show "
2021-03-15, China asks Alibaba to curtail media assets - WSJ 
2021-03-14," Huawei Pivots to Fish Farms, Mining After U.S. Blocks Its Phones "
2021-03-13, China's JD.com in talks to buy stake worth $1.5 bln in brokerage - sources 
2021-03-12, China's Ant Group CEO leaves after failed IPO prompts revamp 
2021-03-12, China's Ant Group CEO Hu quits amid regulatory-driven revamp 
2021-03-12, India's Tata proposes to take majority stake in Alibaba-backed BigBasket - filing 
2021-03-12, China's Ant Group CEO Hu departs amid regulatory-driven revamp 
2021-03-12, China market regulator fines 12 firms for violating anti-monopoly law 
2021-03-12, China's JD.com in talks to buy stake worth $1.5 bln in brokerage - sources 
2021-03-12, Ant Group publishes financial self-discipline rules amid tougher Chinese scrutiny 
2021-03-12, China market regulator fines 12 firms over illegal monopolistic behavior 
2021-03-12, China's JD.com in talks to purchase stake in brokerage worth $1.5 bln - sources 
2021-03-12, Ant Group publishes financial self-discipline rules amid tougher Chinese scrutiny 
2021-03-12, China's JD.com in talks to purchase stake in brokerage worth up to $1.5 bln - sources 
2021-03-12, China market regulator fines 12 companies for illegal monopolistic behavior 
2021-03-12, China market regulator fines 12 companies for illegal monopolistic behaviors 
2021-03-12, China's Ant publishes financial self-discipline rules amid tougher scrutiny 
2021-03-12, China's antitrust regulators weigh levying record fine on Alibaba - WSJ 
2021-03-12, What is China's Consumer Rights Day? 
2021-03-11, China's Baidu to sell around 4% of shares in HK listing - sources 
2021-03-09," SoftBank-backed Coupang boosts IPO price, aims for $58 billion valuation "
2021-03-09," China stocks in correction on policy tightening, valuations "
2021-03-09," H.K. Electoral Overhaul, Beijing Expects Pollution: NPC Update "
2021-03-05," Hong Kong shares end lower following U.S. bond, stock slump "
2021-03-05, China to increase SME loans from big banks by 30% in 2021 
2021-03-03, Emerging Europe.com bolsters defenses as Amazon enters Poland 
2021-03-02, China's Ant seeks to ease staff concerns about selling company's shares 
2021-03-02, Jack Ma loses title as China's richest man after coming under Beijing's scrutiny 
2021-03-02, Jack Ma loses title as China's richest man after coming under Beijing's scrutiny 
2021-03-02, Chinese fintech platforms expected to meet capital requirements within 2 years-regulator 
2021-03-01, AI chip firm Wave Computing emerges from Chapter 11 bankruptcy protection 
2021-03-01, Innovation is popping up everywhere: Five platforms for growth 
2021-02-26, Tim Hortons plans to open 200 more restaurants in China and sell retail coffee on Alibaba 
2021-02-26, Mukesh Ambani Is Again Richest Asian as China's Zhong Loses $22 Billion 
2021-02-26, China's Ant to boost consumer finance unit capital as it restructures micro-lending -sources 
2021-02-26, China's Ant to boost consumer finance unit capital as it restructures micro-lending -sources 
2021-02-26," Tim Hortons China raises fresh cash, plans to add 200 shops in 2021 "
2021-02-25, Sports retailer Fanatics enters China via venture with Hillhouse Capital 
2021-02-25, Sports retailer Fanatics enters China via JV with Hillhouse Capital 
2021-02-25, China's Suning.com says shareholders plan to sell up to 25% stake 
2021-02-24," Alibaba, Once a Fund Darling, Dumped By Point72, Hillhouse "
2021-02-24, Ant investor Boyu Capital targets $6 bln for new private equity fund -sources 
2021-02-23, Bill Gates-led Clean Tech Fund Adds New Billionaire Investors 
2021-02-22, SoftBank Vision Fund set for new portfolio champion with Coupang IPO 
2021-02-22, ESG Magnates Pour Money Into Asia as Rest of Developing World Lags 
2021-02-18, German investor Angermayer's SPAC aims to raise up to $200 mln in U.S. IPO 
2021-02-17, German investor Angermayer to launch biotech SPAC in the U.S. -sources 
2021-02-17, German investor Angermayer to launch biotech SPAC in the U.S. -sources 
2021-02-17, Chinese discouraged from Lunar New Year travel go to movies instead 
2021-02-17, Chinese discouraged from Lunar New Year travel go to movies instead 
2021-02-16, RevoluGROUP Canada Inc. RevoluPAY landmark deal to Integrate ALIPAY 
2021-02-16, Chinese cinema stocks a hit as New Year drives box office record 
2021-02-16, Hong Kong stocks close at 2-1/2 year high on economic optimism after Lunar New Year break 
2021-02-16, Economic optimism lifts HK stocks to 2-1/2-year high after Lunar New Year break 
2021-02-16, Cinema stocks jump as China's holiday box office sets revenue record 
2021-02-12, SoftBank-backed Coupang reveals revenue surge ahead of U.S. IPO 
2021-02-12, China New Year travel slumps amid coronavirus curbs 
2021-02-10," HKEX's new CEO seen focusing on product expansion, diversifying revenue "
2021-02-09," Covid Keeps Workers in Factories, Distorting China Spending "
2021-02-09, Wall Street Is Investing Billions to Scale Tiny Mom-and-Pop Sellers on Amazon 
2021-02-09, China tech firms look to bolster legal defense amid regulatory crackdown-sources 
2021-02-09," Tencent hit with fresh anti-monolopy complaint, this time from GM China venture "
2021-02-09," Temasek CEO Ho Ching to retire Oct 1, Pillay to take over "
2021-02-09, Tencent bolsters defenses for core businesses as ByteDance muscles into its turf 
2021-02-08, How One Woman Turned a $40 Million Kuaishou Bet Into $12 Billion 
2021-02-08, Chinese authorities slap Vipshop with large fine as regulatory arsenal expanded 
2021-02-07, China issues new anti-monopoly rules targeting its tech giants 
2021-02-07, China issues new anti-monopoly rules targeting its tech giants 
2021-02-06, Herbalife Wraps Up Repricing Sale as Buyers Pile on Risky Deals  
2021-02-05, China central bank research paper suggests requiring big tech to report credit data 
2021-02-05," Investors flock to $5 bln Alibaba bond deal, shrug off regulatory woes "
2021-02-05, Investor demand for $5 bln Alibaba bond deal undimmed by regulatory woes 
2021-02-05, commerce giant Alibaba prices $5 bln bond deal 
2021-02-04, Alibaba Group Announces Pricing of Offering of US$5 Billion of Senior Unsecured Notes 
2021-02-04, China's Ant to hive off credit data in revamp; sees IPO in 2 years-sources 
2021-02-04," China stocks fall on fresh liquidity concerns, Hong Kong dragged by tech shares "
2021-02-04, Alibaba sets initial price guidance on $5 bln bond offering - term sheet 
2021-02-04, Alibaba sets initial price guidance on $5 bln bond offering - term sheet 
2021-02-03, Ant Group reaches deal with China regulators on restructuring - source 
2021-02-03, Ant Group reaches deal with China regulators on restructuring - Bloomberg News 
2021-02-03," Ant Group reaches deal with China regulators on restructuring, Bloomberg News reports "
2021-02-03," Ant Group reaches deal with China regulators on restructuring, Bloomberg News reports "
2021-02-03, Elon Musk's banter with Robinhood CEO triggers stampede for Clubhouse app 
2021-02-03," China shares rise as virus cases drop, auto stocks rally "
2021-02-03," Tencent fires 100 employees, blacklists 37 firms in anti-graft campaign "
2021-02-03, Alibaba plans up to $5 bln U.S.-dollar bond issuance -term sheet 
2021-02-03, Alibaba plans up to $5 bln U.S.-dollar bond issuance -term sheet 
2021-02-02, Alibaba Resumes Plan for $5 Billion Bond After Revenue Gain 
2021-02-02, Alibaba Group Announces Proposed Offering of Senior Unsecured Notes 
2021-02-02, Alphabet shares jump as Google sales top estimates 
2021-02-02, Short seller Kerrisdale goes long on 'The Robinhood of China' 
2021-02-02," Wall St set to climb ahead of Amazon, Alphabet earnings; stimulus in focus "
2021-02-02," Wall St set to climb ahead of Amazon, Alphabet earnings; stimulus in focus "
2021-02-02," Stocks are roaring higher ahead of Amazon, Alphabet earnings "
2021-02-02, Chinese state newspaper omits Jack Ma from list of entrepreneurial leaders 
2021-02-02, Chinese state newspaper omits Jack Ma from list of entrepreneurial leaders 
2021-01-29, SoftBank's Son expects mass production of driverless cars in 2 years 
2021-01-29, RDIF says completes joint investment of 7.85% in AliExpress Russia alongside partners 
2021-01-29, China paper urges tougher curbs on algorithms used by online platforms 
2021-01-28, 19 epidemic widens China's North-South economic divide 
2021-01-28, Saudi Arabia's futuristic city project in talks over cloud computing deal 
2021-01-28," China's iQiyi to offer free movies, TV over holiday after Beijing's urging "
2021-01-28, Venture Capital firm GGV raises $2.52 bln for latest funds 
2021-01-27, China's Ant Group plans revamp amid regulator pressure - WSJ 
2021-01-26," Sovereign wealth, public pension giants caught up in U.S.-China tech fight "
2021-01-26," India retains ban on 59 Chinese apps, including TikTok "
2021-01-26, Atos partners with OVHcloud to offer European-made cloud services 
2021-01-25," India to impose permanent ban on 59 Chinese apps, including TikTok - Indian media "
2021-01-22," China's antitrust moves not aimed at private sector nor specific firms, regulator says "
2021-01-22," China's antitrust moves not aimed at private sector, specific firms, regulator says "
2021-01-22," China's antitrust measures not aimed at private sector, specific firms - regulatory official "
2021-01-21, Luxury fashion platform Mytheresa valued at $2.2 bln in U.S. IPO 
2021-01-21, Jack Ma's reappearance fails to soothe all investor concerns about regulatory crackdown 
2021-01-21, Nikkei closes at 30-year high as Biden inauguration sparks optimism 
2021-01-21, Japan's Nikkei rises following Wall Street's record high 
2021-01-21, Jack Ma's reappearance fails to soothe all investor concerns 
2021-01-20, Kahoot Weighs U.S. Listing to Ride Boom in Educational Games 
2021-01-20, Alibaba-backed logistics firm Best weighs sale in strategic review -sources 
2021-01-20, Hong Kong shares end at over 20-month high on tech boost 
2021-01-20, Alibaba-backed logistics firm Best weighs sale in strategic review -sources 
2021-01-19, Stocks Rise to Record on Hope for New Aid Bill: Markets Wrap 
2021-01-19, Chinese regulator approves Cisco's $4.5 bln Acacia deal 
2021-01-19, Chinese regulator approves Cisco acquisition of Acacia 
2021-01-19, Bill Gates-Led Fund Raises Another $1 Billion to Invest in Clean Tech 
2021-01-15," Investors resigned to Trump's China ban, with Biden seen changing little "
2021-01-15, Trump administration takes final swipes at China and its companies 
2021-01-15, Trump administration takes final swipes at China and its companies 
2021-01-15," Investors resigned to Trump's China ban, with Biden seen changing little "
2021-01-15, Trump administration takes final swipes at China and its companies 
2021-01-15, Trump administration takes final swipes at China and its companies 
2021-01-15, Trump administration takes final swipes at China and its companies 
2021-01-15, Trump administration takes final swipes at China and its companies 
2021-01-15, Trump administration takes final swipes at China and its companies 
2021-01-15, Playtika prices $1.88 bln IPO above target range 
2021-01-15, Playtika prices $1.88 bln IPO above target range -sources 
2021-01-15, Playtika prices $1.88 bln IPO above target range 
2021-01-15, Trump administration takes final swipes at China and its companies 
2021-01-14, Trump administration takes final swipes at China and its companies 
2021-01-14, U.S. unlikely to add more Chinese firms to military blacklist until Jan. 20 -U.S. official 
2021-01-14, Stocks rise to records in anticipation of U.S. stimulus plan; yields up 
2021-01-14, Poshmark valued at over $7 bln in blockbuster Nasdaq debut 
2021-01-14," Stocks climb in anticipation of U.S. stimulus plan, yields up slightly "
2021-01-14, Blackstone-Backed Hedge Fund That Beat Peers Likes Old-World EMs 
2021-01-14, Stimulus helps stocks shrug off impeachment chaos 
2021-01-14, Stimulus helps stocks shrug off impeachment chaos 
2021-01-14, WhatsApp scrambles as users in big Indian market fret over privacy 
2021-01-14," South African rand, Russian rouble rise; stocks at record high "
2021-01-14," Alibaba, Tencent boost Hong Kong shares as Trump scraps investment ban "
2021-01-14, Treasury Yields Rise on Aid Report; Stocks Advance: Markets Wrap 
2021-01-14, Bonds slip as markets bet Biden goes big 
2021-01-14, PayPal becomes first foreign firm in China with full ownership of payments business 
2021-01-14," Consumer firms drag China shares lower; Alibaba, Tencent boost Hong Kong "
2021-01-14, China's yuan eases as dollar rebounds on higher U.S. yields 
2021-01-14," Trump administration shelves planned investment ban on Alibaba, Tencent, Baidu -sources "
2021-01-14," Bonds dip, Nikkei charges higher as stimulus hopes stoke gains "
2021-01-14, Trump bolsters ban on U.S. investments in China 
2021-01-13," Trump administration shelves planned investment ban on Alibaba, Tencent, Baidu -sources "
2021-01-13," Trump administration shelves planned investment ban on Alibaba, Tencent, Baidu -sources "
2021-01-13," Primavera chairman believes Ma 'safe and sound', upbeat on Ant "
2021-01-13," PE firm Primavera chairman believes Ma 'safe and sound,' upbeat on Ant "
2021-01-13, PE firm Privavera chairman says remain optimistic about China's Ant Group 
2021-01-12, The trillion dollar weapon in the U.S.-China tech stock war 
2021-01-11, BlackRock says ETFs match index cuts of China stocks 
2021-01-11, China to push its tech giants to share consumer credit data-sources 
2021-01-11, Take Five: The great reflation 
2021-01-11, Chinese regulators to push tech giants to share consumer credit data-sources 
2021-01-11, China's Baidu to create an intelligent EV company with automaker Geely 
2021-01-08, Trading in 12 off-exchange Chinese securities to be restricted 
2021-01-08, Take Five: The great reflation 
2021-01-08, Chinese telecom firms lose $5.6 bln in value as index providers drop them 
2021-01-08, China's Biggest Carmaker Targets Best Sales Growth in a Decade 
2021-01-08," MSCI, FTSE Russell drop Chinese telcos, shares lose $10 bln in value "
2021-01-08, Chinese bargain hunters pile into stocks blacklisted by Trump 
2021-01-08," China's internet regulator weighs tighter curbs on payment, shopping platforms "
2021-01-08," Baidu plans smart EV company, to make cars at Geely plant - sources "
2021-01-08," Baidu plans smart EV company, to make cars at Geely plant - sources "
2021-01-07, Tesla's stock market value tops Facebook's in huge trading 
2021-01-07, 'Weaponizing financial markets': Trump's rules on China investment spark confusion across global finance 
2021-01-07, Trump administration to mull expansion of China investment ban -sources 
2021-01-07, Trading in 12 off-exchange Chinese securities to be restricted 
2021-01-07," Baidu plans smart EV company, to make cars at Geely plant - sources "
2021-01-07, Playtika eyes nearly $10 bln valuation in U.S. listing as gaming booms 
2021-01-07," U.S. considering adding Alibaba, Tencent to China investment ban -sources "
2021-01-07," EMEA FX, stocks gain as Democrat Senate win hits dollar "
2021-01-07, Pompeo angers China with Hong Kong sanctions threat 
2021-01-07, Hong Kong stocks ended lower on NYSE's U-turn to delist 3 Chinese telecoms 
2021-01-07, Nikkei hits 30-year high as financials gain on Democrat control of Senate 
2021-01-07, Nikkei hits 30-year high as financials gain on Democrat control of Senate 
2021-01-07, Nikkei hits 30-year high as financials gain on Democrat control of Senate 
2021-01-07," U.S. considering adding Alibaba, Tencent to China investment ban -sources "
2021-01-07," Democrat Senate win drives stocks higher, bonds lower "
2021-01-07," China stocks advance, Hong Kong falls on NYSE's U-turn to delist 3 Chinese telecoms "
2021-01-07, China's yuan firms on dollar weakness as Democrats win Senate control 
2021-01-07," Democrat Senate win drives stocks higher, bonds lower "
2021-01-07," U.S. considering adding Alibaba, Tencent to China stock ban -sources "
2021-01-07," Nikkei hits 30-year high, financials boost Topix after Georgia runoffs "
2021-01-07," Stocks ride higher on Democrat Senate win, dollar founders "
2021-01-07," U.S. considering adding Alibaba, Tencent to China stock ban -sources "
2021-01-06," U.S. mulling to add Alibaba, Tencent to China stock ban - WSJ "
2021-01-06," U.S. mulling to add Alibaba, Tencent to China stock ban - WSJ "
2021-01-06, Trump bars U.S. transactions with eight Chinese apps including Alipay 
2021-01-06, Trump bars U.S. transactions with eight Chinese apps including Alipay 
2021-01-06, Alibaba plans $5 bln bond this month amid regulatory scrutiny -sources 
2021-01-06, Alibaba plans $5 bln bond this month amid regulatory scrutiny -sources 
2021-01-06, Alibaba plans $5 bln bond this month amid regulatory scrutiny -sources 
2021-01-06, Trump bars U.S. transactions with eight Chinese apps including Alipay 
2021-01-06, Alibaba plans to raise at least $5 bln via dollar bond this month -sources 
2021-01-06, Alibaba plans to raise at least $5 bln via dollar bond this month -sources 
2021-01-06, Trump bars U.S. transactions with eight Chinese apps including Alipay 
2021-01-06, Trump signs order banning transactions with eight Chinese apps including Alipay 
2021-01-05, Why China Is Sentencing a Tycoon to Death 
2021-01-05," Gojek, Tokopedia in $18 bln merger talks for Indonesia's biggest deal "
2021-01-05," Indonesia's Gojek, Tokopedia in advanced $18 bln merger talks -sources "
2021-01-04, This Is What Asia's Stock Investors Are Betting On in 2021 
2021-01-04, China ADRs Fall as U.S. Ramps Up Pressure on Delistings 
2021-01-04, Where is Jack Ma? Speculation swirls about whereabouts of billionaire not seen in public since rant against China banks two months ago 
2021-01-04, Jack Ma's disappearing act fuels speculation about billionaire's whereabouts 
2021-01-04, Pinduoduo faces labor probe after employee death-newspaper 
2020-12-31, Rectification and revenge: How China is plotting to break up Jack Ma's Ant Group empire 
2020-12-31, Chinese regulators probe Ant Group's equity investments - sources 
2020-12-30, Hong Kong stocks mark 10-month closing high on recovery hopes 
2020-12-30," China's blue-chip, start-up indexes hit over five-year high on growth hopes "
2020-12-30," China, HK stocks join Asian markets rally on economic recovery hopes "
2020-12-29, These Are the Winners and Losers in Japan's 2020 Stock Market 
2020-12-29," Ant weighs financial holding company to placate regulators, sources say "
2020-12-29," Ant weighs financial holding company to placate regulators, sources say "
2020-12-29," Ant weighs holding company for financial businesses to placate regulators, sources say "
2020-12-29, Hong Kong shares end firmer as bargain hunters boost Alibaba after recent sell-off 
2020-12-29, Japan stocks lead Asian shares higher as U.S. stimulus fuels rally 
2020-12-28, Hong Kong Exchange Is Finding It Tough to Appoint a New CEO 
2020-12-28, STC to invest up to $500 mln in cloud services with partners 
2020-12-28, Wall St set to open near record highs after Trump signs fiscal aid bill 
2020-12-28, Wall St set to open near record highs after Trump signs fiscal aid bill 
2020-12-28," S&P, Nasdaq futures at record levels as Trump signs stimulus aid bill "
2020-12-28," S&P, Nasdaq futures at record levels as Trump signs stimulus aid bill "
2020-12-28, Hong Kong stocks end down as techs weigh 
2020-12-28, Alibaba's $10 bln buyback plan fails to halt stock slide as regulatory concerns mount 
2020-12-28, Chinese online tutor Zuoyebang raises more than $1.6 bln 
2020-12-28, China stocks climb on upbeat industrial profit data 
2020-12-28, China pushes Ant Group overhaul in latest crackdown on Ma 
2020-12-28," Alibaba increases share repurchase program to $10 bln, shares fall "
2020-12-28, China pushes Ant Group overhaul in latest crackdown on Ma 
