date,headlines
2023-02-01," Posthaste: Baby boomers delaying retirement have eased labour shortages, but our luck is about to run out "
2023-01-31," China leads the world in counterfeit, pirated products -U.S. report "
2023-01-30, China stocks rise on consumption recovery during holidays 
2023-01-30, China stocks jump as holiday travel rebound lifts sentiment 
2023-01-29, Elon Musk's mysterious ways on display in Tesla tweet trial 
2023-01-24, Activist investors crowd into tech companies as runaway growth ebbs 
2023-01-23, Activist investors crowd into tech companies as runaway growth ebbs 
2023-01-20, China stocks close higher as officials say worst in COVID battle over 
2023-01-19, Chinese companies set for biggest earnings growth in 5 years in 2023-Refinitiv data 
2023-01-19, Asia Hedge Funds Avert Disaster on Scale of Financial Crisis With China's Reopening 
2023-01-17," Investor Ryan Cohen builds Alibaba stake, wants more share buybacks "
2023-01-17," Futures slip ahead of Goldman, MS earnings as China data hits sentiment "
2023-01-17," Stocks, FX slip as weak China growth dents sentiment "
2023-01-17, Didi's China ride-hailing app back on some app stores 
2023-01-17," China's economic growth falls to 3%, gradually reviving "
2023-01-17," Investor Ryan Cohen builds Alibaba stake, pushes for more share buybacks "
2023-01-16, China lifts 18-month ban on new Didi users as tech crackdown wanes 
2023-01-16, China lifts ban on ride-hailing giant Didi's new user registration 
2023-01-15," As China Tech Stocks Roar Back, a New Normal Will Test Upside "
2023-01-13, China's Didi on comeback trail after suffering regulatory setbacks 
2023-01-13, China acquires 'golden shares' in two Alibaba units 
2023-01-12," Google, Porsche in talks over Google Apps access "
2023-01-12, China stocks seesaw in thin trade ahead of holidays 
2023-01-12," Google, Porsche in talks over Google Apps access - Manager Magazin "
2023-01-12, China stocks fall amid concerns ahead of holidays 
2023-01-11, Stocks back off from six-month highs as U.S. CPI caution remains 
2023-01-11, Foreigners' dry powder is fuel for a long stock market rally in China 
2023-01-11, Stocks back off from six-month highs as U.S. CPI caution remains 
2023-01-11," HK stocks hit six-month highs on rebound hopes, China lower "
2023-01-11," China stocks extend gains on rebound hopes, cheaper valuations "
2023-01-11," China stocks extend gains on rebound hopes, cheaper valuations "
2023-01-10, Alibaba Cloud Launches Global Apsara Developer Community 
2023-01-09, Nasdaq leads gains on Wall Street as interest rate worries ease 
2023-01-09, Nasdaq leads Wall St higher as interest rate worries ease 
2023-01-09, Infobip reveals the five most significant trends in customer experience and omnichannel communications for 2023 
2023-01-09," Wall St eyes higher open on China optimism, easing rate hike worries "
2023-01-09," Futures rise on China reopening optimism, easing rate hike worries "
2023-01-09, Shares surge to five-month highs as China reopens borders 
2023-01-09," China, HK stocks gain on border reopening, Beijing's support for internet sector "
2023-01-09," Asian FX gains on optimism over China reopening, smaller Fed hikes "
2023-01-09, Alibaba Cloud Unveils Its First International Product Innovation Center and Partner Management Center 
2023-01-09, Goodbye to all that 
2023-01-09, Asian stock markets mixed ahead of US inflation update 
2023-01-09," China, HK stocks gain on border reopening, Beijing's support for internet sector "
2023-01-09, Ant-linked firms' shares rise after news of Jack Ma ceding control; Alibaba jumps 
2023-01-07, Ant Group founder Jack Ma to give up control in key revamp 
2023-01-07, Ant Group founder Jack Ma to give up control in key restructuring 
2023-01-07, Jack Ma to relinquish control of Ant Group 
2023-01-06, China stocks shine in first week of 2023 on economic recovery hopes 
2023-01-06, China stocks shine in first week of 2023 on economic recovery hopes 
2023-01-05, Tax Havens Obscured at Least $1.4 Trillion of Foreign Investment in China 
2023-01-04, Wall St eyes higher open with focus on Fed minutes 
2023-01-04, Futures edge higher ahead of Fed meeting minutes 
2023-01-04," Tech, property shares lift Hong Kong stocks as recovery hopes brighten "
2023-01-04, Chinese regulators approve capital expansion for Ant Group 
2023-01-04," HK stocks surge, China extends gains on economic recovery hopes "
2023-01-03," Wall St falls in 2023 trading kick-off; Apple, Tesla shares drag "
2023-01-03," Wall St falters at start of 2023 as Apple, Tesla shares fall "
2023-01-03," Wall Street drops as Apple, energy stocks weigh "
2023-01-03, Wall Street eyes higher open on first trading day of 2023 
2022-12-29, 'Woke people have taken over': Home Depot's billionaire co-founder Bernie Marcus is worried about capitalism 
2022-12-29, Former PBOC official says China's digital yuan is little used - Caixin 
2022-12-27," S&P 500, Nasdaq close lower, weighed by growth stocks "
2022-12-27," S&P 500, Nasdaq close lower, weighed by growth stocks "
2022-12-27," S&P 500, Nasdaq close lower, weighed by growth stocks "
2022-12-27," Wall Street dips as growth stocks drag on S&P 500, Nasdaq "
2022-12-27," Tesla, megacap growth stocks pull Nasdaq lower; Dow rises "
2022-12-27," S&P 500, Nasdaq knocked down by Tesla, megacap stocks "
2022-12-27, Wall St set to open higher after China relaxes COVID curbs 
2022-12-27, Wall St set to open higher after China relaxes COVID curbs 
2022-12-27, Futures climb as China eases COVID curbs 
2022-12-22," Chinese bluechips, HK shares rise as China vows to deepen reforms "
2022-12-22, Asian markets follow Wall St lower on inflation worries 
2022-12-22," China, HK stocks rise after Chinese securities regulator vows further reforms "
2022-12-21," Asian shares advance, Hong Kong up 2.8%, after Wall St rally "
2022-12-20, Smartphone maker Xiaomi to slash 10% of jobs amid China's COVID battle 
2022-12-20, Demand for Lemons Surges as Chinese Seek Immunity Against Covid 
2022-12-19, China stocks fall as COVID jitters outweigh policy support 
2022-12-19, Asia's stockpickers struggle in vintage year for big picture hedge funds 
2022-12-19, China stocks fall as COVID outbreaks dent sentiment 
2022-12-18," China Hints at Pro-Business Policies, Smaller Fiscal Boost "
2022-12-16, Hanging tough 
2022-12-16, Five radical investing views and whether you should take advantage of them 
2022-12-16, Hawk-eyed 
2022-12-16, Chinese firms avert delisting as U.S. audit watchdog gets full inspection access 
2022-12-15, Buying into the live-shopping phenomenon 
2022-12-15," Georgia, NH latest states to ban TikTok from state computers "
2022-12-14," U.S., UK export controls hit China's access to Arm's chip designs -FT "
2022-12-14," U.S., UK export controls hit China's access to Arm's chip designs - FT "
2022-12-08," Stocks, oil struggle to pull out of four-day slide "
2022-12-08," Stocks, oil struggle to pull out of four-day slide "
2022-12-08, Hong Kong stocks rise on report of more easing in COVID curbs 
2022-12-08, SoftBank Group CEO Son's stake rises to more than a third 
2022-12-08, SoftBank Group CEO Son gains more control after his stake climbs to over a third 
2022-12-08, SoftBank Group CEO Son gains more control after his stake climbs to over a third 
2022-12-08, Hong Kong stocks rise on report of more easing in COVID curbs 
2022-12-07, Shopify stock seen carrying weight of Canadian tech stocks curse into 2023 
2022-12-07, Wall Street set to open lower as recession worries mount 
2022-12-07, Futures fall on growing fears of recession 
2022-12-06, Maryland governor bans use of TikTok on state devices 
2022-12-06," China stocks end higher, HK dips amid worries of Fed's rate stance "
2022-12-06," China stocks turn range bound, Hong Kong dips, as U.S. data dulls hopes for slower Fed hikes "
2022-12-05, Wall St set for lower open ahead of service-sector data 
2022-12-05, Futures fall as investors await more data before Fed meet 
2022-12-01, Posthaste: Deteriorating housing affordability conjures the 1980s when real estate took a dive 
2022-11-30, Where's Jack Ma? Alibaba founder discovered living in Tokyo since China's tech crackdown 
2022-11-30," China stocks end higher on Guangzhou COVID easing, auto gains "
2022-11-29, S&P 500 ends down as Apple dips and traders eye Powell speech 
2022-11-29, Pickup in U.S. 'Cyber Week' sales beat China's Singles Day gain 
2022-11-29, S&P 500 ends down as Apple dips and traders eye Powell speech 
2022-11-29, Wall Street mixed as Apple dips and traders eye Powell speech 
2022-11-29, Pickup in U.S. 'Cyber Week' sales beat China's Singles Day gain 
2022-11-29, Wall Street dips as growth shares offset energy gains 
2022-11-29, Wall Street flat as energy stocks limit declines in growth shares 
2022-11-29, Nasdaq set for small gains as Tesla leads growth shares higher 
2022-11-29," Futures edge higher on boost from growth stocks, hopes of looser China COVID curbs "
2022-11-29," China stocks, yuan jump as hopes of reopening rekindle risk appetite "
2022-11-29," China stocks, yuan jump as hopes of reopening rekindle risk appetite "
2022-11-28," Apple, energy shares drag Wall St lower amid China COVID protests "
2022-11-28," Apple, energy shares drag Wall St lower amid China COVID protests "
2022-11-28, Wall St set to open lower on China's anti-lockdown protests; Apple slips 
2022-11-28, Wall St futures slip on China COVID woes; Apple falls 
2022-11-28, Japan's Nikkei slips amid China COVID worries; tech shares slide 
2022-11-28, Japan's Nikkei sinks as China COVID worries weigh; tech shares slide 
2022-11-25, Beijing on edge as city adds new quarantine centers 
2022-11-25, China stocks rise on property boost; Hong Kong slips as COVID weighs 
2022-11-23, China's Fosun seeks to sell stake in Alibaba's logistics arm Cainiao- sources 
2022-11-23," China markets end higher on fresh property support, HK tracks Wall St gains "
2022-11-23, Hong Kong stocks track Wall St gains; China slides 
2022-11-22," China set to fine Ant Group over $1 bln, signaling revamp nears end-sources "
2022-11-22," China set to fine Ant Group over $1 bln, signaling revamp nears end-sources "
2022-11-22," China set to fine Ant Group over $1 bln, signaling revamp nears end-sources "
2022-11-21, Wall St eyes lower open as China COVID cases rise; Disney jumps 
2022-11-21, Futures decline as China COVID cases rise; Disney jumps 
2022-11-21, Beijing Stock Exchange launches benchmark index as it seeks to lure investors 
2022-11-18, Stocks Settle Down as Traders Make Peace With Fed: Markets Wrap 
2022-11-17, TSX falls to 9-day low as commodity prices slide 
2022-11-17, TSX falls as commodity stocks weigh 
2022-11-17," Wall St set to open lower after mixed economic data, hawkish Fed comments "
2022-11-17, Futures fall as investors assess mixed economic data 
2022-11-17, Good is bad? Depends on who or what you are 
2022-11-17, China stocks fall as COVID flare-ups dent sentiment 
2022-11-16, U.S. watchdog gained 'good access' to audits of Chinese firms -sources 
2022-11-15, Wall Street jumps on growing evidence of easing inflation 
2022-11-15, Wall Street jumps on more evidence of cooling inflation 
2022-11-15," Druckenmiller Reloads on Amazon, BlueCrest Bolsters Gold Bet "
2022-11-15," Futures rise on U.S.-China talks, inflation data in focus "
2022-11-15," China stocks surge on Xi-Biden meeting, pro-growth policies "
2022-11-15, China's Tencent starts new round of layoffs -sources 
2022-11-15," China stocks surge on Xi-Biden meeting, pro-growth policies "
2022-11-15," China stocks rise on Xi-Biden meeting, pro-growth policies "
2022-11-14," US Earnings to Watch: Walmart, Home Depot, Nvidia, Gap "
2022-11-14, SoftBank shares tumble after Vision Fund reports another big loss 
2022-11-14," A More Efficient, Innovative and Greener 11.11 Runs Wholly on Alibaba Cloud "
2022-11-12," Alibaba mum on Singles Day sales tally, says in line with 2021 "
2022-11-12," Alibaba stays mum on Singles Day sales tally, says in line with 2021 "
2022-11-12, Chinese brands outnumber foreign names among Singles Day best-sellers 
2022-11-11," Nasdaq, S&P 500 end sharply higher, fueled by inflation optimism "
2022-11-11," Nasdaq and S&P 500 end higher, fueled by inflation optimism "
2022-11-11, Alibaba's 2022 11.11 Global Shopping Festival Facilitates Quality Growth for Brands and Merchants 
2022-11-11," Nasdaq and S&P 500 add to rally, stoked by inflation optimism "
2022-11-11," Alibaba stays mum on Singles Day sales tally, says in line with 2021 "
2022-11-11," S&P 500, Nasdaq gain on rising bets of Fed slowdown; healthcare drags Dow "
2022-11-11," S&P 500, Nasdaq extend gains on Fed slowdown bets "
2022-11-11, Wall St set to extend Thursday's surge on hopes of less hawkish Fed 
2022-11-11, SoftBank reports Q2 profit but announces more Vision Fund pain with FTX writedown 
2022-11-11, Futures point to fresh gains on Wall Street 
2022-11-11, No easy fix for China as economy slows more than expected 
2022-11-11, SoftBank swings to Q2 profit but unveils more Vision Fund pain with FTX writedown 
2022-11-11, SoftBank swings to Q2 profit but unveils more Vision Fund pain with FTX writedown 
2022-11-11, Japan's SoftBank returns to profit as investments rebound 
2022-11-11, Final stretch of China Singles Day shopping festival lacks sales oomph 
2022-11-11, Japan's SoftBank returns to quarterly profit but unveils more Vision Fund pain 
2022-11-11, China Singles Day events show 4.7% sales slide in first half of last day -research firm 
2022-11-11, China's muted Singles' Day shopping fest expects slow growth 
2022-11-10, Alibaba's Singles Day shopping event set to end with subdued sales and no fanfare 
2022-11-09, Microsoft faces new EU antitrust complaint on cloud computing practices 
2022-11-08, Microsoft faces new EU antitrust complaint on cloud computing practices 
2022-11-08, China stocks end lower as domestic COVID cases hit 6-month high 
2022-11-08, China stocks fall after rally driven by reopening bets 
2022-11-07, Wall St set to open higher with focus on midterm elections 
2022-11-07, Brooklyn Nets owners start program for minority-led startups 
2022-11-07, Futures rise as focus shifts to midterm elections 
2022-11-07, Futures rise as focus shifts to midterm elections 
2022-11-07, CEO of China's Bilibili to manage gaming unit in bid to boost revenue 
2022-11-07," Asia Earnings Week Ahead: SoftBank, SMIC, Nintendo, NAB, Nissan "
2022-11-05, A Stock Trader's Guide to the US Midterm Elections 
2022-11-04, Wall St rallies to close out soft week after jobs report 
2022-11-04, Wall St rallies to close out soft week after jobs report 
2022-11-04, Wall St climbs in volatile trade after payrolls report 
2022-11-04, Wall St slips in choppy trade after mixed jobs report 
2022-11-04, U.S. audit inspection of Chinese companies in Hong Kong ends - sources 
2022-11-04, U.S. audit inspection of Chinese companies in Hong Kong ends - sources 
2022-11-04, U.S. audit inspection of Chinese companies in Hong Kong ends - sources 
2022-11-04, Wall St climbs as jobs data supports smaller rate hike prospects 
2022-11-04," China stocks notch trillion-dollar gain on hopes of reopening, better U.S. ties "
2022-11-04, Wall St eyes higher open after October jobs data 
2022-11-04," China stocks notch trillion-dollar gain on hopes of reopening, better U.S. ties "
2022-11-04, Futures rise with all eyes on key jobs data 
2022-11-04, Futures rise ahead of key jobs report 
2022-11-04, Stocks on course for best week in more than a year 
2022-11-04," China stocks notch trillion-dollar gain on hopes of reopening, better U.S. ties "
2022-11-04," China stocks notch trillion-dollar gain on hopes of reopening, better U.S. ties "
2022-11-04," China stocks eye best week in years on audit, reopening hopes "
2022-11-04," China stocks eye best week in years on audit, reopening hopes "
2022-11-04," China stocks surge on audit, COVID restrictions hopes "
2022-11-03, Alibaba Cloud Launches ModelScope Platform and New Solutions to Lower the Threshold for Materializing Business Innovation 
2022-11-02, Wall St set to open lower on strong private jobs data ahead of Fed decision 
2022-11-02, Futures subdued ahead of Fed rate decision 
2022-11-02, Futures edge higher as investors await Fed decision 
2022-11-02, Alibaba Cloud Showcases Wuying Cloudbook at Apsara Conference 
2022-11-01, Wall St slips as jobs data dents hopes for Fed rate deceleration 
2022-11-01, Wall St slips as jobs data dents Fed deceleration wish 
2022-11-01, Wall St slips as labor market data dims Fed deceleration hopes 
2022-11-01, Wall St dips as strong job openings dent Fed pivot hopes 
2022-11-01, Wall St slips as job openings dampen Fed pivot hopes 
2022-11-01, Wall Street eyes higher open with Fed in focus 
2022-11-01, Future rise after strong month on Wall Street 
2022-10-28, Credit Suisse's newly created investment bank lays out plans in memo 
2022-10-27," China stocks fall on weak industrial profit data, COVID; HK tracks Asian markets higher "
2022-10-27," China stocks dip on industrial profit data, COVID; HK follows Asian markets higher "
2022-10-26," Moody's cuts Fosun International's credit rating, raises concerns over asset sales "
2022-10-26," Moody's cuts Fosun International's rating, revises outlook to 'negative' "
2022-10-25," Moody's cuts Fosun International's rating, revises outlook to 'negative' "
2022-10-24, Allianz China Fund Bets on Reopening as Xi Stands by Covid Zero 
2022-10-24, China ADRs tumble as Xi's new team sparks worries over economy's path 
2022-10-24, Wall Street set to open higher as bond yields retreat 
2022-10-24, China ADRs slump on fears Xi's new team to favor state over growth 
2022-10-24, Futures reverse losses as bond yields retreat 
2022-10-24, China ADRs slump on fears Xi's new team to favor state over growth 
2022-10-24, China stocks tumble as Xi's team fans economic concern; yuan weakens 
2022-10-24, China stocks tumble as Xi's team fans economic concern; yuan weakens 
2022-10-24, Futures slide as China worries sour global mood 
2022-10-24, Alibaba Group Kicks Off 2022 11.11 Global Shopping Festival 
2022-10-24, Hong Kong stocks tumble as Xi appointments fan economic fears; yuan weakens 
2022-10-24, Hong Kong stocks tumble after Xi appointments fan economic fears; yuan weakens 
2022-10-24, A Singles Day without livestream superhosts leaves Alibaba in a quandary 
2022-10-18," Singapore's GIC says global recession scenario possible, eyes Australia opportunities "
2022-10-18, China stocks edge higher on state support measures during congress 
2022-10-17, Take Five: Calm or calamity? 
2022-10-16, Key Takeaways From Xi Jinping's Two-Hour Speech 
2022-10-15, Musk has a 'super app' plan for Twitter. It's super vague 
2022-10-14, Take Five: Calm or calamity? 
2022-10-13, China's digital currency passes 100 bln yuan in spending - PBOC 
2022-10-13, China's Xi gets chance to tighten hold on economy at meeting 
2022-10-12," Canadian pensions join stampede out of Chinese stocks amid prolonged rout, delisting threat "
2022-10-12," China, Hong Kong stocks languish near recent lows on COVID policy woes "
2022-10-11, Megaport and Zenlayer Announce Strategic Partnership to Extend Their Joint Global Reach to 50+ Countries 
2022-10-10, The song remains the same 
2022-10-10, China tech shares sink as U.S. export curbs raise chip sector hurdles 
2022-10-10, China tech shares sink as U.S. export curbs raise chip sector hurdles 
2022-10-10, Dollar feeds on stress 
2022-10-10, China tech shares sink as U.S. export curbs raise chip sector hurdles 
2022-10-10, China tech shares sink as U.S. export curbs raise chip sector hurdles 
2022-10-10, Chinese tech shares tumble after U.S. publishes new export rules 
2022-10-09, China to include eligible dual-listed shares in Stock Connect scheme 
2022-10-07, What's a supercomputer? How the U.S. will decide who to punish with China tech curbs 
2022-10-07, Matthew Lau: Keep politics out of pension investing 
2022-10-05, Wall Street set to decline as rally in growth stocks falters 
2022-10-05, Wall Street set to decline as rally in growth stocks falter 
2022-10-05," Megacap stocks lose ground as yields rise, economic data awaited "
2022-10-05, Hong Kong stocks help emerging markets rise 2% 
2022-10-05, Hong Kong Stocks Surge Most in Asia After Return From Holiday 
2022-10-04," U.S. inspections of China corporate audits at 'very early stage,' PwC says "
2022-09-30, Amazon India rolls out live-stream shopping to drive festive season sales 
2022-09-29, SoftBank cuts about 150 staff globally -source 
2022-09-29, Audit breakthrough fails to lure investors into China ADRs 
2022-09-28," U.S. boutique bank Raine expands in Southeast Asia, bets on media and tech "
2022-09-28," U.S. boutique bank Raine expands in Southeast Asia, bets on media and tech "
2022-09-28," China stocks tumble to 5-month lows, tracking global peers "
2022-09-27, Canada's Ontario Teachers' fund plans Indian investment drive 
2022-09-27," China stocks rebound as consumer, tourism shares rise "
2022-09-26, Electric Blanket Sales Soar as Homeowners Struggle With Soaring Fuel Bills 
2022-09-26, Kevin O'Leary says it could be the best time to buy stocks 
2022-09-23," China stocks fall on foreign outflow concerns, geopolitical risks "
2022-09-22, China sends regulators to Hong Kong to assist U.S. audit inspection -sources 
2022-09-22, China sends regulators to Hong Kong to assist U.S. audit inspection-sources 
2022-09-22, SoftBank looks to form a 'strategic alliance' between Arm and Samsung 
2022-09-22, SoftBank to discuss Arm 'strategic alliance' with Samsung 
2022-09-21," Stocks, FX spooked before Fed decision; rouble down as Putin orders mobilization "
2022-09-21, China's blue-chip stocks hit four-month low as Fed rate hike looms 
2022-09-21, China stocks hit four-month low as Fed rate hike looms 
2022-09-20, China's livestreaming sales king returns to screens after long absence 
2022-09-20, China stocks track global peers higher ahead of Fed rate decision 
2022-09-20, China stocks track global peers higher ahead of Fed rate-hike decision 
2022-09-19," China, Hong Kong stocks dip further ahead of Fed meeting outcome "
2022-09-19," Chinese stocks mixed, Hong Kong falls ahead of Fed meeting "
2022-09-19," Chinese stocks mixed, Hong Kong falls ahead of Fed meeting "
2022-09-18, US-China Tech Rivalry Adds to Headaches for Stock Investors 
2022-09-14, SoftBank considers launching third Vision Fund - source 
2022-09-14," China, Hong Kong stocks slump on bets of aggressive Fed rate hikes "
2022-09-14, China stocks fall as U.S. inflation fuels more aggressive rate-hike bets 
2022-09-08," U.S. ban on Nvidia, AMD chips seen boosting Chinese rivals "
2022-09-07, Xi Renews Call for China Tech Push After US Escalates Curbs 
2022-09-07," China stocks fall as disappointing exports data, COVID weigh "
2022-09-06, Tech workers left hanging as Sea e-commerce arm Shopee rescinds job offers 
2022-09-06, Tech workers left hanging as Sea e-commerce arm Shopee rescinds job offers 
2022-09-05, China's Foreign Investment Data Distorted by Hong Kong Flows 
2022-09-05," China blue-chip stocks end lower on COVID woes, yuan weakness "
2022-09-05," China stocks fall as COVID woes, yuan weakness weigh "
2022-09-02, China securities regulator says will implement Sino-U.S. audit deal 
2022-09-02, China securities regulator says will implement Sino-U.S. audit deal 
2022-09-02, China securities regulator says will implement Sino-U.S. audit deal 
2022-09-01, New U.S. curbs on sales of Nvidia AI chips to China spark selloff 
2022-09-01, U.S. export ban on some advanced AI chips to hit almost all China tech majors - analysts 
2022-08-31," China gaming giants Tencent, NetEase invest in foreign studios "
2022-08-31," U.S. regulators to vet Alibaba, JD.com, other Chinese firms' audits -sources "
2022-08-31," Chinese gaming giants Tencent, NetEase snap up more foreign studios "
2022-08-31," U.S. regulators to vet Alibaba, JD.com, other Chinese firms' audits -sources "
2022-08-31," Shanghai stocks fall as COVID woes, weak factory activity weigh "
2022-08-31," U.S. regulators to vet Alibaba, JD.com, other Chinese firms' audits -sources "
2022-08-31," JD.com, Yum China among Chinese firms chosen for U.S. audit inspection -sources "
2022-08-31," Hedge fund Bridgewater, Citadel Securities expand Asian footprints "
2022-08-31," China stocks fall as COVID woes, weak factory activity weigh "
2022-08-31," U.S. regulators to vet Alibaba, other Chinese firms' audits -sources "
2022-08-30," Amazon, Google slam Microsoft's cloud computing changes "
2022-08-30," U.S.-listed Chinese shares tumble on geopolitical, regulatory concerns "
2022-08-30," U.S. regulators to vet Alibaba, other Chinese firms' audits -sources "
2022-08-30," U.S. regulators to vet Alibaba, other Chinese firms' audits -sources "
2022-08-30," U.S. regulators to vet Alibaba, other Chinese firms' audits -sources "
2022-08-29, Microsoft cloud computing changes to allay EU antitrust concerns effective Oct. 1 
2022-08-29, China audit deal offers relief but few reasons to invest 
2022-08-26, U.S. and China reach landmark audit deal in boon for Chinese tech companies 
2022-08-26," US, China reach deal in dispute over Chinese company audits "
2022-08-26, U.S. and China reach landmark audit deal in boon for Chinese tech companies 
2022-08-26," Wall St falls after Powell warns of tight policy, slow growth "
2022-08-26, China and U.S agree deal on audit dispute 
