date,headlines
2020-06-25, SoftBank is not 'SoftPunku' says CEO in defense of strategy 
2020-06-25, SoftBank is not 'SoftPunku' says CEO in defense of strategy 
2020-06-25, SoftBank CEO says equity value back at pre-virus levels 
2020-06-25, SoftBank CEO says equity value back at pre-virus levels 
2020-06-24, Jack Ma dethroned as China's richest person by Tencent's Pony Ma 
2020-06-24," China loses appetite for salmon, seafood on virus contamination worries "
2020-06-24, Mobile shares priced at $103 each in SoftBank sale 
2020-06-23, China's Fosun seeks sale of $1.3 bln stake in Alibaba's Cainiao -sources 
2020-06-23, SoftBank kicks off $21 bln sale of T-Mobile shares 
2020-06-19, Singapore Bungalow for $45 Million. Rare Artifacts Are Extra 
2020-06-19, Amazon signals entry into alcohol delivery in India with nod in key state -document 
2020-06-19," Cars, Coffee Shops Fuel Emerging-Market Rally Amid Rebound Bets "
2020-06-18, Oppo cancels live online phone launch in India amid calls to boycott Chinese goods 
2020-06-17, Oppo cancels live online phone launch in India amid calls to boycott Chinese goods 
2020-06-16, Tencent aims to become biggest shareholder of video streaming rival iQIYI -sources 
2020-06-10, China punishes microblog platform Weibo for interfering with communication 
2020-06-05," NetEase raises at least $2.7 bln in Hong Kong, more listings likely "
2020-06-05," As coronavirus sinks global demand, China's exporters go online to tap domestic market "
2020-06-04, Russia's Sberbank in talks to buy stake in online retailer Ozon -sources 
2020-06-04, Broken Food Supply Chain Has Some Consumers Buying Their Own Pigs 
2020-06-04, Broken Food Supply Chain Has Some Consumers Buying Their Own Pigs 
2020-06-03, China-owned Playtika hires banks for $1 bln U.S. IPO -sources 
2020-06-03, Key dates in Hong Kong's anti-government protests 
2020-06-03, Key dates in Hong Kong's anti-government protests 
2020-06-03, China-owned Playtika hires banks for $1 bln U.S. IPO -sources 
2020-06-02, Indian app highlights backlash against Chinese business 
2020-06-02, Australia's Zip taps US market with buyout of buy-now-pay-later peer QuadPay 
2020-06-02, Australia's Zip taps U.S. market with buyout of buy-now-pay-later peer 
2020-06-02, Geely's Polestar plans China showroom expansion to compete with Tesla -sources 
2020-06-02, (OFFICIAL)-UPDATE 1-SoftBank Vision Fund head's pay doubled last year despite massive losses 
2020-06-01, China's NetEase targets global expansion with $2.6 bln HK listing 
2020-05-31, Netease aims to raise $2-$3 billion in Hong Kong listing 
2020-05-30, Key dates in Hong Kong's anti-government protests 
2020-05-29, SoftBank Vision Fund head's pay doubled last year despite massive losses 
2020-05-29, Stick or twist? Investors face coronavirus-induced property dilemma 
2020-05-28," From Mr. Clean to Michelle Yeoh, how the travel industry plans to woo customers back "
2020-05-28, Wall Street Has Billions to Lose in China From Rising Strain 
2020-05-28," With M&A Hit, Wall Street Bankers Keep Busy With Stock Sales "
2020-05-28, Alibaba extends its reach in China as coronavirus outbreak opens doors 
2020-05-27, Wall Street frets as 'unloved' stock rally powers on 
2020-05-27, Shanghai Stock Exchange Mulls First Revamp of Benchmark in 30 Years 
2020-05-27, A Tech Billionaire May Find Use in a Cold War 
2020-05-26, Post-pandemic returns unlikely to match past decade's: CPPIB chief 
2020-05-26, Tencent to invest $70 billion in 'new infrastructure' 
2020-05-22, Posthaste: Don’t believe everything they're saying about the future after coronavirus 
2020-05-22, Wall Street ends mixed as China-U.S. tensions weigh 
2020-05-22, Wall Street ends mixed as China-U.S. tensions weigh 
2020-05-22, Wall Street mixed as China-U.S. tensions weigh 
2020-05-22," Wall St flat amid Sino-U.S. tensions, economic uncertainty "
2020-05-22, Hedge funds increased exposure to growth favorites in first quarter - Goldman 
2020-05-22, Wall St dips as U.S.-China tensions add to economic woes 
2020-05-22," Wall St dips on U.S.-China tensions, economic woes "
2020-05-22, Wall St set for muted open on simmering U.S.-China tensions 
2020-05-21, Baidu considers leaving the Nasdaq to boost its valuation - sources 
2020-05-21," India's Swiggy, Zomato start booze deliveries during COVID-19 lockdown "
2020-05-21, CanSino's 23% Stock Slump Shows Perils of Chasing Vaccine Hype 
2020-05-20," Stocks Drop Amid Rising China Tension, Job Losses: Markets Wrap "
2020-05-20, Alibaba to invest $1.4 bln in AI system for smart speakers 
2020-05-20, Alibaba group holding to invest 10 billion yuan in artificial intelligent system 
2020-05-19, Sony to take full control of listed financial arm for $3.7 bln 
2020-05-19, Sony to take full control of listed financial arm for $3.7 bln 
2020-05-19, Sony to turn financial arm into wholly owned unit for $3.7 bln -Nikkei 
2020-05-18, What Canada’s big pension plans were buying and selling in the first quarter of the COVID-19 market 
2020-05-18, Hong Kong's Hang Seng benchmark paves way to include Alibaba 
2020-05-18, Alibaba's Jack Ma resigns from SoftBank board 
2020-05-18, SoftBank proposes three new board members as Alibaba's Jack Ma resigns 
2020-05-18, Alibaba's Jack Ma resigns from SoftBank board 
2020-05-18, Alibaba's Jack Ma resigns from SoftBank board 
2020-05-15," Fake Uber, Twitter IPO Investor Admits $18 Million Fraud Scheme "
2020-05-13, Europe nears crisis plan for public stakes in key companies - sources 
2020-05-12, Sequoia-backed online grocer Dingdong valued at $2 bln in fundraising -sources 
2020-05-12," Sequoia-backed online grocer Dingdong raises $300 mln, valued at $2 bln -sources "
2020-05-10," China's Animal Crossing gamers use code words, middlemen to enter virtual world "
2020-05-10," China's Animal Crossing gamers use code words, middlemen to enter virtual world "
2020-05-06, The world is experiencing an eCommerce surge. Here's how newcomers can enter the market 
2020-05-06, Digital-friendly recession: How Big Tech got even bigger in the midst of a market meltdown 
2020-05-06, China's Alibaba launches 'outlet' platform to shift luxury overstock 
2020-05-04, Bad Start to May Is a Sign of Things to Come for Markets 
2020-05-04, Take Five: Trade winds to blow again? 
2020-05-04," China's binge shoppers turn thrifty as outbreak, sputtering economy force financial 'wake-up call' "
2020-05-03, The Next Frontier of Shopping Will Be Livestreamed 
2020-05-03, Indonesia's Tokopedia probes alleged data leak of 91 mln users 
2020-05-03, Indonesia's Tokopedia probes alleged data leak of 91 mln users 
2020-05-01, Take Five: Trade winds to blow again? 
2020-04-29, Amazon's foreign websites named in U.S. piracy and counterfeiting report 
2020-04-29, Amazon's foreign websites named in U.S. piracy and counterfeiting report 
2020-04-29, JD.com applies for $3 bln Hong Kong secondary listing -sources 
2020-04-29, JD.com applies for $3 bln Hong Kong secondary listing -sources 
2020-04-28, Chinese seen staying close to home for first major holiday since coronavirus 
2020-04-28, Alibaba Named by Gartner as Third Biggest Global Provider for IaaS and First in Asia Pacific 
2020-04-27, Alibaba demotes top executive after probe into behavior-source 
2020-04-25, India plans to fast track Chinese investments after policy change - sources 
2020-04-24, Facebook's big India deal portends a bruising time for SoftBank-backed Paytm 
2020-04-23, Zuckerberg Just Gave Asia's Richest Man a Sorely Needed Win 
2020-04-23, Chinese investors flummoxed by India's new foreign investment rules 
2020-04-23," For SoftBank's Son, coronavirus turns vision to illusion "
2020-04-23," For SoftBank's Son, coronavirus turns vision to illusion "
2020-04-22," Facebook invests $5.7 bln in Reliance unit, plans digital services for Indian grocers "
2020-04-22," Facebook invests $5.7 bln in Reliance unit, plans digital services for Indian grocers "
2020-04-22," Chinese e-commerce giants Alibaba, JD offer bookings for COVID-19 tests "
2020-04-22," Hong Kong flagship newspaper cuts management pay, puts staff on unpaid leave "
2020-04-22, Facebook invests $5.7 bln in Reliance unit to reach small Indian grocers 
2020-04-22, Facebook Seals Biggest Deal Since WhatsApp With Ambani 
2020-04-21," Equinix, Singapore fund GIC to invest in cloud data centers in Japan "
2020-04-21, Alibaba Cloud Joins Technology Committee of the Content Delivery and Security Association (CDSA) 
2020-04-20," Ruble, Peso Tumble in Tandem as Crude Glut Grows Amid Lockdowns "
2020-04-20, Alibaba Challenges Students to Create Solutions for a Post Covid-19 World 
2020-04-20, Alibaba to invest $28 bln in cloud services after coronavirus boosted demand 
2020-04-14, SoftBank record loss estimate renews asset sale focus 
2020-04-10, Indonesia leans on healthtech startups to cope with virus surge 
2020-04-09, Sony invests $400 million in Chinese video site Bilibili 
2020-04-03," New York reports deadliest day from coronavirus, makes plea for help "
2020-04-03, Investors look to China for a glimpse of life after coronavirus 
2020-04-01, China's War on Garbage Faces a Major Coronavirus Setback 
2020-04-01, EU industry chief sees no quid pro quo in Chinese firms' 'mask diplomacy' 
2020-04-01, EU industry chief sees no quid pro quo in Huawei's 'mask diplomacy' 
2020-04-01, EU trade chief sees no quid pro quo in Huawei's 'mask diplomacy' 
2020-04-01, China's Pinduoduo raises $1.1 bln in share placement amid volatile markets 
2020-04-01, Apple doubles China donations for COVID-19 recovery efforts 
2020-03-31," Ottawa orders made-in-Canada ventilators, surgical masks, COVID-19 tests in rush for supply "
2020-03-31, China's 'mini-IPO' reform takes on new virus urgency 
2020-03-31, China's Pinduoduo raises $1.1 bln in share placement amid volatile markets 
2020-03-30, What Private Banks Are Telling Clients About Asian Equities 
2020-03-29, Jack Ma Foundation and Alibaba Foundation Donate to Seven More Countries in Asia to Fight COVID-19 
2020-03-26, Multi-Lingual Support From the Global MediXchange of Combating COVID-19 (GMCC) Programme to Further Enable Sharing Among Medical Personnel Worldwide 
2020-03-25, SoftBank criticizes Moody's after 2-notch downgrade 
2020-03-25, India's Flipkart to resume e-commerce sales of essential products 
2020-03-25, India's Flipkart to resume e-commerce sales of essential products 
2020-03-25," Alibaba, Jack Ma send Russia medical equipment to fight virus outbreak "
2020-03-25, India's Flipkart and Amazon's Pantry halt services as lockdown obstructs online deliveries 
2020-03-25, Chinese consumers urged to splurge as economy begins path to normality 
2020-03-25, Walmart's Flipkart suspends services as India lockdown impedes online grocery deliveries 
2020-03-24, SoftBank's Son Is Betting on Himself After Go-Private Talks 
2020-03-24, First of Hong Kong's new online-only banks starts operating 
2020-03-24, SoftBank shares jump 20% on record buyback announcement 
2020-03-24," At Alibaba's Lazada, coronavirus measures become the latest culture conflict "
2020-03-23," At Alibaba's Lazada, coronavirus measures become the latest culture conflict "
2020-03-23, commerce companies face disruption as India locks down to curb coronavirus 
2020-03-23, CORRECTED (OFFICIAL)-How Alibaba's Freshippo adapted to keep delivering in virus-hit China 
2020-03-23, Tencent rolls out new health tracking code aimed at China's students 
2020-03-23, SoftBank plans $41 bln of asset sales to expand buyback and cut debt 
2020-03-23," Home work triggers demand jump for chips, laptops and network goods "
2020-03-23, How Alibaba's Freshippo adapted to keep delivering in virus-hit China 
2020-03-23," SoftBank to raise $41 bln to expand share buyback, cut debt "
2020-03-23," SoftBank to raise $41 bln to expand share buyback, cut debt "
2020-03-21, Jack Ma Foundation and Alibaba Foundation Donate Medical Supplies to 10 More Asian Nations 
2020-03-20, Tencent-backed Yuanfudao near to close new fundraising at $7.5 bln valuation- sources 
2020-03-19, Jack Ma Foundation and Alibaba Foundation Announce Donations to Four Southeast Asian Countries 
2020-03-19," Alibaba Cloud Offers AI, Cloud Services to Help Battle COVID-19 Globally "
2020-03-18," As China's coronavirus outbreak eases, a wary return to shops for consumers "
2020-03-18," As China's coronavirus outbreak eases, a wary return to shops for consumers "
2020-03-16, TransferWise taps into China market with Alipay partnership 
2020-03-16," China's coronavirus cases fall, with most infections coming from abroad "
2020-03-16," China sees fewer coronavirus cases, wary of international travelers "
2020-03-16, China's Didi launches delivery service after coronavirus hammers ride-hailing demand 
2020-03-16," Gambling limitations, elderly shopping hours; coronavirus changes business "
2020-03-16, JD.com hires banks for a Hong Kong listing as early as mid-year -sources 
2020-03-13," Jack Ma to donate test kits, masks to U.S. in fight against coronavirus "
2020-03-13," SoftBank unveils $4.8 bln buyback after stock tumble, Elliott backs move "
2020-03-13," SoftBank unveils $4.8 bln buyback after stock tumble, pressure from Elliott "
2020-03-11, Augmented reality company Magic Leap to explore sale - Bloomberg 
2020-03-10, Chinese Health Stocks Avoid Worst of Emerging-Market Virus Pain 
2020-03-10, Chinese farmers dodge coronavirus and go online for spring seeds and supplies 
2020-03-10, Alibaba's Alipay to open app to more services to take on Meituan 
2020-03-10, IKEA to sell through third party for first time on Tmall in China 
2020-03-10," IKEA tests selling through third party for the first time, on Tmall in China "
2020-03-05, China's Alibaba to offer $144 mln in subsidies as shopping suffers 
2020-03-04, China's Ant Financial buys small stake in Swedish fintech partner Klarna 
2020-03-04, Hong Kong stock exchange tells IPO hopefuls to detail impact of virus -sources 
2020-03-03, Alibaba's AliExpress warns of possible coronavirus delays 
2020-03-03, Alibaba's AliExpress warns of possible coronavirus delays 
2020-03-03, Alibaba's AliExpress warns of possible coronavirus delays 
2020-03-03, Alibaba's AliExpress warns customers of possible coronavirus delays 
2020-02-28, REUTERS NEWS SCHEDULE 11 a.m. GMT/6 a.m. ET. 
2020-02-26, New Chinese billionaires outpace U.S. by 3 to 1 - Hurun 
2020-02-26, Worried Chinese turn to online doctor consultations amid coronavirus outbreak 
2020-02-26, Worried Chinese turn to online doctor consultations amid coronavirus outbreak 
2020-02-25," Chinese consumers snap up yoga mats, video games, condoms as coronavirus keeps them at home "
2020-02-21, Outbreak will not change China's commitments to buy U.S. goods - senior U.S. official 
2020-02-20, Outbreak will not change China's commitments to buy U.S. goods -senior U.S. official 
2020-02-20, Outbreak will not change China's commitments to buy U.S. goods -senior U.S. official 
2020-02-20, Bill Gates-Led Fund Invests in Making Lithium Mining More Sustainable 
2020-02-19, Coronavirus poses risk to modest pickup in global growth -G20 draft communique 
2020-02-19, SoftBank to borrow $4.5 bln pledging domestic telco's shares 
2020-02-18, China's Economy Is Getting Back to Work After Virus Shutdowns 
2020-02-17, China seeks help of national tech giants to track coronavirus with QR codes 
2020-02-16," Fast-food companies in China step up 'contactless' pickup, delivery as coronavirus rages "
2020-02-14, Stocks End Week Higher Despite Virus Questions: Markets Wrap 
2020-02-13, Wall Street slips as coronavirus fears mount 
2020-02-13," S&P 500, Nasdaq turn positive amid mixed coronavirus news "
2020-02-13, REUTERS NEWS SCHEDULE AT 11:30 a.m. GMT/6:30 a.m. ET 
2020-02-13, REUTERS NEWS SCHEDULE AT 6 a.m. GMT/2 p.m. SGT 
2020-02-13, A stock and a hard place: SoftBank's $150 bln Alibaba warchest in spotlight 
2020-02-12, REUTERS NEWS SCHEDULE AT 10 p.m. GMT/6 a.m. SGT 
2020-02-12, A stock and a hard place: SoftBank's $150 bln Alibaba warchest in spotlight 
2020-02-12, SoftBank stock surges to seven-month high after judge OKs Sprint-T-Mobile merger 
2020-02-11, Hong Kong stocks tick up as new coronavirus cases drop 
2020-02-11, Hong Kong stocks tick up as new coronavirus cases drop 
2020-02-11, China stocks end higher for sixth day as new virus cases dip 
2020-02-10, Labs ramp up coronavirus testing as cases outside of China climb 
2020-02-10," Coronavirus cases outside China 'could be spark' for bigger fire, WHO says "
2020-02-10," Coronavirus cases outside China 'could be spark'' for bigger fire, WHO says "
2020-02-10," Coronavirus cases outside China 'could be spark' for bigger fire, says WHO "
2020-02-10," Coronavirus cases outside China 'could be spark' for bigger fire, says WHO "
2020-02-10, U.S. Stocks Hit Record Despite Coronavirus Fears: Markets Wrap 
2020-02-10, Alibaba offers $2.86 bln in loans to firms hit by coronavirus outbreak 
2020-02-10, Alibaba offers $2.86 bln in loans to firms hit by coronavirus outbreak 
2020-02-10, Alibaba offers $2.86 bln in loans to firms hit by coronavirus outbreak 
2020-02-08, Your Weekend Reading: The Toll Mounts 
2020-02-07, China virus forces white collar class to work from home 
2020-02-07, Ant Financial pauses credit rating service amid coronavirus outbreak 
2020-02-07, Hedge fund Elliott Management builds $3 bln stake in SoftBank-sources 
2020-02-06, Hedge fund Elliott Management builds stake in SoftBank-sources 
2020-02-06, China virus forces white collar class to work from home 
2020-02-05, Ingram Micro Commerce & Lifecycle Services Enables Ecommerce Growth in Canada 
2020-02-04," Millions in China banish virus blues with online games, video apps "
2020-01-27," From Chipmakers to Casinos, Virus Angst Is Far-Ranging in Stocks "
2020-01-27, How Traders Trapped by China Holidays Are Hedging the Virus Risk 
2020-01-27, China's Li pledges medical reinforcements as virus toll hits 81 
2020-01-27, China's Li pledges medical reinforcements as virus toll hits 81 
2020-01-27," China extends holiday, businesses shut as virus toll rises to 81 "
2020-01-27," In bid to curb virus, China firms tell staff to work from home even after holidays end "
2020-01-27," China extends holiday, businesses shut as virus toll rises to 81 "
2020-01-27," Firms in China extend holidays, ask staff to work from home as virus spreads "
2020-01-26," ‘Sell first, ask questions later’: Stocks tumble around the world as coronavirus spreads "
2020-01-24," U.S. to unveil crackdown on counterfeit, pirated e-commerce goods "
2020-01-23," China's mask makers cancel holidays, jack up wages as new virus spurs frenzied demand "
2020-01-23, China's latest virus outbreak exposes perils of exotic wildlife trade 
2020-01-23, Chinese listed companies ramp up virus efforts after president's call 
2020-01-22, Bank of America to hire 50 bankers for Asia dealmaking team in 2020 -sources 
2020-01-22, Bank of America to hire 50 bankers for Asia dealmaking team in 2020 - sources 
2020-01-21, Swedish tech start-up Bambuser gears up to expand livestream shopping 
2020-01-21, China virus scare sends shudder through European luxury goods sector 
2020-01-21, China virus scare sends shudder through European luxury goods sector 
2020-01-21, Uber sells Indian food delivery arm to Ant Financial-backed Zomato 
2020-01-21, Ant Financial-backed Zomato buys Uber's Indian food delivery arm 
2020-01-21, Alibaba Cloud Named First Public Cloud Vendor in the World to Obtain Trusted Partner Network (TPN) Certification 
2020-01-20, World's Biggest Producer of Plastic to Curtail Its Use 
2020-01-20, Tencent says to step up investment overseas and in smart retail 
2020-01-17, Wall Street's trillion-dollar club dwarfs Europe Inc 
2020-01-17, China's Ant aims for $200 bln price tag in private share sales - sources 
2020-01-16, Far Point to buy tax-free shopping firm Global Blue at $2.6 bln valuation 
2020-01-15, eSSENTIAL Accessibility Secures $16 Million in Growth Funding 
2020-01-14, Banks lobby Aramco for incentive fee after slim IPO pickings -sources 
2020-01-14, China to frame rules for online-only banks this year in boost to foreigners -sources 
2020-01-13, Banks lobby Aramco for incentive fee after slim IPO pickings -sources 
2020-01-13, Hong Kong applauds its financial prowess amid protests 
2020-01-13, Hong Kong leader says financial hub's strengths intact despite protests 
2020-01-13, Hong Kong leader says financial hub's strengths intact despite protests 
2020-01-10, China's Ctrip in talks with banks to follow Alibaba with HK listing - sources 
2020-01-10, China's Ctrip taps banks to follow Alibaba with HK listing - sources 
2020-01-10, China's Ctrip taps banks to follow Alibaba with HK listing - sources 
2020-01-09, Chinese internet firms falling behind on renewable energy goals - Greenpeace 
2020-01-09," Greenpeace Calls Out Alibaba, Tencent in First China Ranking "
2020-01-09, Chinese internet firms falling behind on renewable energy goals - Greenpeace 
2020-01-08, Saudi Aramco shares hit new low on US-Iran tensions; debt markets steady 
2020-01-08, Saudi Aramco falls on U.S.-Iran tensions; debt markets little changed 
2020-01-08," Justin Trudeau, Chrystia Freeland to skip Davos this year "
2020-01-08, Saudi Aramco falls on U.S.-Iran tensions; debt markets little changed 
2020-01-08, Saudi Aramco hits new low on U.S.-Iran tensions 
2020-01-08, Alibaba undercuts Amazon in Europe to woo wary brands 
2020-01-08, Alibaba undercuts Amazon in Europe to woo wary brands 
2020-01-07, REUTERS NEWS SCHEDULE AT 10 p.m. GMT /6:00 a.m. SGT 
2020-01-07, Facebook defies China headwinds with new ad sales push 
2020-01-06, Blacklisted Chinese firm Megvii cleared for $500 million Hong Kong IPO 
2020-01-02," Stocks hit record as rally enters new year, dollar rebounds "
2020-01-02," Stocks surge as rally enters new year, dollar rebounds "
2020-01-02," Stocks surge as rally enters year, dollar rebounds "
2019-12-31, Indonesia plans fixed fees for e-wallet transactions - sources 
2019-12-30, Owning IPOs Has Been Clunker of a Trade Amid Raging Bull Market 
2019-12-27," Flying Cars, Hyperloops and the Other 2020 Tech Predictions That Didn't Pan Out "
2019-12-25," Russia's Sberbank to remain Yandex partner, may adjust some projects - CEO Gref "
2019-12-23, Disruptive decade: Ten things the teen years brought world markets 
2019-12-23, SoftBank's $3 bln WeWork financing talks stall with Japan banks -sources 
2019-12-23, The best year financial markets have ever had? 
2019-12-23, China's Meituan vows improvements after delivery man kills supermarket worker 
2019-12-23, IPO Bankers Face Headwinds From Silicon Valley to Saudi Arabia 
2019-12-23, IPO Bankers Face Headwinds From Silicon Valley to Saudi Arabia 
2019-12-20, The best year financial markets have ever had? 
2019-12-20," Aramco, Alibaba rescue sluggish 2019 global ECM market "
2019-12-20," Mahjong, cartoons coming to Tesla car screens in China next year "
2019-12-19," Nvidia, Mellanox Technologies win EU approval for $6.8 bln deal "
2019-12-19, Alibaba Reshuffles Management as Ant Financial Names New CEO 
2019-12-19, CITIC poised to beat Goldman to become first China firm to lead Asia equity rankings 
2019-12-18," Nvidia touts chip deals with China's Alibaba, Baidu and Didi "
2019-12-18, Hong Kong exchange to slash IPO price-to-trading gap in 2020 - executive 
2019-12-17, Finance's final frontier? British watchdog probes data sharing 
2019-12-17," China, Hong Kong stocks rise on trade deal optimism, Wall-Street cheer "
2019-12-13, SoftBank's China strategy wobbles as key bets disappoint 
2019-12-13, SoftBank-backed Paytm to allot 2.6 mln shares in fundraising 
2019-12-12, Saudi Aramco hits Crown Prince's $2 trillion goal despite valuation doubts 
2019-12-12, Saudi Aramco shares briefly hit $2 trln before easing 
2019-12-12, Hong Kong's role in global finance remains intact despite months of protests: Fitch 
2019-12-11, The Wall Street bankers who burst Saudi Aramco's $2-trillion bubble 
2019-12-11, Saudi Aramco's winding road to an IPO 
2019-12-11, 'Vindication' - Saudi Arabia hails 10% debut jump in Aramco shares 
2019-12-11," Saudi Aramco overtakes Microsoft, Apple in debut to hit market value of $1.88 trillion "
2019-12-10, REUTERS NEWS SCHEDULE AT 11 a.m. GMT/6 a.m. ET 
2019-12-09, Saudi 2020 budget forecasts slight drop in spending as deficit widens 
2019-12-09, Global financial watchdogs take aim at Big Tech's data dominance amid creep into banking 
2019-12-09," Saudi energy minister talks OPEC+ unity, backs Aramco to soar "
2019-12-09, China's SenseTime expects $750 mln 2019 revenue despite U.S. ban -sources 
2019-12-08, Global financial watchdogs take aim at Big Tech's data dominance 
2019-12-07," Saudi energy minister talks OPEC+ unity, backs Aramco to soar "
2019-12-06," Saudi energy minister talks OPEC+ unity, backs Aramco to soar "
2019-12-06, Amazon websites could be added to USTR's 'Notorious Markets' list -WSJ 
2019-12-06, China's SenseTime expects $750 mln 2019 revenue despite U.S. ban -sources 
2019-12-06, China's SenseTime expects $750 mln 2019 revenue despite U.S. ban -sources 
2019-12-06, SoftBank's Son sticks with gut-led investing in chat with Alibaba's Ma 
2019-12-06, No Riyadh rush as many global investors steer clear of Aramco IPO 
2019-12-06, Oil slips as OPEC+ gears up to confirm supply cut 
2019-12-06, The Prince Got His World-Beating IPO. Now The Hard Work Begins 
2019-12-06, SoftBank's Son cleaves to gut-led investing in chat with Alibaba's Ma 
2019-12-06, Oil rises sharply this week as OPEC+ agrees on deeper output cuts 
