headlines,date
" Sphere 3D to Grow Its Bitcoin Mining Capacity to 32 Exahash Through the Purchase of 60,000 Numiner NM440 BTC Miners ",03-02-2022
 Meta's huge share price drop shakes world tech stocks ,03-02-2022
 Motion Picture Association - Canada Responds to Online Streaming Act ,03-02-2022
 Meta's huge share price drop shakes world tech stocks ,03-02-2022
 Meta's huge share price drop shakes world tech stocks ,03-02-2022
 Wall St futures tumble after Facebook sparks another tech rout ,03-02-2022
 Meta's shock share price drop shakes world tech ,03-02-2022
" New bill regulating online streaming puts Canadian-content requirements on platforms, not users ",03-02-2022
 Meta's shock share price drop shakes world tech ,03-02-2022
" ""Stay Alive (Prod. SUGA of BTS)"" Original Soundtrack for 7FATES: CHAKHO Is Coming Exclusively to WEBTOON ",03-02-2022
" Wall St poised for fourth straight gain on Alphabet, AMD results ",02-02-2022
" Wall St set for fourth day of gains on Alphabet, AMD results ",02-02-2022
 $20 a pop for Apple: CDRs open new avenue for Canadians to invest in U.S. stocks ,02-02-2022
" Hyper Hippo, Leading Idle Game Developer, Launches Dungeon Dwarves on Netflix ",01-02-2022
" AT&T opts for WarnerMedia spinoff in Discovery merger, cuts dividend ",01-02-2022
" AT&T to spin off WarnerMedia in $43-bln Discovery merger, cuts dividend ",01-02-2022
" AT&T to spin off WarnerMedia in $43-bln Discovery merger, cuts dividend ",01-02-2022
 AT&T to spin off WarnerMedia in $43 billion Discovery media merger ,01-02-2022
 AT&T to spin off WarnerMedia in $43 billion Discovery media merger ,01-02-2022
 AT&T to spin off WarnerMedia in $43 billion Discovery media merger ,01-02-2022
 HBO Max to launch in 15 European countries on March 8 ,01-02-2022
 Nasdaq gains avert worst January on record ,31-01-2022
 Wall Street swings higher on final day of volatile month ,31-01-2022
 Nasdaq up 2% on final day of volatile month ,31-01-2022
 Battered Nasdaq climbs at end of volatile month ,31-01-2022
 BrandGraph® 500 Year in Review Released: WhatsApp Ranks #1 for 2021 ,31-01-2022
 Enthusiast Gaming Announces Record 51.8 Million Monthly Unique Visitors in the United States ,31-01-2022
" Red-hot gaming market to breach $150 billion in deals, fundraising - report ",31-01-2022
 Wall St Week Ahead-Bargain hunters study stock valuations after big declines ,30-01-2022
 Netflix to produce Mattel's 'Masters of the Universe' movie ,28-01-2022
 Wall St Week Ahead-Bargain hunters study stock valuations after big declines ,28-01-2022
 S&P 500 ends lower after another wild ride ,27-01-2022
 The S&P ends lower after another roller-coaster session ,27-01-2022
" Wall St reverses again, wiping out early gains in afternoon plunge ",27-01-2022
 U.S. retail investors kept buying stocks on Fed day -analysts ,27-01-2022
" Wall St slips as chipmakers, Tesla weigh; Netflix jumps ",27-01-2022
" In a risky business, Wattpad leans on data to build 'not a traditional Hollywood studio' ",27-01-2022
 Wall Street firms 1% on boost from tech stocks ,27-01-2022
 3 reasons to buy Netflix after its recent 30 per cent plunge ,27-01-2022
 Tech stocks set to push Wall Street higher at open ,27-01-2022
 Futures little changed following Fed's hawkish stance ,27-01-2022
 ESE to Produce the First In-Person Esports Competition and TV Broadcast for the Regional Finals of Riot Games' Teamfight Tactics ,27-01-2022
" Germany's Bertelsmann to spend 500 mln euros/year on streaming, says CEO ",27-01-2022
 UBS steps into 'Gen Z' push with $1.4 bln Wealthfront buy ,27-01-2022
 Ackman's Pershing Square takes new position in Netflix ,27-01-2022
 Ackman's Pershing Square takes new position in Netflix ,26-01-2022
" ""Lil' Heroes"" NFT Collection From Spanish Artist Edgar Plans Reaches #1 Spot on OpenSea at Reveal ",26-01-2022
 Tom Segura and Christina P. Partner with Comedy Collectibles Startup Jambb to Bring Your Mom's House NFTs to Fans ,26-01-2022
 Digital 2022 Report Finds Social Media Users Now Equivalent to 58 Percent of the World's Total Population ,26-01-2022
 Wall Street ends down as markets whipsaw ahead of Fed meeting ,25-01-2022
 S&P 500 ends down as markets whipsaw ahead of Fed meeting ,25-01-2022
 Wall Street ends down as markets whipsaw ahead of Federal Reserve meeting ,25-01-2022
 DeepCell Industries Awarded Groundbreaking Patent for Prebiotic Cannabis Formulation ,25-01-2022
" Futures fall ahead of Fed meeting, corporate earnings ",25-01-2022
" Wall Street reverses, ends higher in late session rally ",24-01-2022
 Wall Street closes higher in late market reversal ,24-01-2022
" Stocks extend sell-off as Fed, geopolitical fears loom ",24-01-2022
 Futures slide as Ukraine tensions weigh at start of crucial week ,24-01-2022
" European stocks slump 2% on Ukraine risks, tech selloff ",24-01-2022
 Futures slide as Ukraine tensions dent mood at start of crucial week ,24-01-2022
" European equity sell-off deepens, telecom stocks shine ",24-01-2022
" Asia shares brace for hawkish Fed, wary of potential Ukraine conflict ",24-01-2022
" Asia shares brace for hawkish Fed, Ukraine tensions ",24-01-2022
" Asia shares tense as Fed looms, Ukraine a concern ",24-01-2022
" Retail Resolve, Credit Form a Stock Bull Case for Troubled Times ",23-01-2022
" Shopify plunges in 2022 tech wreck, losing title as Canada's biggest publicly traded company ",21-01-2022
 TSX tanks while Nasdaq extends fall to fourth day on Netflix letdown ,21-01-2022
 Bond yields tumble as Netflix fuels stock market sell-off ,21-01-2022
" S&P 500, Nasdaq post worst weeks since pandemic start as Netflix woes deepen slide ",21-01-2022
 Bond yields tumble as Netflix fuels stock market sell-off ,21-01-2022
 Canadian dollar gives back weekly gain on rising risk aversion ,21-01-2022
 Tech Earnings Jitters Mount as Pandemic Darlings Get Crushed ,21-01-2022
 Wall Street slide deepens after Netflix disappointment ,21-01-2022
 The Rooms Where It Happened in 2021: The year in federal lobbying ,21-01-2022
" Proactive news headlines including ANGLE, Trillion Energy, Biocept and Twitter ",21-01-2022
 Bond yields tumble as Netflix fuels stock market sell-off ,21-01-2022
 Pandemic darlings face the boot as investors eye return to normal life ,21-01-2022
 Nasdaq extends declines to fourth day on Netflix letdown ,21-01-2022
 Pandemic darlings face the boot as investors eye return to normal life ,21-01-2022
" Netflix, Peloton bring pandemic-stock era to shuddering halt as shares plunge ",21-01-2022
 Wall Street opens lower as Netflix disappoints ,21-01-2022
 Nasdaq set for lower open after disappointing Netflix forecast ,21-01-2022
 Pandemic darlings face the boot as investors eye return to normal life ,21-01-2022
 Nasdaq futures weaken after disappointing Netflix forecast ,21-01-2022
 Stocks tumble as disappointing earnings fan investor fears ,21-01-2022
 Netflix's modest growth forecast casts pall over streaming ,21-01-2022
" Stocks, FX hit by hawkish Fed bets; Geopolitics in focus ",21-01-2022
 Stocks tumble as disappointing earnings fan investor fears ,21-01-2022
" Asian markets fall after weak showing on Wall St, oil tumbles ",21-01-2022
" Asian markets fall after weak showing on Wall St, oil tumbles ",21-01-2022
 Netflix plunges after disappointing with forecast for new users ,20-01-2022
 Wall Street drops as bargain-hunting loses steam ,20-01-2022
 Bargain-hunting buoys Wall Street after Nasdaq correction ,20-01-2022
 FILMLOFT LAUNCHES NEW CANADIAN ANIMATED SERIES UPROOTED: THE PLANTEMIC ,20-01-2022
" Growth bargains, upbeat earnings boost Wall Street ",20-01-2022
" HISTORIC LAUNCH OF LIL HEROES NFT COLLECTION FROM EXILE CONTENT STUDIO, ARTIST EDGAR PLANS AND CURATIBLE ",20-01-2022
" Growth bargains, upbeat earnings take Wall Street higher ",20-01-2022
 Wall Street set to open higher after upbeat earnings ,20-01-2022
" Posthaste: Decades-high inflation 'seals the deal' for Bank of Canada rate hike in January, says BofA  ",20-01-2022
 Futures rise on earnings after Nasdaq enters correction territory ,20-01-2022
 Stock Rebound Gathers Pace as Bond Yields Decline: Markets Wrap ,20-01-2022
 Disney names Rebecca Campbell as international content group lead ,20-01-2022
 Disney names Rebecca Campbell as international content group lead ,19-01-2022
 Disney names Rebecca Campbell as international content group lead ,19-01-2022
 Disney names Rebecca Campbell as international content group lead ,19-01-2022
 Disney names Rebecca Campbell as new international content group lead ,19-01-2022
 Disney names Rebecca Campbell as new international content group lead ,19-01-2022
 Wall St rises on earnings boost; Big Tech bounces back ,19-01-2022
" Wall St set to open higher on earnings boost, Big Tech bounces back ",19-01-2022
" Futures gain as UnitedHealth, BofA rise on results ",19-01-2022
 Stocks Drop as Selloff Puts Nasdaq Into Correction: Markets Wrap ,19-01-2022
 Microsoft to gobble up Activision in $69 billion metaverse bet ,18-01-2022
 Microsoft to gobble up Activision in $69 billion metaverse bet ,18-01-2022
 Microsoft to gobble up Activision in $69 billion metaverse bet ,18-01-2022
 Wall St falls on tech drag; GS profit miss triggers bank selloff ,18-01-2022
 Microsoft to gobble up Activision in $69 billion metaverse bet ,18-01-2022
 Microsoft to gobble up Activision in $69 billion metaverse bet ,18-01-2022
 Wall St falls on tech drag; GS results trigger more bank declines ,18-01-2022
" Tech tumble, lackluster GS earnings set to weigh on Wall Street ",18-01-2022
 Connecting Communities: Rogers is bringing 100% Pure Fibre to New Brunswick   ,18-01-2022
 Nasdaq futures tumble as rising yields spark tech rout ,18-01-2022
 The algorithm is broken: Humans are still better than machines when it comes to the important stuff ,18-01-2022
 Stock Selloff Deepens as Treasury Yields Climb: Markets Wrap ,18-01-2022
 Britain freezes BBC funding as reviews TV license fee future ,17-01-2022
 European shares edge higher ahead of earnings; China adds stimulus ,17-01-2022
 European stocks gain ahead of earnings; China adds stimulus ,17-01-2022
" Take Five: U.S. bank earnings, BoJ and (another) virtual Davos ",17-01-2022
" Stocks mixed as Beijing adds stimulus, Brent tops 2021 high ",17-01-2022
" Asia weighs mixed China data, Brent clears 2021 highs ",17-01-2022
" Asia braces for China data, oil nears 2021 highs ",17-01-2022
 'Scream' Reboot Dethrones 'Spider-Man' at the Box Office ,16-01-2022
 Wall St Week Ahead-Earnings to test growth stocks after rocky start to year ,16-01-2022
" Netflix raises monthly subscription prices in U.S., Canada ",14-01-2022
 Netflix Raises Price of Standard U.S. Plan by $1.50 a Month ,14-01-2022
 'The Matrix' co-producer Village Roadshow considering strategic options - WSJ ,14-01-2022
 Wall St Week Ahead-Earnings to test growth stocks after rocky start to year ,14-01-2022
" Take Five: U.S. bank earnings, BoJ and (another) virtual Davos ",14-01-2022
" MINT DATE FOR ""LIL' HEROES"" NFT COLLECTION FROM EXILE CONTENT STUDIO, ARTIST EDGAR PLANS AND CURATIBLE IS THIS SUNDAY, JANUARY 16 ",13-01-2022
 Superstar DJ and Artist Steve Aoki Named World Poker Tour® Ambassador ,13-01-2022
 Futures gain after producer prices data eases rate hike fears ,13-01-2022
 Thunderbird Entertainment Appoints Jérôme Levy to the Board of Directors ,13-01-2022
 Futures muted ahead of data; Delta Air rises on strong earnings ,13-01-2022
 Fintech firm Checkout.com's valuation touches $40 bln after latest funding ,12-01-2022
 Blackstone-backed Candle Media acquires Faraway Road Productions ,11-01-2022
 Why modern managers are reviving old-school staff handbooks ,11-01-2022
" Box Office: 'Spider-Man: No Way Home' Rules Again, 'The 355' Misfires ",09-01-2022
" Rug-pull scams raked in over US$2.8 billion in crypto in 2021, report finds ",07-01-2022
 Canada needs fixing as the digital transformation takes hold ,07-01-2022
" S&P 500 ends choppy session nearly flat, a day after sell-off ",06-01-2022
" S&P 500, Nasdaq gain in choppy trading; cyclicals rise ",06-01-2022
 Wall St falls as tech stocks weaken on hawkish Fed minutes; cyclicals rise ,06-01-2022
" Wall St eyes mixed open as tech stocks still weak, banks rally ",06-01-2022
" Futures mixed as tech stocks still weak, banks rally ",06-01-2022
 HBO Max shows growth despite industry slowdown ,05-01-2022
" Coveo's Lavigueur and Têtu Canada's most successful tech leaders of 2021, subscribers say ",04-01-2022
" AMD Unveils New Ryzen Mobile Processors Uniting ""Zen 3+"" core with AMD RDNA 2 Graphics in Powerhouse Design ",04-01-2022
" S&P 500, Dow eye record open; Ford shines ",04-01-2022
 Cutting Edge and Blantyre Commit $125m to Acquire Film and TV Composer's Music Publishing Rights ,04-01-2022
 Futures extend positive start to the year ,04-01-2022
" Exile Content Studio Partners With Spanish Artist Edgar Plans and Curatible to Launch New Entertainment Franchise ""Lil' Heroes"" With Animated Children's Series Based on Lil' Heroes NFTs ",28-12-2021
 Asset bubbles? Champagne outfizzes Big Tech and bitcoin in 2021 ,24-12-2021
 Barry Choi: Overspent on the holidays? Things you can do right now to start saving money ,24-12-2021
 Amazon restores cloud services after power outage hits data center ,22-12-2021
" Sony, Zee lock India merger to create mega TV network ",22-12-2021
" Letter from the editor: What to read, watch and listen to over the holidays ",20-12-2021
" Meltwater wins four Comparably awards -- ""Best Company Culture"", ""Best CEO"", ""Best Company for Women"", and ""Best Company for Diversity"" ",17-12-2021
 Warner Music Group acquires label behind rapper Megan Thee Stallion ,16-12-2021
 Dialpad Raises $170 Million and Increases Valuation to $2.2 Billion as it Leads New Era of AI-Powered Communications ,16-12-2021
 Communications platform Dialpad valued at $2.2 bln after ICONIQ Capital-led funding ,16-12-2021
 Licence to trill: Apple TV+ plans documentary on James Bond soundtracks ,16-12-2021
 Amazon cloud unit recovers from brief outage affecting third-party services ,15-12-2021
 Wall Street falls ahead of Fed announcement ,15-12-2021
 Amazon's AWS recovers from brief outage affecting third-party services ,15-12-2021
" Amazon's AWS hit again, affecting third-party services ",15-12-2021
 Wall Street dips ahead of Fed announcement ,15-12-2021
 Wall St set for subdued open ahead of Fed announcement ,15-12-2021
 Futures inch lower ahead of Fed announcement ,15-12-2021
 YouTube says services fixed after disruption affects thousands ,14-12-2021
 YouTube down for thousands of users - Downdetector ,14-12-2021
" Inside 'Project Narsil,' a Canadian cannabis entrepreneur’s bid for porn giant MindGeek ",14-12-2021
 Firms that are family unfriendly risk losing talent ,14-12-2021
" Netflix slashes India prices in battle with Disney, Amazon ",14-12-2021
 Wall St set to open higher as Apple leads; Fed meeting awaited ,13-12-2021
 Futures edge higher as Apple leads; Fed meeting awaited ,13-12-2021
 Diane Francis: Melanie Joly has no business being foreign affairs minister ,10-12-2021
" Hobbit, Sauron and Gollum makeovers in New Zealand as Lord of the Rings turns 20 ",10-12-2021
 Outage shows how Amazon's complex cloud makes backup plans difficult ,09-12-2021
 Outage shows how Amazon's complex cloud makes backup plans difficult ,09-12-2021
 Academy Award Winner Benicio del Toro Partners With Exile Content Studio ,09-12-2021
 SUPERMAN & LOIS MAKES B.C. ECONOMY SOAR WITH OVER $95 MILLION SPENT ON FIRST SEASON ,09-12-2021
 Thunderbird Entertainment Announces Promotion of Matthew Berkowitz to President of Company ,09-12-2021
 Outage shows how Amazon's complex cloud makes backup plans difficult ,09-12-2021
" Dialpad Announces Dialpad for Good to Support Small Businesses, Underrepresented Founders and Nonprofit Organizations ",09-12-2021
 Apple nears $3 trillion in market value ,08-12-2021
 S.Korea 'webtoon' firms leverage low-cost stories with potential huge upside ,08-12-2021
" Amazon cloud outage hits major websites, streaming apps ",07-12-2021
" Amazon cloud outage hits major websites, streaming apps ",07-12-2021
 ViacomCBS teams up with 'Parasite' distributor to make Paramount+ Asia debut ,07-12-2021
 Rachel Smythe's WEBTOON Sensation Lore Olympus Reaches #1 on the New York Times Bestseller List ,07-12-2021
" ESE to Organize Esports Competition with Riot Games, the Ultraliga Teamfight Tactics Championship Arcane ",06-12-2021
 HOWLX Launches With Gaming Profits Generating Mechanisms ,04-12-2021
 Purpose and Drop Partner to Launch New Cryptocurrency Rewards ,03-12-2021
" Half of subscribers have invested in crypto, even as 80% say it's risky: Survey ",03-12-2021
" More minority faces in film, TV, music as audiences demand diversity ",02-12-2021
 Enthusiast Gaming Announces Return of Pocket Gamer Connects Live Global Event Series ,02-12-2021
 New Zealand's COVID-19 re-opening plans leave Maori feeling exposed ,02-12-2021
" Facebook's Meta Ticker Trades in Canada, Ignores U.S. Delay ",01-12-2021
 Wall St eyes dour open as Omicron worries grow after vaccine warning ,30-11-2021
 Futures slump on fresh Omicron worries after vaccine warning ,30-11-2021
 The switching generation: Why U.S. workers are quitting their jobs in record numbers ,30-11-2021
 Cathie Wood is backing up the truck on these 3 growth stocks -- should you? ,29-11-2021
 Stocks tumble on new coronavirus variant fear ,29-11-2021
" D. Telekom, Vodafone, others want U.S. tech giants to help fund network costs ",28-11-2021
 Wall St Week Ahead-COVID-19 fears reappear as a threat to market ,28-11-2021
 U.K. Finds Omicron Cases; S. Africa Mulls Response: Virus Update ,27-11-2021
 Wall St Week Ahead-COVID-19 fears reappear as a threat to market ,26-11-2021
 Wall St Week Ahead-COVID-19 fears reappear as a threat to market ,26-11-2021
" U.S., Canada Follow Europe on Africa Travel Ban: Virus Update ",26-11-2021
 Stocks tumble on new coronavirus variant fear ,26-11-2021
 Stocks tumble on new coronavirus variant fear ,26-11-2021
 Dow falls over 2% as new virus variant spooks investors ,26-11-2021
 Dow set for 2% fall on fears over new virus variant ,26-11-2021
 From cruise operators to airlines: 'Reopening' stocks tumble on variant fears ,26-11-2021
 New coronavirus variant fears knock 2% off Dow futures ,26-11-2021
 Russia investigates complaint against Netflix over LGBT content ,26-11-2021
 'We're right at this inflection point': Coveo looks to growth following $215-million IPO ,25-11-2021
" Own a slice of Apple, Microsoft — plus others — for $1 with fractional shares ",25-11-2021
 WOW! Unlimited Media Announces Record Quarterly EBITDA on Strong Revenue for the Third Quarter of 2021 ,25-11-2021
 Russia investigates Netflix after complaint over LGBT content ,25-11-2021
 Thunderbird Entertainment Group Reports on Q1 2022 Results ,24-11-2021
 Private Equity Propels Top ESG Hires Into 7-Digit Pay League ,24-11-2021
" Lights, camera.. anyone? Film studios can't get the crew ",24-11-2021
 Spain to force streaming platforms to air shows in regional languages ,23-11-2021
 Spotify launches 'Netflix Hub' on its app to attract fans ,23-11-2021
 Enthusiast Gaming Expands into League of Legends with Acquisition of U.GG ,23-11-2021
 Comcast considers moving some content to Peacock from Hulu - WSJ ,22-11-2021
 Netflix employee at the center of protests against Dave Chappelle resigns ,22-11-2021
 T. Rowe Joins Goldman in Betting on Battered China Property Debt ,22-11-2021
 Union group says U.S. should reject Amazon's plan to buy MGM ,22-11-2021
 Opening Remarks: Broadcasting Notice of Consultation CRTC 2021-281 – Application for Rogers Communications Inc. for Authority to Acquire Effective Control of Shaw Communications Inc. (Application No. 2021-0228-4) ,22-11-2021
 Opening Remarks: Broadcasting Notice of Consultation CRTC 2021-281 – Application for Rogers Communications Inc. for Authority to Acquire Effective Control of Shaw Communications Inc. (Application No. 2021-0228-4) ,22-11-2021
" Nasdaq ends atop 16,000 mark for the first time on tech strength ",19-11-2021
" Nasdaq closes above 16,000 for the first time; Dow down again ",19-11-2021
" Nasdaq hits fresh record peak, Dow declines again ",19-11-2021
" COVID fears weigh on Dow, S&P 500; Nasdaq hits record high ",19-11-2021
" Lockdown fears weigh on Dow, S&P 500; Nasdaq hits record high ",19-11-2021
 Nasdaq set for record open as economic concerns drive tech gains ,19-11-2021
" Wattpad WEBTOON Studios Announces WEBTOON Unscrolled, a new Graphic Novel Imprint for Leading Digital Comics from WEBTOON ",18-11-2021
 What rhymes with bitcoin and could leave you broke? If you said shiba inu you're getting warm... ,18-11-2021
 China Evergrande sells streaming platform stake at steep discount; S&P says default 'likely' ,18-11-2021
 China Evergrande sells entire stake in streaming platform HengTen to ease debt burden ,18-11-2021
 China Evergrande sells entire stake in streaming platform HengTen to ease debt burden ,18-11-2021
 China Evergrande sells entire stake in streaming platform HengTen for $273 mln ,18-11-2021
 Thunderbird Entertainment's Great Pacific Media Signs Director Brad Peyton and Renowned Futurist Michio Kaku to New Series If: Imagine the Impossible ,17-11-2021
 Latinx-led Production House Exile Content Studio Acquires Pioneering Latin American and Spanish-language Podcast Leader Dixo ,16-11-2021
 'Resurrections': Second-biggest cinema chain Cineworld nears pre-COVID sales ,15-11-2021
 Apple TV+ hopes to build on rivals' success with first Korean series ,15-11-2021
 Duke Ellington school delays naming theater after Dave Chappelle ,13-11-2021
 TPG Real Estate Acquires Leading Sound Stage Owner Cinespace Studios ,12-11-2021
" Theaters reopen, but Disney cautious on families returning to big screens ",12-11-2021
 You sold a successful business. How do you use your windfall? Maybe a dream trip? ,12-11-2021
 U.S. airlines and Amazon join push to reduce aircraft emissions ,10-11-2021
 CORRRECTION (OFFICIAL)-U.S. airlines and Amazon join push to reduce aircraft emissions ,10-11-2021
 Cathie Wood's ARK Invest cashes in on Roblox share surge ,10-11-2021
" Faang's Gains Are Nothing Special, Quant Study Says ",10-11-2021
 Shares in Sorrell's S4 slump on future investment plans ,10-11-2021
 ITV expects 2021 advertising revenue to hit record high ,10-11-2021
 Sorrell's S4 posts Q3 gross profit up 42% ,10-11-2021
 U.S. app that lets viewers sample 40 streaming services raises $7 million ,09-11-2021
 Eat Well Group Announces Anchor Investment into Industry Leading Media Platform Plant Based News ,09-11-2021
 Netflix to Roll Out TikTok-Like Short Clip Feature Aimed at Kids ,09-11-2021
 Mark Cuban-backed FiscalNote to go public via $1.3 bln SPAC deal ,08-11-2021
" Wall St books records, weekly gains on strong jobs report, Pfizer COVID-19 pill cheer ",05-11-2021
" S&P 500 books record on strong jobs report, Pfizer COVID-19 pill cheer ",05-11-2021
" S&P 500 hits record on strong jobs report, Pfizer COVID-19 pill cheer ",05-11-2021
" Wall St extends record rally on strong jobs report, Pfizer COVID-19 pill cheer ",05-11-2021
 Want to earn big returns without the shaky stock market? Try art ,04-11-2021
 Quebec AI champion Coveo files for IPO on TSX ,04-11-2021
 A Squid Game crypto scam plus Ubisoft backs blockchain-based gaming ,04-11-2021
 Blackstone-backed firm nears $3 billion deal for Moonbug Entertainment - sources ,03-11-2021
 Netflix rolls out mobile games to subscribers on Android ,02-11-2021
 Crypto coin riding Squid Game high craters after dizzying rally ,02-11-2021
 Sid Lee Announces Top 10 Community Brands on Its 2021 Belong Index ,02-11-2021
 Netflix removes spy drama episodes after Philippines' complaint over China map ,01-11-2021
" Squid Game Is Memecoin Warning With Wipeout After 230,000% Gain ",01-11-2021
" After Facebook change, Big Tech's FAANG considers toothless MAANG ",29-10-2021
 ANTLERS makes BC economy jump $16.7 million ,29-10-2021
 Software firm ClickUp valued at $4 bln in new funding round ,27-10-2021
 S.Korean bakes 'Squid Game'-themed Halloween dog treats ,27-10-2021
" Democrats Unveil a Corporate Minimum Tax, Eyeing $400 Billion ",26-10-2021
 Trudeau Hands Environment Ministry to Ex-Greenpeace Activist ,26-10-2021
 Comedian Dave Chappelle addresses Netflix transgender controversy in full for first time ,25-10-2021
 Game-changing innovations that are capturing investors' attention ,25-10-2021
 Thailand to regulate digital platform service businesses ,25-10-2021
" Take Five: ECB, FAANGs and China's bond conundrum ",25-10-2021
 'Squid Game' mania has shoppers snapping up Vans' white slip-on shoes ,22-10-2021
" S&P 500, Dow scale new peaks; Nasdaq hit by Facebook ",22-10-2021
 Nasdaq set for lower open after Intel's margin warning ,22-10-2021
 How Democrats Could Tax Companies More--Without Undoing Trump's Tax Cuts ,22-10-2021
" Equities ride tech to third week of gains, dollar dips ",22-10-2021
 Nasdaq futures edge lower after Intel's margin warning ,22-10-2021
" Take Five: ECB, FAANG and China's bond conundrum ",22-10-2021
" Equities eye third week of gains after tech boost, dollar dips ",22-10-2021
 High demand for 'Squid Game' tracksuits cheers S.Korea's struggling garment sector ,22-10-2021
" Equities eye third week of gains after tech boost, dollar dips ",22-10-2021
 Asia tech shares jump; China property stocks rally on Evergrande payment ,22-10-2021
" Asian tech shares jump, China property stocks rally as Evergrande makes payment ",22-10-2021
 No 'Squid Game': South Korea's real-life debt trap ,21-10-2021
