headlines,date
" S&P 500, Nasdaq slip as bond yields rise ",12-03-2021
 AT&T raises subscriber forecast for HBO Max as streaming booms ,12-03-2021
" S&P 500, Nasdaq fall as yields spike ",12-03-2021
" S&P 500, Nasdaq fall as yields spike ",12-03-2021
 Airtable eyes $5 bln valuation in new funding round -sources ,12-03-2021
" S&P 500, Nasdaq weighed down by spike in bond yields ",12-03-2021
 AT&T raises subscriber forecast for HBO Max as streaming booms ,12-03-2021
 Opinion: The new Broadcasting Act is about speech control over the internet ,12-03-2021
" S&P 500, Nasdaq set for lower open as bond yield spike pressures tech stocks ",12-03-2021
" S&P 500, Nasdaq set for lower open as bond yield spike pressures tech stocks ",12-03-2021
 AT&T raises subscriber adds forecast on HBO Max as streaming booms ,12-03-2021
 Nasdaq futures drop as spike in bond yields hurts tech stocks ,12-03-2021
 Nasdaq futures drop as spike in bond yields hurts tech stocks ,12-03-2021
 Nasdaq futures fall nearly 2% as bond yields spike ,12-03-2021
 Nasdaq futures fall nearly 2% as bond yields spike ,12-03-2021
 Nasdaq futures fall nearly 2% as bond yields spike ,12-03-2021
 Nasdaq futures fall nearly 2% as bond yields spike ,12-03-2021
 India child rights body asks Netflix to stop streaming 'Bombay Begums' ,12-03-2021
 Netflix tests feature that could limit password sharing ,12-03-2021
 Netflix testing a crackdown on password sharing - CNBC ,11-03-2021
 Dialpad Marks Ten Year Anniversary and One Year of Remote Work with Record Growth and Widespread Market Recognition ,11-03-2021
 Wall Street Is Rethinking the Treasury Threat to Big Tech Stocks ,11-03-2021
 Instacart Adds Slootman to Board; Signaling It May Go Public ,11-03-2021
 Argentina Is Torn Between Its Shale Dream and Climate Goals ,10-03-2021
 Disney+ Tops 100 Million Users in Unprecedented Growth Run ,09-03-2021
 WOW! Unlimited Media Strikes Deal to Develop New Animated Series Based on NY Times Best-selling Series Parasol Protectorate Mystery and Paranormal Romance Set in Steampunk Victorian London ,09-03-2021
 Indian non-profit challenges new content regulation rules for news media ,09-03-2021
 Nasdaq futures slide 2% on inflation jitters ,08-03-2021
 Nasdaq futures slide 2% on inflation jitters ,08-03-2021
 Nasdaq slump badly bruises Wall St's most loved stocks ,05-03-2021
" Bollywood, streaming giants on edge as Amazon gets flak for hurting religious beliefs in India ",05-03-2021
 Hopin Raises $400 Million to Scale Innovation for Hybrid Experiences ,04-03-2021
 India's Supreme Court says favors controls on video streaming services ,04-03-2021
 Oilsands aren't the weakest link: Lessons we learned during crude's year of near oblivion ,03-03-2021
 Netflix Debuts 'Fast Laughs' Clip Feature That Resembles TikTok ,03-03-2021
 'Next big leap': Netflix to offer 41 new shows to lure Indian viewers ,03-03-2021
 Liquid Media and Atari® Sign Distribution Deal ,03-03-2021
 Amazon issues rare apology in India after complaints that series hurt Hindu beliefs ,02-03-2021
 Women entrepreneurs feeling the pinch of second pandemic wave ,02-03-2021
 Amazon issues rare apology in India after complaints that series hurt Hindu beliefs ,02-03-2021
 Amazon Prime Video apologizes for offending Hindu beliefs in Indian political show ,02-03-2021
 Disney CEO says households without kids have boosted streaming success ,02-03-2021
" For manga's striving artists, success lurks online ",01-03-2021
" For manga's striving artists, success lurks online ",01-03-2021
 Casting Workbook Español Launched as Part of New Global Expansion Effort to Support Spanish Talent Worldwide ,26-02-2021
 U.S. Treasuries' selloff give European stocks an edge ,26-02-2021
 Futures fall as tech stocks slide again ,26-02-2021
 Futures fall as tech stocks slide again ,26-02-2021
 AT&T to sell minority stake in DirecTV to buyout firm TPG Capital ,26-02-2021
 AT&T to sell minority stake in DirecTV to buyout firm TPG Capital ,25-02-2021
 New Global Survey by Opus Research for SoundHound Inc. Reveals Business Leaders are Focused on Customized Voice Experiences ,25-02-2021
" Wall Street ends sharply lower, tech selloff weighs as bond yields climb ",25-02-2021
" Wall Street ends sharply lower, tech selloff weighs as bond yields climb ",25-02-2021
" India tightens regulatory grip on Facebook, WhatsApp with new rules ",25-02-2021
" Wall Street closes down, tech selloff drags as bond yields climb ",25-02-2021
" Wall Street closes down, tech selloff drags as bond yields climb ",25-02-2021
 Wall Street tumbles on tech selloff as bond yields climb ,25-02-2021
 Wall Street tumbles on tech selloff as bond yields climb ,25-02-2021
" RAIR Launches Decentralized Digital Rights Management Platform, Powering Digital Scarcity for Creators RAIR's new middleware encryption and 'digital watermark' lets anyone publish and distribute media while retaining full ownership and earnings ",25-02-2021
 Wall Street slides on tech selloff as bond yields rise ,25-02-2021
 Wall Street slides on tech selloff as bond yields rise ,25-02-2021
 Popcorn-on-demand: Belgian cinema chain gets creative amid pandemic ,25-02-2021
" India tightens regulatory grip on Facebook, WhatsApp with new rules ",25-02-2021
" Wall St edges lower as tech shares fall, bond yields rise ",25-02-2021
" Wall St edges lower as tech shares fall, bond yields rise ",25-02-2021
" Nasdaq, S&P set to open lower as tech shares fall amid rising bond yields ",25-02-2021
" Netflix to spend $500 mln more to line up original shows, movies in South Korea ",25-02-2021
" Stocks rise, bond yields too - despite central banker talk-down efforts ",25-02-2021
 Nasdaq futures slide 1% on tech sell-off; jobless claims in focus ,25-02-2021
 Nasdaq futures slide 1% on tech sell-off; jobless claims in focus ,25-02-2021
 India plans new social media controls after Twitter face-off ,24-02-2021
 Thunderbird Entertainment Group Reports on Second Quarter Fiscal Year 2021 Results ,24-02-2021
 Wall Street finishes up as Fed's Powell soothes inflation fears ,24-02-2021
 Wall Street finishes up as Fed's Powell soothes inflation fears ,24-02-2021
 Wall Street finish up as Fed's Powell soothes inflation fears ,24-02-2021
 Wall Street closes higher as Fed's Powell soothes inflation fears ,24-02-2021
 Next 'Star Wars' series to hit Disney streaming service in May ,24-02-2021
 Wall Street advances as Fed's Powell soothes inflation worries ,24-02-2021
 Wall Street advances as Fed's Powell soothes inflation worries ,24-02-2021
 Wall Street regains footing after Powell calms inflation jitters ,24-02-2021
 Wall Street regains footing after Powell calms inflation jitters ,24-02-2021
 India plans new social media controls after Twitter face-off ,24-02-2021
" Planet Ventures' Subsidiary, 1st11, Announces Equity Investment and Strategic Partnership with Final Level Brazil - Latin America's Number One Gaming and Entertainment Platform ",24-02-2021
" Tech selloff hits Nasdaq, Powell comments limit declines ",23-02-2021
" Tech selloff hits Nasdaq, Powell comments limit declines ",23-02-2021
" Slide in growth stocks pummel Nasdaq, Powell testimony underway ",23-02-2021
" Slide in growth stocks pummel Nasdaq, Powell testimony underway ",23-02-2021
 Top Amazon India executive questioned by police over video series ,23-02-2021
" Nasdaq, S&P 500 set to open lower ahead of Powell speech ",23-02-2021
" Nasdaq, S&P 500 set to open lower ahead of Powell speech ",23-02-2021
" Montréal's Coveo Announces Ray Wang, Brian Solis, Rachael Powell as Keynote Speakers at Relevance 360 on March 25 They join CEO Louis Têtu at The Future of Experience Is AI, a virtual event, to explore the importance of relevance in the experience economy ",23-02-2021
 Nasdaq futures deepen slide ahead of Powell speech ,23-02-2021
 Nasdaq futures deepen slide ahead of Powell speech ,23-02-2021
" 'X-Files', 'Lost' in Mickey's clubhouse as Disney+ Star lands in Europe, Canada ",23-02-2021
" Growth stocks push Nasdaq, S&P 500 lower as rising yields weigh ",22-02-2021
" Growth stocks push Nasdaq, S&P 500 lower as rising yields weigh ",22-02-2021
" Wall St falls as growth stocks slide; inflation concerns, rising yields weigh ",22-02-2021
" Wall St falls as growth stocks slide; inflation concerns, rising yields weigh ",22-02-2021
" Wall St set to fall at open on inflation concerns, rising yields ",22-02-2021
" Wall St set to fall at open on inflation concerns, rising yields ",22-02-2021
" Futures fall on concerns over rising yields, inflation expectations ",22-02-2021
" Futures fall on concerns over rising yields, inflation expectations ",22-02-2021
" Disney Adds R-Rated Movies, Biker Gangs in Europe Streaming Push ",22-02-2021
" Wall Street closes flat as cyclicals shine, big tech falls ",19-02-2021
" Wall Street close flat as cyclicals shine, big tech falls ",19-02-2021
" Wall Street little changed as cyclicals shine, big tech falls ",19-02-2021
 Wall Street supported by rise in cyclical stocks ,19-02-2021
 Wall Street supported by rise in cyclical stocks ,19-02-2021
 Wall Street supported by rise in cyclical stocks ,19-02-2021
 Wall Street supported by rise in cyclical stocks ,19-02-2021
 Experts urge heritage minister to speed up tech bill after Australian legislation ,19-02-2021
 Google adds Apple's TV app to latest Chromecast device ,18-02-2021
 Public Television Documentary Explores the Dying Experience Through the Perspective of Patients  ,16-02-2021
 Regé-Jean Page Receives an IMDb STARmeter Award ,16-02-2021
 Opinion: Child care isn't recovery’s big challenge ,16-02-2021
 Amazon to make TV streaming device in India ,16-02-2021
 TikTok's U.S. ad business roars back as Trump's threats recede ,16-02-2021
 Amazon to make TV streaming device in India ,16-02-2021
 Should mobile gamers consider upgrading to iPhone 12? ,12-02-2021
" Three-day work week, anyone? Report details ways pandemic may change labour markets ",12-02-2021
" HBO Max plans Latin America, Caribbean launch in June ",11-02-2021
 PBO says taxing services like Netflix could yield feds $1.3 billion ,10-02-2021
 Nasdaq closes higher; stimulus in focus ,09-02-2021
 Nasdaq sets another closing high amid stock rotation ,09-02-2021
 Nasdaq closes higher; stimulus in focus ,09-02-2021
 Stocks extend winning streak; stimulus in focus ,09-02-2021
" Dow, S&P 500 edge higher; stimulus in focus ",09-02-2021
" S&P 500, Dow set to snap six-day run; stimulus in focus ",09-02-2021
" S&P 500, Dow set to snap six-day run; stimulus in focus ",09-02-2021
" S&P 500, Dow ease from record highs; stimulus in focus ",09-02-2021
 Meet Nigerian Corruption Cop Lagarde Expects Will 'Rock' WTO ,08-02-2021
 Big Wall St investors chased tech during GameStop retail frenzy - BofA ,05-02-2021
 Netflix raises prices for Japanese customers ,04-02-2021
 Instagram removes hundreds of accounts tied to username hacking ,04-02-2021
 Instagram disables hundreds of accounts tied to hacking of 'OG' usernames ,04-02-2021
" BCE beats expectations, hikes dividend and commits $1 billion to 5G buildout ",04-02-2021
" As Jeff Bezos prepares for his second act, what comes next for Amazon? ",03-02-2021
" This Valentine's Day, Give the Gift of Learning to Love Even Better ",02-02-2021
 Elon Musk makes characteristically wild debut on a buzzy social app Clubhouse ,01-02-2021
 Lava for Good Podcasts and Stitcher Announce Partnership Focused on True Crime and Criminal Justice ,01-02-2021
" The state of big tech regulation in Canada, from privacy to tax policy ",30-01-2021
 Bertelsmann explores potential sale of French media group M6 - sources ,29-01-2021
 Wall St falls after J&J vaccine data; GameStop effect weighs ,29-01-2021
 Wall St falls after J&J vaccine data; GameStop effect weighs ,29-01-2021
" Wall St falls after J&J vaccine data, hedge fund-retail investor clash ",29-01-2021
" Wall St falls after J&J vaccine data, hedge fund-retail investor clash ",29-01-2021
 Wall St set to open lower after J&J vaccine data ,29-01-2021
 Wall St set to open lower after J&J vaccine data ,29-01-2021
 Wall St set to open lower after J&J vaccine data ,29-01-2021
 Wall St set to open lower after J&J vaccine data ,29-01-2021
 Bertelsmann explores potential sale of French media group M6 - sources ,29-01-2021
 Futures drop as short squeeze worries resurface ,29-01-2021
 Futures drop as short squeeze worries resurface ,29-01-2021
 Bertelsmann explores potential sale of French media group M6 - sources ,29-01-2021
" Wall St jumps on big-tech strength, short squeeze worries ease ",28-01-2021
" Wall St jumps on big-tech strength, short squeeze worries ease ",28-01-2021
" Wall St rises on big-tech strength, shrugs off bleak data ",28-01-2021
" Wall St rises on big-tech strength, shrugs off bleak data ",28-01-2021
 A Career in Volatility Prepared RBC's Amy Wu Silverman for This Market ,28-01-2021
" China's iQiyi to offer free movies, TV over holiday after Beijing's urging ",28-01-2021
 Stocks slump to worst day in three months in wake of Fed statement ,27-01-2021
 Stocks slump to worst day in three months in wake of Fed statement ,27-01-2021
" Stocks slump on short squeeze fallout, Boeing drop; Fed sits tight ",27-01-2021
" Dow, S&P 500 sink 1% on Boeing results, short squeeze ",27-01-2021
" Dow, S&P 500 sink 1% on Boeing results, short squeeze ",27-01-2021
 Bankrupt Blockbuster joins Reddit-inspired retail rally ,27-01-2021
" S&P, Dow slide after Boeing results; Nasdaq fall cushioned by Microsoft ",27-01-2021
" S&P, Dow slide after Boeing results; Nasdaq fall cushioned by Microsoft ",27-01-2021
" Wall St set to open lower with earnings underway, eyes on Fed ",27-01-2021
" Wall St set to open lower with earnings underway, eyes on Fed ",27-01-2021
" Futures fall with earnings underway, eyes on Fed ",27-01-2021
" Futures fall with earnings underway, eyes on Fed ",27-01-2021
 Silicon Valley venture capital firm TCV raises $4 bln for latest fund ,27-01-2021
" Stimulus jitters dent Wall St's early gains; Nasdaq, S&P at records ",25-01-2021
 Stimulus jitters dent Wall St's early gains; Nasdaq hits record ,25-01-2021
 Stimulus jitters dent Wall St's early gains; Nasdaq hits record ,25-01-2021
" S&P, Nasdaq back off early highs on stimulus jitters ",25-01-2021
" S&P, Nasdaq back off early highs on stimulus jitters ",25-01-2021
 Nasdaq rally cools as stimulus concerns resurface ,25-01-2021
 Nasdaq rally cools as stimulus concerns resurface ,25-01-2021
 Nasdaq scales new high ahead of big-tech earnings; cyclicals lag ,25-01-2021
 Nasdaq scales new high ahead of big-tech earnings; cyclicals lag ,25-01-2021
 Tech Megacaps Are Storming Back to Derail the Stock Rotation ,25-01-2021
 Revenge of Megacaps Hurts Investors Fading the Oligarchic Era ,25-01-2021
" Nasdaq futures jump, Merck keeps Dow, S&P 500 subdued ",25-01-2021
" Nasdaq futures jump, Merck keeps Dow, S&P 500 subdued ",25-01-2021
" Nasdaq futures jump, hopes grow for stimulus ",25-01-2021
" Nasdaq futures jump, hopes grow for stimulus ",25-01-2021
" U.S. corporate buybacks are on the rise, lifting investor hopes ",25-01-2021
" Hedge Funds Beef Up Tech Holdings Before Apple, Amazon Earnings ",23-01-2021
 Buyout firm TPG in lead for stake in AT&T's DirecTV -sources ,22-01-2021
 Wall St Week Ahead-Tech shares could retake market reins as earnings heat up ,22-01-2021
" Five ways to hedge your portfolio if you think this market has run too far, too fast ",22-01-2021
" S&P, Nasdaq close at record highs on optimism about Biden stimulus plan ",21-01-2021
" S&P, Nasdaq close at record highs on optimism about Biden stimulus plan ",21-01-2021
 Wall Street pauses at record highs after Biden inauguration ,21-01-2021
 Wall Street pauses at record highs after Biden bounce ,21-01-2021
 Wall Street pauses at record highs after Biden bounce ,21-01-2021
" Energy stocks drag down FTSE 100, IG Group slides ",21-01-2021
 Investors get their Biden bounce ,21-01-2021
" After layoffs, travel start-up TripActions is hiring and raises $155 mln ",21-01-2021
 Investors get their Biden bounce on ,21-01-2021
 Asian stocks climb to record highs on Biden stimulus hopes ,21-01-2021
 Asian stocks at record highs as Biden inauguration lifts stimulus hopes ,21-01-2021
 Asian stocks set for strong start after day of gains on Wall Street ,20-01-2021
" Wall Street closes at record highs as Netflix jumps, Biden inaugurated ",20-01-2021
 Asian Stocks to Gain After U.S. Hits Record High: Markets Wrap ,20-01-2021
" Wall Street closes at record highs as Netflix jumps, Biden inaugurated ",20-01-2021
" Wall Street sets record as Netflix jumps, Biden inaugurated ",20-01-2021
" S&P 500, Nasdaq scale highs as Netflix jumps, Biden inaugurated ",20-01-2021
" S&P 500, Nasdaq scale record highs as Netflix soars; Biden takes office ",20-01-2021
" S&P 500, Nasdaq scale record highs as Netflix soars; Biden takes office ",20-01-2021
" S&P 500, Nasdaq scale record highs as Netflix jumps; Biden takes office ",20-01-2021
" S&P 500, Nasdaq scale record highs as Netflix jumps; Biden takes office ",20-01-2021
 North American stock markets increase while loonie hits nearly three-year high ,20-01-2021
 Nasdaq hits record high at open as Netflix soars; Biden takes office ,20-01-2021
 Wall St set to open near record high as Biden takes office; Netflix soars ,20-01-2021
 Futures near record highs as Biden to take office; Netflix soars ,20-01-2021
 Stocks welcome Yellen's call to 'act big' on coronavirus spending ,20-01-2021
 Jack M. Mintz: Canada should retaliate against Biden's wrong-headed decision to cancel Keystone. Here's how ,20-01-2021
" Tech, luxury stocks drive European shares higher ",20-01-2021
 Shares rise after Yellen's call to `act big' on coronavirus spending ,20-01-2021
 Asian shares hit a record high after Yellen calls for big spending ,20-01-2021
" Stimulus plans fuel Biden trade, but Wall Street wonders if it can continue ",20-01-2021
 Asian shares hit a record high after Yellen calls for big spending ,20-01-2021
 UK's BBC must make tough decisions on spending - watchdog ,20-01-2021
 Wall St closes higher as Yellen backs more stimulus ,19-01-2021
 Wall St closes higher as Yellen backs more stimulus ,19-01-2021
 Stocks Rise to Record on Hope for New Aid Bill: Markets Wrap ,19-01-2021
 Netflix Hits Record After Subscribers Leap Past 200 Million ,19-01-2021
 Wall St closes higher as Yellen backs more stimulus ,19-01-2021
 Wall St closes higher as Yellen backs more stimulus ,19-01-2021
 Netflix beats estimates for paid subscriber additions ,19-01-2021
 Music Royalties Inc. Launches Private Placement Offering on DealSquare ,19-01-2021
 Charter Communications drops bid to end merger conditions early ,19-01-2021
 Posthaste: Toronto's vacancy rate has soared to a 50-year high — and rents are plunging ,19-01-2021
 ViacomCBS to launch streaming service Paramount+ in March ,19-01-2021
" Shares climb, dollar dips before Yellen speech; earnings in focus ",19-01-2021
 Futures rise ahead of Yellen speech; spotlight on earnings ,19-01-2021
 Futures rise ahead of Yellen speech; spotlight on earnings ,19-01-2021
" Shares climb ahead of Yellen speech, earnings in focus ",19-01-2021
 Earnings to the rescue? ,19-01-2021
" Shares climb on China's economic recovery, with earnings in focus ",19-01-2021
" Asia shares look to China for recovery lead, earnings in focus ",19-01-2021
" Asia shares look to China for recovery lead, earnings in focus ",19-01-2021
 Tech Stocks Rise With Small Caps; Treasuries Slip: Markets Wrap ,18-01-2021
" The Benford Company: Entertainment Mogul Vassal Benford Known for His Midas Touch - An Entrepreneur Who Created His Own 300 Million Dollar Niche in Entertainment Benford's Companies ( A full service multi-media entertainment company, Music, Film , 4D Technologies, Concert events, Estate and Sports Management) ""Pac Sports Entertainment"" and ""TBC Group Corporate Management both based in Los Angeles, represent famed super star boxer Manny Pacqiuo and Iconic legendary Blues artist BB King, his estate, and ""The BB King Music Companies."" The Benford Companies have generated over $400 million USD in revenue, currently with such companies as Universal, Warner Bros. ",18-01-2021
 S&P/TSX composite edges higher despite energy trending down on Keystone XL news ,18-01-2021
 Asia shares pare losses as China economy rebounds ,18-01-2021
 Asia shares pare losses as China GDP pips forecasts ,18-01-2021
" Asia shares step back, await China economic update ",18-01-2021
 Multinationals urge OECD to simplify cross-border tax plans ,14-01-2021
 Amazon takes on Netflix in India with cheaper mobile-only Prime Video plan ,13-01-2021
 Amazon’s removal of Parler shows cloud unit's rarely used power ,12-01-2021
 William Watson: Walking within the ropes ,12-01-2021
 Wall Street Visionaries Provide Chilling Views on Next Big Risk ,12-01-2021
 Thunderbird Entertainment Launches New Global Distribution and Consumer Products Division ,11-01-2021
 CRTC chairman questions CBC head over transparency amid broadcaster's online push ,11-01-2021
 'Wonder Woman 1984' Stays Atop Domestic Box Office ,10-01-2021
 'Wonder Woman 1984' Stays Atop Domestic Box Office ,10-01-2021
 ESG Investing Could Be Making the 'Bear Market for Humans' Worse ,10-01-2021
 Roku buys video-streaming app Quibi's content library ,08-01-2021
 Opinion: A wealth tax would pay for three days of Ottawa’s spending ,08-01-2021
 Mambu Raises €110 Million in Funding Round Led by TCV ,07-01-2021
 Netflix raises monthly charges for UK subscribers ,06-01-2021
 Britain names former Goldman banker Sharp as BBC chairman ,06-01-2021
 Britain to name former Goldman banker Sharp as BBC chairman ,06-01-2021
" Box Office: 'Wonder Woman 1984' Grabs $5.5 Million Domestically, Global Total Tops $118 Million ",03-01-2021
" Box Office: 'Wonder Woman 1984' Grabs $5.5 Million Domestically, Global Total Tops $118 Million ",03-01-2021
 Wall Street set to wind up pandemic year with gains ,31-12-2020
 Wall Street set to wind up pandemic year with gains ,31-12-2020
 Wall Street set to end pandemic year on strong note ,31-12-2020
 Wall Street set to end pandemic year on strong note ,31-12-2020
 Wall St set for a sedate start in last trading session of 2020 ,31-12-2020
 Wall St set for a sedate start in last trading session of 2020 ,31-12-2020
 A (markets) journal of the plague year ,31-12-2020
 Futures muted in the last trading session of 2020 ,31-12-2020
 Futures muted in the last trading session of 2020 ,31-12-2020
 Wall Street ends up on recovery expectation ,30-12-2020
 Wall Street ends up on recovery expectation ,30-12-2020
 Wall Street ends up on recovery expectation ,30-12-2020
 Wall Street edges higher on recovery outlook ,30-12-2020
 Wall Street edges higher on recovery outlook ,30-12-2020
 Amazon to acquire Wondery in podcast push ,30-12-2020
 Wall Street rises on hopes of vaccine-fueled recovery ,30-12-2020
 Wall Street rises on hopes of vaccine-fueled recovery ,30-12-2020
 Wall Street rises on hopes of vaccine-fueled recovery ,30-12-2020
 Wall Street rises on hopes of vaccine-fueled recovery ,30-12-2020
 Stock Pickers' Faang Addiction Delivers a Harsh Blow to Workers ,30-12-2020
 2020 Hindsight: Surviving COVID and Trudeau with opera and birdsong ,30-12-2020
 The Sanity List: 47 Discoveries That Have Been Getting Us Through ,29-12-2020
 Big tech bets and cryptocurrencies power 2020's top U.S. funds ,29-12-2020
 Wall St at record levels after Trump signs fiscal aid bill ,28-12-2020
 Wall St at record levels after Trump signs fiscal aid bill ,28-12-2020
 Big tech bets and cryptocurrencies power 2020's top U.S. funds ,28-12-2020
" David Clement: Happy Festivus, for the rest of us ",23-12-2020
 Tech Worker Turns Hobby Into a Startup Nearing Unicorn Status ,22-12-2020
 A (markets) journal of the plague year ,21-12-2020
" Box Office: 'Wonder Woman 1984' Sputters in China, Grosses $38.5 Million Overseas ",21-12-2020
" Box Office: 'Wonder Woman 1984' Sputters in China, Grosses $38.5 Million Overseas ",21-12-2020
 A (markets) journal of the plague year ,20-12-2020
 A (markets) journal of the plague year ,20-12-2020
 Mindful Media Introduces 11 Female Entrepreneurs Everyone Will Know in 2021 ,18-12-2020
 This year investors had their cake and ate it too. Will there be consequences in 2021? ,18-12-2020
 2020 Hindsight – Philip Cross: A year when Big Tech did better than Big Gov ,18-12-2020
 The secretive world of MindGeek: the Montreal-based company behind Pornhub and RedTube ,18-12-2020
" The Empires Strike Back: Disney, Comcast, AT&T set streaming battle ",18-12-2020
 WorldRemit Identifies Top 20 Migrant Moments of 2020 ,18-12-2020
 Roku to carry AT&T's HBO Max streaming service ,16-12-2020
" Netflix says outage in U.S., Canada, South America resolved ",15-12-2020
 Over 400 Brands From Over 45 Countries Named 'Brand of the Year' in 2020-2021 World Branding Awards ,15-12-2020
" Netflix streaming down for more than 1,000 users - Downdetector.com ",15-12-2020
 Netflix streaming down for several users - Downdetector.com ,15-12-2020
" S&P 500 ends down, Walt Disney weighs ",15-12-2020
" S&P 500 ends down, Walt Disney weighs ",14-12-2020
 Posthaste: Ownership in Canadian energy stocks hits 5-year low as domestic investor interest wanes ,14-12-2020
 European pay-TV company Sky adds Amazon Prime to its platform ,14-12-2020
 Wall St set to drop as stimulus doubts resurface ,11-12-2020
 Wall St set to drop as stimulus doubts resurface ,11-12-2020
 New Star Wars and Marvel shows underpin Disney's ambitious streaming targets ,11-12-2020
 Disney unveils flurry of new programming amid rapid streaming growth ,11-12-2020
