headlines,date
 ProSieben's $500 mln dating bet a turn-off for investors ,05-03-2020
" Apple, Netflix pull out of South by Southwest festival amid coronavirus outbreak ",05-03-2020
 Posthaste: How Russia dethroned OPEC as oil market's most dominant player — and wants to see oil lower for longer ,04-03-2020
 Posthaste: All a rate cut may do is turbocharge Canadian home prices and consumer debt ,03-03-2020
" Posthaste: Coronavirus will likely shave off 0.5% of Canadian GDP; 50bps BoC rate cut 'not impossible', analysts say ",02-03-2020
 REUTERS NEWS SCHEDULE AT 11 a.m. GMT/6 a.m. ET ,29-02-2020
 REUTERS NEWS SCHEDULE AT 2 p.m. SGT/6 a.m. GMT ,29-02-2020
 Is new Disney CEO Bob Chapek up to the task? ,27-02-2020
 Wall Street on firm footing after virus-driven selloff ,26-02-2020
 Posthaste: Don't leave it to Poloz — provinces may need to ramp up spending to stimulate sputtering economy ,26-02-2020
 Posthaste: Why B.C. is seen as one of the least attractive resource jurisdictions in Canada ,25-02-2020
 British fintech Revolut hits $5.5 billion valuation after funding round ,25-02-2020
 Your Evening Briefing ,24-02-2020
" Netflix to release 'Top 10' feature in push toward transparency, ease of search ",24-02-2020
 Posthaste: Add Teck's Frontier mine to the $100Bn worth of energy projects already shelved or rejected in Canada ,24-02-2020
 Green deal sprinkles stardust on European power stocks ,21-02-2020
 Missing inflation is no mystery — here are five ways investors can make it work for them ,20-02-2020
 Netflix CEO's new book to shed light on streaming giant's work culture ,19-02-2020
" Carole Cadwalladr, Who Exposed the Cambridge Analytica Scandal, to Speak at True North Festival ",19-02-2020
 Posthaste: Why the new mortgage stress test rules could not have come at a worse time for Canada's frothy housing market ,19-02-2020
 Posthaste: $850M worth of manufactured goods sit idle every day as rail stoppages continue ,18-02-2020
" 20 years after dot-com peak, tech dominance keeps investors on edge ",18-02-2020
 Regulators should allow RTL and ProSieben to merge - Rabe ,16-02-2020
 Shopify's Sweetheart Week Has It Encroaching on Market Stalwarts ,15-02-2020
 Mattel Climbs After Cost Cutting Lifts Profit Above Estimates ,14-02-2020
" Posthaste: Only one in 5 Canadians believe Teck's Frontier oilsands project will 'absolutely' get built, despite strong support ",12-02-2020
" Samsung unveils foldable Galaxy Z phone, Galaxy S with 5G ",11-02-2020
 Posthaste: Note to natural gas skeptics — it played a major role in curbing global carbon emissions last year ,11-02-2020
 William Watson: How Oscar winner Parasite undermines Canada's cultural protectionism theory ,11-02-2020
" Demand for streaming TV services remains strong, Nielsen survey suggests ",11-02-2020
 Posthaste: Why pipeline protests in Canada have taken an ugly turn and could disrupt the wider economy — at the worst possible time ,10-02-2020
" Upstart Neon wins top Oscars prize, Netflix falls short again ",10-02-2020
 REUTERS NEWS SCHEDULE AT 6 a.m. GMT/ 2 p.m. SGT ,10-02-2020
 REUTERS NEWS SCHEDULE AT 10 p.m. GMT/6 a.m. SGT ,09-02-2020
 Netflix heard the complaints: You can now turn off that annoying autoplay ,07-02-2020
 ViacomCBS to launch new streaming platform - source ,07-02-2020
 REUTERS NEWS SCHEDULE AT 6 a.m. GMT/2 p.m. SGT ,06-02-2020
 REUTERS NEWS SCHEDULE AT 10 p.m. GMT/6 a.m. SGT ,05-02-2020
 Jack M. Mintz: Liberals' fixation on class war doesn't make for good tax policy ,05-02-2020
 Disney's weapon against Netflix and Amazon in India: Hotstar ,05-02-2020
 UK government hints BBC license fee could be scrapped ,05-02-2020
 REUTERS NEWS SCHEDULE AT 11 a.m. GMT/6 a.m. ET ,05-02-2020
 REUTERS NEWS SCHEDULE AT 6 a.m. GMT/2 p.m. SGT ,05-02-2020
 UK to consult on decriminalizing BBC license fee evasion ,05-02-2020
 REUTERS NEWS SCHEDULE AT 10 p.m. GMT/6 a.m. SGT ,04-02-2020
 Posthaste: Canadian companies are hitting record levels of debt — and real estate firms are leading the way ,04-02-2020
 No longer niche: Oscar contenders embraced beyond the art house ,04-02-2020
 Broadcasting report proposes to wreck the internet with insane hubris and mad regulatory overreach ,04-02-2020
" Minister walks back talk of licensing media, but CRTC overhaul plan still has critics worried ",03-02-2020
" Apple's push into TV is 'failing to resonate' with consumers, analyst says ",03-02-2020
 Posthaste: Two Canadian pipelines with capacity of 1.3M bpd are back in the courts this week — perhaps for the last time ,03-02-2020
 ViacomCBS plans Latam push for streaming service Pluto TV ,03-02-2020
 How many people really are watching 'The Mandalorian'? Data firms offer numbers that Disney and Netflix won't ,03-02-2020
 REUTERS NEWS SCHEDULE AT 11 a.m. GMT/6 a.m. ET ,03-02-2020
 REUTERS NEWS SCHEDULE AT 6 a.m. GMT/2 p.m. SGT ,03-02-2020
 REUTERS NEWS SCHEDULE AT 10 p.m. GMT/6 a.m. SGT ,01-02-2020
 REUTERS NEWS SCHEDULE AT 11 a.m. GMT/6 a.m. ET ,01-02-2020
 REUTERS NEWS SCHEDULE AT 7 a.m. GMT/2 a.m. ET ,01-02-2020
 Hulu CEO Randy Freer steps down ,31-01-2020
 REUTERS NEWS SCHEDULE AT 10 p.m. GMT/6 a.m. SGT ,31-01-2020
 Adam Sandler to make four new movies for Netflix ,31-01-2020
 Netflix extends contract with Adam Sandler for 4 films ,31-01-2020
 Avast pulls plug on Jumpshot after data privacy scandal ,30-01-2020
 Avast pulls plug on Jumpshot after data privacy scandal ,30-01-2020
 Avast pulls plug on Jumpshot after data privacy scandal ,30-01-2020
" Facebook ekes out a beat on daily active users, sees its costs explode ",29-01-2020
" Canada panel urges taxes and domestic content rules for Netflix, other U.S. firms ",29-01-2020
" Canada panel urges taxes and domestic content rules for Netflix, other U.S. firms ",29-01-2020
 Posthaste: Canadian beer consumption fell 4% last year — the most since Prohibition. Blame millennials and cannabis ,29-01-2020
 REUTERS NEWS SCHEDULE AT 11 a.m. GMT/6 a.m. ET ,29-01-2020
 REUTERS NEWS SCHEDULE AT 6 a.m. GMT/1 a.m. ET ,29-01-2020
 Posthaste: Canadians are financially stressed but would switch to a lower paying job in a heartbeat for this one perk ,28-01-2020
 Services in spotlight after Apple stock market value hits $1.4 trillion ,28-01-2020
 Twitter says several NFL teams' accounts hacked ,27-01-2020
 Tubi to Exclusively Stream Robert Rodriguez's Latest Film and Docu-Series ,27-01-2020
 Posthaste: Canadian GDP likely contracted in Q4 and outlook does not look bright as coronavirus fears could crimp future growth ,27-01-2020
 Socially Conscious ETFs Have Some Baffling Holes ,27-01-2020
 Indian panel wants encryption broken in fight against child porn ,27-01-2020
 Take Five: When China sneezes ,27-01-2020
 Take Five: When China sneezes ,24-01-2020
" S&P 500 gains, Nasdaq hits new high as investors eye earnings, coronavirus ",23-01-2020
" S&P 500, Nasdaq end higher with Netflix ",23-01-2020
" Wall Street hit by coronavirus concerns, weak earnings ",23-01-2020
 Tech sector pushes the S&P 500 to slight gain ,22-01-2020
 Stocks edge up as China virus worries abate; oil drops ,22-01-2020
" S&P 500, Nasdaq hit record highs on IBM, chip power ",22-01-2020
" S&P 500, Nasdaq hit record highs on IBM, chip power ",22-01-2020
 Stocks tick up as China virus worries abate; oil drops ,22-01-2020
 Wall Street analysts buy into Netflix optimism amid Disney threat ,22-01-2020
" S&P 500, Nasdaq hit record on IBM, waning China virus fears ",22-01-2020
 Netflix Slides on Outlook for Greater Competitive Threats ,22-01-2020
" S&P 500, Nasdaq aim for record on IBM earnings, fading China virus fears ",22-01-2020
" Stocks shake off China virus worries, dollar stays strong ",22-01-2020
" Posthaste: Air Canada stock hit by the China virus, BoC's decision day, and Volkswagen's back in Canadian court ",22-01-2020
" S&P 500 aims for record open on IBM support, fading China virus fears ",22-01-2020
 Eurazeo hires banks for $2.2 bln sale of payments firm Planet -sources ,22-01-2020
 Why overtaxing Big Tech is such a bad idea ,22-01-2020
" Companies buy first-ever Super Bowl ads, hope to gain attention in streaming era ",22-01-2020
 REUTERS NEWS SCHEDULE AT 6 a.m. GMT/1 a.m. ET ,22-01-2020
" Netflix adds more paid subscribers than expected in fourth quarter, but growth slows in U.S., Canada ",21-01-2020
 REUTERS NEWS SCHEDULE AT 10 p.m. GMT /6:00 a.m. SGT ,21-01-2020
 Wall Street falls as China virus reaches the U.S. ,21-01-2020
 Wall Street loses ground as China virus spooks investors ,21-01-2020
 China virus outbreak impedes Wall Street rally; Netflix earnings on deck ,21-01-2020
 Italian court to wait until Feb. 1 to rule on Mediaset pan-European TV plan ,21-01-2020
" S&P 500 loses ground amid China virus outbreak, growth fears ",21-01-2020
" Disney+ to launch in UK, Western Europe earlier than planned ",21-01-2020
" Disney+ to launch in UK, Western Europe earlier than planned ",21-01-2020
" Disney moves up UK, Western Europe launch by a week ",21-01-2020
" BMO launching new suite of ESG ETFS, and some big-name companies didn't make the cut ",20-01-2020
 Stocks slump around the world on fears deadly virus in China could hit global growth ,20-01-2020
" Stocks stay near record highs; focus turns to central banks, earnings ",20-01-2020
" Stocks stay near record highs; focus turns to central banks, earnings ",20-01-2020
 Take Five: A week in central banking ,20-01-2020
" Feel good factor keeps world stocks near record highs, oil jumps ",20-01-2020
" Asia shares pause near high ground, oil jumps on Libya shutdown ",20-01-2020
" Asia shares camp on high ground, oil jumps on Libya shutdown ",20-01-2020
" Asia shares camp on high ground, oil up on Libya shutdown ",20-01-2020
 Dollar Trims Gain on French Tariff Deal; Oil Rises: Markets Wrap ,19-01-2020
" Wall St Week Ahead-With market at record highs, eyes on reports from chipmakers ",19-01-2020
 REUTERS NEWS SCHEDULE AT 7 a.m. GMT/2 a.m. ET ,18-01-2020
 REUTERS NEWS SCHEDULE AT 10 p.m. GMT /6:00 a.m. SGT ,17-01-2020
" Wall St Week Ahead-With market at record highs, eyes on reports from chipmakers ",17-01-2020
" Netflix opens Paris office, plans new French-language series ",17-01-2020
" Netflix opens Paris office, plans new French-language series ",17-01-2020
" Netflix opens new Paris office, plans 20 French-language series ",17-01-2020
 Wall Street's trillion-dollar club dwarfs Europe Inc ,17-01-2020
 Take Five: A week in central banking ,17-01-2020
" Comcast bets ads work on streaming TV, plans NBC Peacock debut for April ",17-01-2020
" Comcast bets ads work on streaming TV, plans Peacock debut for April ",16-01-2020
 Comcast's Peacock streaming service to offer free and $5- or $10-a-month options ,16-01-2020
" Comcast, late to the streaming party, to give details of NBC's Peacock service ",16-01-2020
" Moonstruck: Japanese billionaire's girlfriend entrants top 20,000 ",16-01-2020
 Interest rates have been a tailwind for investors for 40 years. Will this be the decade that changes? ,15-01-2020
 Disney+ App Outpaces Streaming Rivals With 41 Million Downloads ,14-01-2020
" Wall Street hits record, boosted by trade and earnings optimism ",13-01-2020
" Wall Street hits record, boosted by trade and earnings optimism ",13-01-2020
" Wall Street hits fresh record on trade, earnings optimism ",13-01-2020
" Wall Street nears record high on trade, earnings optimism ",13-01-2020
 REUTERS NEWS SCHEDULE AT 11 a.m. GMT/6 a.m. ET ,13-01-2020
 REUTERS NEWS SCHEDULE AT 6 a.m. GMT/ 1 a.m. ET ,13-01-2020
 Mediaset approves changes to keep pan-European TV plan afloat ,10-01-2020
" Meet Bell's new CEO — a likeable, blue-collar, hockey-loving sports nut at heart ",10-01-2020
 Mediaset approves changes to keep pan-European TV plan afloat ,10-01-2020
 Mediaset set to win shareholder approval on pan-European plan ,10-01-2020
 Big broadcasters in India warn new tariff rules could hit services ,10-01-2020
 Mediaset seeks shareholder approval to ease pan-European plan ,10-01-2020
 Brazil's Supreme Court overturns censorship of Netflix show ,09-01-2020
" Wall St hits record high on trade optimism, FAANG rally ",09-01-2020
" Murder, Mystery and Tea: Acorn Leads Anglophile Streaming Market ",08-01-2020
 Posthaste: New and old Canadians are flooding into these 10 towns as Toronto and Vancouver get pricey ,08-01-2020
" Alphabet, Amazon keep S&P afloat as Middle East tensions persist ",06-01-2020
" Alphabet, Amazon keep S&P afloat as Middle East tensions persist ",06-01-2020
 Amazon Fire TV crosses 40 mln active users globally ,06-01-2020
 Traditional studios take top film honors at Golden Globe awards ,06-01-2020
 REUTERS NEWS SCHEDULE AT 10 pm GMT/6 am SGT ,05-01-2020
 The Internet Is No Longer a Disruptive Technology ,02-01-2020
 REUTERS NEWS SCHEDULE AT 10 p.m. GMT/ 6 a.m. SGT ,01-01-2020
 REUTERS NEWS SCHEDULE AT 0600 GMT/0100 ET ,01-01-2020
" Aaron Wudrick: 14 things to keep the same in Canada — like FOI requests, taxi price wars and (lack of) question period decorum ",31-12-2019
 REUTERS NEWS SCHEDULE AT 11 a.m. GMT/6 a.m. ET ,31-12-2019
 REUTERS NEWS SCHEDULE AT 6 a.m. GMT/1 a.m. ET ,31-12-2019
 Crypto? Disney? Investment strategists offer top picks for the next decade ,31-12-2019
 REUTERS NEWS SCHEDULE AT 10 p.m. GMT/6 a.m SGT ,30-12-2019
 Netflix says 'Murder Mystery' its most popular U.S. release in 2019 ,30-12-2019
" S&P 500, Dow at record highs as year-end rally continues ",27-12-2019
 Wall Street at record highs as year-end rally continues ,27-12-2019
 Wall Street's festive rally pauses as investors await trade details ,27-12-2019
 Wall Street's festive rally pauses as investors await trade details ,27-12-2019
" Just as Canadians see smartphone bills head down, the cost of watching online content on them may be going up ",26-12-2019
 REUTERS NEWS SCHEDULE AT 6 a.m. GMT/1 a.m. ET ,25-12-2019
 REUTERS NEWS SCHEDULE AT 6 a.m. GMT/1 a.m. ET ,24-12-2019
 REUTERS NEWS SCHEDULE AT 10 p.m. GMT /6:00 a.m. SGT ,23-12-2019
 NBCUniversal's Xfinity TV to continue carrying Lions Gate's Starz ,23-12-2019
 S&P is the decade's runaway winner ,23-12-2019
 Disruptive decade: Ten things the teen years brought world markets ,23-12-2019
 The best year financial markets have ever had? ,23-12-2019
 REUTERS NEWS SCHEDULE AT 6 a.m. GMT/1 a.m. ET ,22-12-2019
 REUTERS NEWS SCHEDULE AT 10 p.m. GMT/6 a.m. SGT ,20-12-2019
 The best year financial markets have ever had? ,20-12-2019
 REUTERS NEWS SCHEDULE AT 11 a.m. GMT/6 a.m. ET ,20-12-2019
 REUTERS NEWS SCHEDULE AT 6 a.m. GMT/1 a.m. ET ,20-12-2019
 REUTERS NEWS SCHEDULE AT 10:00 p.m. GMT/06:00 a.m. SGT ,19-12-2019
" Wall Street holiday parties try dropping booze for bootcamps, smoothies ",18-12-2019
 Wall Street extends record-setting climb on upbeat economic data ,17-12-2019
 Wall Street sustains record-setting climb on upbeat economic data ,17-12-2019
 Upbeat economic data helps Wall Street hover near record levels ,17-12-2019
 Wall Street hovers near record levels supported by strong economic data ,17-12-2019
 Wall Street hovers near record levels; Boeing drags on Dow ,17-12-2019
 Lower cellphone bills to new online rights: What ministers' to-do lists say about the government’s innovation agenda ,17-12-2019
 Cineplex takeover makes sense as pressure from streamers mounts ,16-12-2019
 Netflix's Once-Secret Regional Data Shows Its Strength Overseas ,16-12-2019
 Netflix's Asia-Pacific business has biggest gains over the past three years ,16-12-2019
 Cineplex shares soar on $2.15 billion takeover offer from Cineworld ,16-12-2019
 Cineworld in Deal to Be North America's Top Cinema Operator ,16-12-2019
 Disney+ to debut late March in France in exclusive deal with Canal+ ,15-12-2019
 NBCUniversal CEO Steve Burke to step down next year ,13-12-2019
 NBCUniversal CEO Steve Burke to step down next year ,13-12-2019
 Disney+ mobile app records 22 mln downloads since launch -Apptopia ,11-12-2019
 Privacy commissioner warns of 'crisis' in our data protection laws ,10-12-2019
 Wall Street slips as tariff deadline closes in ,10-12-2019
 Streaming wars could cost Netflix 4 million U.S. subscribers in 2020 ,10-12-2019
 Wall Street flat as tariff deadline nears ,10-12-2019
 Wall Street treads water as tariff deadline nears ,10-12-2019
 Wall Street edges higher on tariff delay hopes ,10-12-2019
 Wall St rises on possible tariff delay hopes ,10-12-2019
" Wall St opens flat as Netflix, JPM losses overshadow trade hopes ",10-12-2019
 Wall St set to open higher on report of possible tariff delay ,10-12-2019
 Futures down with focus on tariff deadline ,10-12-2019
 Netflix could lose 4 million U.S. subscribers in 2020 -brokerage ,10-12-2019
 REUTERS NEWS SCHEDULE AT 11 a.m. GMT/6 a.m. ET ,10-12-2019
 REUTERS NEWS SCHEDULE AT 6 a.m. GMT/2 p.m. SGT ,10-12-2019
 REUTERS NEWS SCHEDULE AT 10 p.m. GMT/6 a.m. SGT ,09-12-2019
 Vivendi's Canal+ in talks with beIN Sports to show France's Ligue 1 soccer ,09-12-2019
 REUTERS NEWS SCHEDULE AT 6 a.m. ET/11 a.m. GMT ,07-12-2019
 REUTERS NEWS SCHEDULE AT 6 a.m. GMT/1 a.m. ET ,07-12-2019
 REUTERS NEWS SCHEDULE AT 10 p.m. GMT/6 a.m. SGT ,06-12-2019
" CBS, Viacom complete merger in a win for Shari Redstone ",04-12-2019
 Peloton says encouraged by some support despite Christmas ad criticism ,04-12-2019
 U.S. backlash over France's digital tax raises fears Canada could be in for a new round of tariffs ,04-12-2019
 Peloton Christmas ad tagged 'sexist' on social media ,04-12-2019
 Bosses of Mediaset and ProSieben hold 'constructive' talks - sources ,02-12-2019
 Beware the 'bezzle': Three likely sources of illusory wealth in the markets today ,29-11-2019
 Judge to rule on Vivendi request to halt Mediaset European TV plan ,29-11-2019
 Mediaset-Vivendi peace talks set to go to the wire - sources ,28-11-2019
" Zoho revamps document management, says Canadian data centre coming in 2020 ",26-11-2019
 Mediaset CEO upbeat on reaching accord with Vivendi ,25-11-2019
 Wall St set for higher open as trade deal hopes build ,25-11-2019
 Futures move higher as trade deal hopes rise ,25-11-2019
 REUTERS NEWS SCHEDULE AT 11 a.m. GMT/6 a.m. ET ,25-11-2019
 REUTERS NEWS SCHEDULE AT 6 a.m. GMT/2 p.m. SGT ,25-11-2019
 Vivendi ready to sell part of Mediaset stake at a loss to end legal row -sources ,21-11-2019
 Vivendi ready to sell part of Mediaset stake at a loss to end legal row -sources ,21-11-2019
 The cabinet ministers who matter most to the innovation economy ,21-11-2019
" How e-reading company Kobo is fighting Amazon, Apple and Google for your time ",21-11-2019
 Dedicated to making the world a better place ,21-11-2019
 Japan's Sony in talks to buy stake in India's Network18 Media -Bloomberg ,21-11-2019
" Arts, Sports & Entertainment Awards ",20-11-2019
" Mediaset, Vivendi struggling to clinch deal to end legal war - sources ",20-11-2019
" Now that Disney's a tech company, it needs to figure out how to tackle password thieves ",19-11-2019
" One week in, Netflix's stock is weathering Disney+ ",19-11-2019
" For Apple and Disney+, getting people to sign up isn't the hard part — it's getting them not to cancel ",18-11-2019
" Mediaset could raise ProSieben stake to 20%, doesn't plan tender offer ",15-11-2019
 KEW MEDIA GROUP Reports Third Quarter 2019 Financial Results ,15-11-2019
 ProSieben says merger with Mediaset wouldn't work ,14-11-2019
" Disney lifts Dow, S&P 500 to records while trade tensions cast shadow ",13-11-2019
 S&P wobbles on fresh trade uncertainty; Disney lifts Dow ,13-11-2019
 Wall St higher as Fed's Powell says economy in 'good shape' ,13-11-2019
 Disney+ is running more smoothly today — but not Netflix-level smoothly ,13-11-2019
" Disney+ streaming exceeds expectations with 10 million sign-ups, shares surge ",13-11-2019
 'A lightbulb went off': How streaming helped CanCon find a global audience — podcast ,13-11-2019
 S&P 500 ekes out gain after Trump trade remarks ,12-11-2019
" S&P 500, Nasdaq hold near record levels after Trump remarks ",12-11-2019
" S&P 500, Nasdaq hold at record levels after Trump remarks ",12-11-2019
" S&P 500, Nasdaq at record highs ahead of Trump speech ",12-11-2019
 Disney+ full of glitches on launch day as demand exceeds highest expectations ,12-11-2019
" Disney+ debut hit by tech glitches, company blames demand ",12-11-2019
 Mediaset could increase stake in ProSieben further -source ,12-11-2019
" In streaming wars, Disney reaches beyond kids and families ",12-11-2019
 Rugby World Cup and Love Island boost ITV's Q3 fortunes ,12-11-2019
 'Midway' Defeats 'Doctor Sleep' in Surprise Box Office Upset ,10-11-2019
 'Midway' Defeats 'Doctor Sleep' in Surprise Box Office Upset ,10-11-2019
 Five Things You Need to Know to Start Your Day ,06-11-2019
 Quebec AI startup Coveo surpasses $1-billion valuation mark after $227-million financing round ,06-11-2019
" Guidewire Congratulates 2019 Innovation Award Winners – Aviva Italy, CAA Insurance Company, Farm Bureau Mutual Insurance Company of Idaho, and FRIDAY ",05-11-2019
 AT&T to pay $60 mln in settlement for slowing cellphone data on unlimited plans ,05-11-2019
" How will Apple, Disney, AT&T and Netflix retain streaming subscribers? ",05-11-2019
" Apple TV+ meets streaming rivals on original shows, but lack of back catalog a big omission ",01-11-2019
 Bell bringing HBO Max streaming service content to Canada after signing long-term deal ,31-10-2019
 Via Transportation CEO Ramot Sees Big Money in Buses: STYT ,30-10-2019
 Terence Corcoran: TMX is a done deal. Here are five bad policies to worry about instead ,30-10-2019
 WhatsApp sues Israeli spyware company over digital spying exposed by U of T group ,30-10-2019
 HBO orders new 'Game of Thrones' series as it scraps another ,30-10-2019
 AT&T surprises with HBO Max price in battle against Disney and Netflix ,29-10-2019
" AT&T reveals date HBO Max will take on Disney, Netflix ",29-10-2019
" AT&T to reveal HBO Max pricing, details at WarnerMedia investor day ",29-10-2019
 French Banijay's Endemol takeover creates global TV production powerhouse ,26-10-2019
" Behind AT&T's plan to take on Netflix, Apple and Disney with HBO Max ",25-10-2019
 The streaming war is about to begin for real — what it means for consumers and the industry ,24-10-2019
 Disney+ to close in on Netflix with Verizon promotion ,22-10-2019
" Gojek CEO quits to join Indonesian cabinet, replacements named ",21-10-2019
 Futures flat as China data gloom overshadows upbeat earnings ,18-10-2019
" Shares slip on weak China growth, dollar suffers weekly mauling ",18-10-2019
" Asian shares slump after weak China GDP, pound retreats ",18-10-2019
 Netflix and Amazon face censorship threat in India -source ,18-10-2019
" Asian shares erase gains after weak China GDP, pound pulls back ",18-10-2019
 Asian stocks track Brexit deal cheer but China caution prevails ,18-10-2019
 WarnerMedia's HBO Max to stream films of 'Spirited Away' producer ,17-10-2019
" Stocks, sterling rise on long-awaited Brexit deal ",17-10-2019
" U.S. stocks gain on upbeat earnings, geopolitical news ",17-10-2019
" Stocks, sterling rise on long-awaited Brexit deal ",17-10-2019
" Wall Street edges higher on robust earnings, Brexit deal ",17-10-2019
" Wall Street higher on strong earnings, Brexit deal ",17-10-2019
" Wall Street advances on upbeat earnings, Brexit deal ",17-10-2019
" Stocks, sterling rise on long-awaited Brexit deal ",17-10-2019
" Wall Street moves higher on Brexit deal, robust earnings ",17-10-2019
 Posthaste: Some economists think IMF’s gloomy global forecast was too ‘optimistic’ ,17-10-2019
" Wall Street opens higher on Brexit deal, earnings cheer ",17-10-2019
 Europe's Brexit deal cheers dampened by familiar snags ,17-10-2019
" Wall St cheers Brexit deal; Netflix, Morgan Stanley results set positive mood ",17-10-2019
 Netflix and Amazon face censorship threat in India -source ,17-10-2019
" Futures rise on Brexit deal; Netflix, Morgan Stanley earnings adds to cheer ",17-10-2019
" Asian shares pause after 5-day rally, Brexit in focus ",17-10-2019
" Global shares lose steam on weak U.S. retail sales, Brexit in focus ",17-10-2019
 Netflix rebounds as subscriber numbers grow – but stiff competition is mere weeks away ,16-10-2019
 Wall Street slips as weak economic data offsets earnings strength ,16-10-2019
" S&P 500 dips as economic data, trade worries offset upbeat earnings ",16-10-2019
 Wall St inches lower as trade concerns linger ,16-10-2019
 Wall St flat as upbeat earnings offset trade worries ,16-10-2019
 Wall Street on edge after Hong Kong protests bill ,16-10-2019
 Hong Kong nerves keep Wall Street on edge ,16-10-2019
" Posthaste: New immigrants projected to make 680,000 home purchases over next five years ",16-10-2019
 Futures slip on renewed U.S-China trade war concerns ,16-10-2019
 Was this zoologist punished for telling school kids politically incorrect facts about polar bears? ,16-10-2019
 Wall Street soars after strong start to earnings season ,15-10-2019
 Wall St rises after upbeat start to earnings season ,15-10-2019
 Wall St headed higher on strong earnings start ,15-10-2019
 Futures rise as third-quarter earnings start on strong note ,15-10-2019
 Sanders unveils economic plan a day before U.S. Democratic debate ,14-10-2019
 Terence Corcoran: End job-killing corporate taxes and free the FAANGS! ,11-10-2019
 Tech stocks lift Wall St as reports brighten hopes of trade deal ,09-10-2019
 Wall St gets tech boost as reports bolster hopes of trade deal ,09-10-2019
 Tech stocks boost Wall St as reports bolster hopes of trade deal ,09-10-2019
 Posthaste: Canada slips — again — in latest ranking of world's most competitive economies ,09-10-2019
